index,attraction,location,blurb,url,description,tags
119,Ahsan Manzil (Pink Palace),"Dhaka, Bangladesh",This colorful palace is an oasis of calm amid the hustle and bustle of the Buringa riverfront.,https://www.atlasobscura.com/places/ahsan-manzil-pink-palace,"Ahsan Manzil is located in the Sadarghat area, a riverfront like no others.  The hustle and bustle of Sadarghat can be overwhelming, with boats carrying produce, laborers unloading boxes, and a wild variety of vehicles transporting the goods to their next destination. The streets are packed, the smells pungent, the colors vivid, and the sounds disorienting. In the mayhem that is Sadarghat, the Ahsan Manzil compound is a fenced-off oasis of unexpected peace and quiet. Built between 1859 and 1872, Ahsan Manzil served as the residence of the Nawab of Dhaka. These days, the palace is a reminder of Bangladesh’s colonial past. Its ostentatious Western architecture incorporates elements of Mughal design, a popular trend among the affluent and aristocratic elite of Dhaka in the 18th and 19th centuries. After being largely abandoned upon the Newab’s death, Ahsan Manzil was restored and turned into a museum in 1985. The building is dominated by a large dome that caps an octagonal room, and a wide staircase leading to an arched portal. Along the façade of the building are porticoes that offer expansive views of the Buringa River. Apart from its architecture, Ahsan Manzil is famous for its bright pink color.  Ahsan Manzil is located on the north bank of the Buringa River, about 650 feet east of Babubazar bridge, along Gabtoli Road.",pink domes palaces museums history architecture
120,Lakkatura Tea Garden,"Sylhet, Bangladesh",One of the largest and most scenic of Bangladesh's tea gardens.,https://www.atlasobscura.com/places/lakkatura-tea-garden,"Sylhet, in the northeast of Bangladesh, is renowned for the beauty of its tea gardens, and among the lot, Lakkatura is considered the most scenic. It is also one of the largest tea gardens in the country, covering a total of 3,200 acres. This estate was officially established in 1875, and it now produces an astounding 550 tons of tea each year. A number of dirt roads intersect the garden, some purpose-built to transport tea across and beyond the grounds. Others are simply part of a larger network of roads cutting through Lakkatura, taking visitors through hills of neatly manicured rows of tea plants. Following the latter set of roads takes you to several rural villages in and around Lakkatura estate, including makeshift villages where migrant workers live during the harvest. The British East India Company first introduced tea cultivation in Bangladesh in 1840, but it was only in 1857 that tea became a commercial occupation. In 2012, Bangladesh produced more than 70,000 tons of tea. In spite of its small size, the South Asian country is the 12th-largest tea producer in the world, employing more than 300,000 people. The industry is supervised by the Bangladesh Tea Board and the Bangladesh Tea Research Institute.  Lakkatura Tea Garden is a few minutes from the center of Sylhet. The easiest way to get to the estate is by CNG (a kind of autorickshaw used all over Bangladesh). Upon arrival at Lakkatura, you can either report to the main office, where you can hire a guide or listen to a lecture about the Lakkatura Tea Garden, or you can wander around the garden by yourself. It is not rare to come across newlyweds having their wedding pictures taken at the picturesque tea garden.",tea landscapes agriculture farms gardens plants
121,Lala Khal,"Lala Khal, Bangladesh",A beautiful stretch of Bangladeshi river known for its high quality sand is possibly more remarkable for its color changing water.,https://www.atlasobscura.com/places/lala-khal,"In the northeast corner of Bangladesh, at the border with India, the Himalayas stop. The Himalayas (Sanskrit for “abode of the snow”) dissolve into gentle slopes blanketed in shrubs of tea, and the snow, melted, flows into Bangladesh in the Shari-Goyain River. Just on the Bangladesh side, on the banks of the blue river, is an area called Lala Khal. Lala Khal is about 26 miles from Sylhet, the micropolitan capital of Sylhet Division, Bangladesh’s tea production epicenter. The locals have only recently started calling Sylhet a city; before, it was just a town. From there, the best way to get to Lala Khal is on a public bus. For 60 taka each (78 US cents), a bus destined for Jaflong drops off passengers all along the way, including at Sarighat, the gateway to Lala Khal. On the way, locals point out the growing hills: “India.” At Sarighat, between the highway and the river, stalls sell everything: biscuits, toothpaste, potato chips, and cigarettes. Lighters dangle from strings tied to the ceilings. In the early summer, pyramids of watermelons line the road, and red, juicy slices sit perched atop the piles, beckoning flies and buyers. Below, on the river, men sit smoking among summer fruits piled high in small boats. A few steps away from the bus stop, a concrete staircase descends to the riverbank, where a row of colorful boats, called “nokas” in Bengali, wait for visitors. The boat operators, called “nokawallahs,” flock to tourists and demand prices three times what might be considered fair. For a foreigner, an hour ride on a private boat, all the way to the border, should cost between 800 and 1000 taka (around 10 USD). The nokawallah starts the engine with oil from a water bottle, and the boat cruises past hearts carved into rocks and women doing laundry. Swimming boys splash and wave. After a while, the boat stops at the Lala Khal Tea Estate, where tea grows in winding rows and the laborers and their families live in a self-contained village. On the slope rising from the river, a sign warns against crossing into India. Several feet beyond, the India Border Guard keeps watch. Later in the year, at the height of monsoon season, the river will rise several feet. The riverbanks will become unrecognizable, and the water will turn murky and brown. But in the brutally hot early summer, the water is still cool and crystal blue. Floating there in the South Asian summer, it’s possible to forget fear and worry: on the way back to Sarighat, sitting on top of a noka canopy, the most beautiful setting sun in Bangladesh will dry your wet clothes.",rivers natural wonders water nature
122,Panam Nagar,"Sonargaon, Bangladesh",This historic textile city was abandoned after being ravaged by fire.,https://www.atlasobscura.com/places/panam-nagar,"In its heyday, Panam Nagar was home to a prosperous community of Hindu merchants that turned the medieval Bengali capital into a thriving textile trading hub in the 19th century. It’s no coincidence that the East India Company set up its permanent offices in Panam Nagar (Panam City), which was then the Bengali capital. Yet if textiles brought wealth to the town, they likely contributed to its downfall as well. Uncertainty surrounds the origins of the fire that razed much of the historic city to the ground, but the fact that such a large number of textiles were stored in the buildings here made the area a huge fire hazard. It is also not clear whether the Hindu community abandoned Panam Nagar before or after the rumor that the town was haunted began. What is known is that what’s left of Panam Nagar has been left derelict for decades, and locals have nicknamed it “Ghost City” and “City of the Dead.” Only 52 of the city’s original buildings are still standing. Most are two-story structures, standing one attached to the other along the main thoroughfare. The oldest of these buildings is said to date back to the 15th century, but most are from the 19th century. It is obvious that these were buildings made for affluent residents, judging from the colonial architecture, the thickness of the walls, and their endurance in spite of decades of neglect.  Panam Nagar is in Sonargaon, about 18 miles (30 km) southeast of Dhaka, along the Meghna River. It can be reached by bus from Gulistan Station in Dhaka, but this may take an inordinate amount of time due to traffic and frequent stops. Should you decide to take this option, the bus stop for Panam Nagar is Magrapara Crossing, from which a rickshaw can take you to Panam Nagar. The other option is to take a taxi from Dhaka to Panam Nagar and back. Depending on your negotiating skills, the whole affair can be very affordable. Due to the level of disrepair, it is ill-advised to enter some of the abandoned houses in Panam Nagar.",textiles fires industrial ghost towns abandoned history
123,Cox's Bazar Beach,"Cox's Bazar District, Bangladesh",One of the longest natural sand beaches in the world.,https://www.atlasobscura.com/places/coxs-bazar-beach,"Stretching a remarkable 75 miles in length, Cox’s Bazar Beach is one of the longest uninterrupted natural sand beaches in all of Bangladesh. Most of Cox’s Bazar is 660 feet wide at high tide, and 1,300 feet wide at low tide. This Bay of Bengal beach is quite unknown to the international beach-loving crowd. But Cox’s Bazar is one of the most visited destinations in Bangladesh. Along its 75 miles, different sections of Cox’s Bazar Beach have distinct names, usually referring to the flora and fauna in the area. Among the most popular sections are Laboni Beach, Humchari Beach, and Inani Beach, all doable on one-day trips from the town of Cox’s Bazar, where most accommodation is located. Further south is Teknaf Beach. In general, the further south you go, the bluer the ocean, and the smaller the crowd. If you stay near Cox’s Bazar town, brace yourself for throngs of people. This can be frustrating if you were expecting a deserted tropical beach, but it can a great opportunity to get closer to the Bangladeshi notion of a beach holiday. Founded in 1869, Cox’s Bazar is named after Captain Hiram Cox, superintendent of the British East India Company, which was stationed in Palongkee (the town’s former name). This is an anomaly in the subcontinent, where most colonial place names have been changed, and it is probably due to the positive effect of Captain Cox’s rehabilitation work with the Arakanese refugees.  The easiest and fastest of getting to Cox’s Bazar is by plane. There are daily flights to Dhaka and Chittagong. For those not afraid of sitting in the traffic for hours, buses are also available. There is not a huge supply of accommodation, but in and near Cox’s Bazar town there are both high-end and budget options, including a handful of eco-lodges. A couple of warnings. This is not Cancun or Pattaya. Local people are extremely friendly, but you have to remember that Bangladesh is a conservative Muslim country. The attire for both men and women should be modest, even while swimming. Once you go beyond Cox’s Bazar town, you will find few (if any) facilities. If venturing south, you should plan on being self-reliant. Be careful with quicksand, especially during low tide.",world's longest beaches natural wonders nature
124,National Assembly of Bangladesh,"Dhaka, Bangladesh",Ancient and modern architecture are joined in Louis Kahn's monument to democracy.,https://www.atlasobscura.com/places/national-assembly-of-bangladesh,"The masterpiece of American architect Louis Kahn, the National Assembly of Bangladesh (Jatiyo Sangshad Bhaban) is both graceful and monumental in its union of modern design with ancient references. Construction started in 1961, but it wasn’t completed until nine years after Kahn’s death in 1983. The project was interrupted by the country’s liberation war from Pakistan, which also transformed Kahn’s vision from an imposing government headquarters to a tribute to the proud new democracy of Bangladesh. It was built with concrete inlaid with white marble, giving it a simplicity that relates to the other buildings in the city and makes it resistant to the extreme Bengali desert climate. Private offices overlook the water and a man-made moat ripples between the main building and the rest of the complex. Kahn’s love of rationalism through geometry is everywhere, from the shapes and lines structuring the exterior to the interior corridors circling the main hall. The rooms glow with natural light let in by the geometric shapes, which also contribute to a natural interior environmental control system. The High Court of Bangladesh recently passed a decision to secure the preservation of Kahn’s original vision from any future alterations.",architectural oddities architecture
125,Star Mosque,"Dhaka, Bangladesh",A tiny mosque decorated with mosaics using an early form of recycling.,https://www.atlasobscura.com/places/star-mosque,"When the Star Mosque (or Tara Masjid in Bengali) in Dhaka was first built in the first half of the 19th century, the original Mughal design included a large dome in the center and two smaller ones on each side. Through the years, additions were built and the interior was decorated—changes that were met with criticism, as they subverted the architectural sensibilities of the Mughal style. Today, with the old design all but gone, the main appeal of the mosque is the striking mosaics decorating it. The artisans who created these patterns used a technique called Chinitikri, which uses broken shards of China porcelain as mosaic pieces. (Pieces of broken bottles were also used at times because colored ceramics were costly.) The size of the pieces varied from half an inch to 2.5 inches, and the preferred shapes were rhomboid and triangular. The mosque is now one of the few extant examples of an architectural work decorated with Chinitikri-style mosaics. Most notable is the Chinitikri blue star motif that gives the structure its popular name, Star Mosque. Hundreds of blue-colored stars adorn the white marble domes, and this star theme is echoed by the mosaics of flowers and rosettes found on the façade and the interior of the mosque.  As with most places in Dhaka, ask a CNG driver to take you there. The mosque is located in the Armanitola area of Old Dhaka.",recycling mosques mosaics art history architecture
126,Lalbagh Fort,"Dhaka, Bangladesh",The untimely death of a dignitary's daughter led to this fort being abandoned before it was ever finished.,https://www.atlasobscura.com/places/lalbagh-fort,"During the height of the Mughal Empire, in 1677, Prince Muhammad Azam commissioned the construction of Lalbagh Fort, but the project was never completed. Soon after construction began, Prince Muhammad Azam left Dhaka to join his father, Emperor Aurangzeb, in Delhi. He passed the job to complete the fort down to Shaista Khan, who continued to build it until his beloved daughter Pari Bibi died there in 1684. Shaista Khan, believing the fort was cursed, halted construction immediately, and it remains in its unfinished state today. The discontinuation of the project met with no objection from Prince Muhammad Azam who was, at the time, engaged to Pari Bibi. Three main sections of the fort are complete, namely the Mausoleum of Pari Bibi, Diwan-i-Aam (the Hall of Audience), and Quilla Mosque. The Mausoleum of Pari Bibi consists of a white marble room with the tomb in the center. Access to the room is restricted. The Hall of Audience, which used to be the residence of the Mughal governor, is a two-story building that now houses a museum showcasing Mughal items such as coins, paintings, carpets, and weapons. Quilla Mosque is a relatively small mosque with three elegant domes. These three structures are surrounded by manicured gardens, which also contain a bathing tank overgrown with vegetation. An intricate web of underground tunnels was also finished below Lalbagh Fort. In an episode of the Sepoy Revolution, in 1857, it is said that soldiers on both sides ventured into the tunnels and never resurfaced, adding to the mystery and intrigue that envelops the fort. To this day, rumors circulate that Lalbagh Fort is haunted.  Roads around Old Dhaka can be confusing. Narrow alleys and newly built multi-lane roads are equally congested, making navigation challenging. As there is no shortage of rickshaws in the area, this is the best way to reach Lalbagh Fort.",cursed places haunted forts abandoned architecture
127,Curzon Hall,"Dhaka, Bangladesh",The fight to make Bengali an official language started in this stunning university hall.,https://www.atlasobscura.com/places/curzon-hall,"In 1948, when Pakistan and Bangladesh were one country, the Constituent Assembly of Pakistan chose Urdu and English to be its official languages. This event occurred within the walls of this impressive Bangladesh university building and sparked the Bengali Language Movement, which advocated the use of Bengali as an official language. Because the government feared retaliation from the Bengali-speaking population, it banned public meetings and rallies. This didn’t stop students and activists at the University of Dhaka from organizing. In 1952, police killed a number of students demonstrating their support for the movement, which prompted countrywide unrest that subsequently claimed thousands of lives. Bengali was eventually granted the status of official language in 1956. Imbued in the Bengali Language Movement were the seeds of independence, which led to the Bangladesh Liberation War and the establishment of Bangladesh as an independent country in 1971. February 21 is now International Mother Language Day, a national holiday. Now, history and everyday life rub shoulders at Curzon Hall. Though originally built to house a town hall, it’s currently home to the Faculty of Science at the University of Dhaka. As in other universities, throngs of students hurry in and out of the building, while others chat in on its arched balconies. The building was named after Lord Curzon, Viceroy of India, who laid its foundations in 1904. Curzon Hall is an exquisite blend of European and Mughal architectural traditions and stands as one of the most beautiful buildings in Dhaka. There is free access to the garden in which Curzon Hall is located. The back of the building, which is where the dormitories can be found, is also worth visiting.",language universities politics history architecture
128,Columbo Sahib’s Tomb,"Dhaka, Bangladesh",Hidden under the thick tropical vegetation of a cemetery is the tomb of Columbo Sahib.,https://www.atlasobscura.com/places/columbo-sahib-s-tomb,"This tomb consists of a square base surmounted by an octagonal structure. Including the cupola, the structure is about three-stories tall. Inside the square base are three off-center tombs. Although there are no epitaphs, it can be assumed they belonged to members of Columbo Sahib’s immediate family. It’s unclear where Columbo Sahib (aka Colombo Saheb) is buried. The tomb is a composite of different architectural styles. The lower structure resembles a Mughal mosque, with four openings, one on each side. The beautifully elaborate upper section exhibits gothic features, and the upper cupola has a baroque flavor. These different styles blend seamlessly and are further enhanced by the overgrown vegetation that has become an integral part of the structure. Although this interplay produces a romantic sense of decay and slow disintegration, the tomb has become structurally unstable. The beauty of this tomb did not escape Johan Zoffany’s eye. The German artist captured a snapshot of 18th-century Dhaka in the painting “Nagapan Ghat,” where Columbo Sahib’s Tomb is easily recognizable on the banks of a river. Of all the tombs in Dhaka Christian Cemetery, that of Columbo Sahib is by far the largest and most striking. It is therefore all the more puzzling that little is known about Columbo Sahib. Bishop Reginald Heber (1783-1826) attempted to uncover the identity of Columbo Sahib, but only managed to discover that this mysterious person worked for “Company ka nuokur.” Information that Heber never managed to confirm. The first record of Dhaka Christian Cemetery comes from 16th-century documents. It was first established for European traders, soldiers, and administrators in Dhaka. So, it’s not surprising that many tombs belong to prominent members of the East India Company.  Dhaka Christian Cemetery can be easily found along Narinda Road by the banner on its main gate, which is usually locked. A firm knock on the gate will usually attract the attention of the guardian, who will grant visitors access to the burial grounds.",tombs burial places cemeteries history & culture
129,Dahala Khagrabari,"Panchagarh, Bangladesh",A piece of India inside a piece of Bangladesh inside a piece of India inside a piece of Bangladesh.,https://www.atlasobscura.com/places/dahalakhagrabari,"Dahala Khagrabari is a geopolitical anomaly. It’s a piece of India that until very recently was completely surrounded by a piece of Bangladesh, which itself was completely surrounded by India, which was again completely surrounded by Bangladesh. An enclave is a piece of one country’s territory which is entirely surrounded by another country’s territory, and the India-Bangladesh border was filled with them before 2015, when they were eliminated by a treaty between the two countries. A second-order enclave is an enclave inside an enclave, and the world has a handful of them. But in the history of the world there has only been one third-order enclave, an enclave inside of an enclave inside of an enclave. This is Dahala Khagrabari (#51), located in the Cooch Behar district of West Bengal, the border between India and Bangladesh. Just 2 acres in size, nobody ever lived inside this unique enclave, but it was owned by a Bangladeshi jute farmer who every morning, woke up in Bangladesh, walked over to India to farm his land, and returned home to Bangladesh at the end of the day. While some of the world’s most developed countries have at least one enclave and still function normally, the enclave situation of the India-Bangladesh border before 2015 was distinctly different. The border contained a whopping 198 enclaves, with over 50,000 people living in them. Since almost all of these enclaves were made up of farmland (and not cities), it can be inferred that tens of thousands of Indians and Bangladeshis had to regularly cross international borders just to acquire food, supplies and health care. But crossing one border is nothing compared to crossing two or three. If that same Bangladeshi jute farmer was working on the farm one day and wanted to walk to the nearest bus stop a half mile away, he would have to cross from his Indian farm into Bangladeshi territory, then cross back into India, and at last arrive back in another part of Bangladesh to reach the stop. That’s three border crossings in a half mile, just to board the bus in his home country. In an effort to fix this messy result of political border disputes, a July 2015 treaty eliminated all enclaves in India and Bangladesh by simply “erasing” all enclave border lines. Unfortunately, in many ways the border situation is just as chaotic as ever. Imagine living in an Indian enclave in Bangladesh, and suddenly hearing that, because of the treaty, you’re suddenly not living in India anymore, you’re living in Bangladesh. Right now many of the Indians and Bangladeshis who were previously living in enclaves are finding themselves in the wrong country. Update: This is no longer an enclave but part of Bangladesh since the 2015 treaty.",enclaves recursive places territorial dispute border crossings geographic oddities borders
130,Dhaka Shipyard,"Keraniganj, Bangladesh",The shipyards along the outskirts of the Bangladesh capital are a flurry dangerous boat breaking and rebuilding.,https://www.atlasobscura.com/places/dhaka-shipyard,"Towering near the banks of Buriganga River on the outskirts of Dhaka, the crude shipyards are a frighteningly dangerous if, fascinating, hive of industrial activity. While it is not the largest shipyard in the country (that honor belongs to the Chittagong Ship Breaking Yard), the Dhaka yard in the town of Keraniganj shares the seeming disregard for worker safety that can be found in simialr industrial sites around the country. The facilities, which employ around 15,000 workers at around $5 a day, work to both break down massive shipping vessels as well as create new ships from the parts. Workers can be seen torches and welding equipment to tears huge pieces of metal from the vessels, sans eye, hand, or face protection. Other workers will be found scaling the tall ships on ramshackle ladders or strolling along the high edges of the ship decks, the only thing to keep them from falling is their own balance. Injuries are common on the site, but the buzz of activity doesn’t stop. The ships being worked on are propped up on crude chalks creating the appearance that the river simply receded and left these hulks stranded on dry land. The space is tight so many of the boats are right up to small homes and other structures. This is clearly a worksite that is dangerous to its employees, and even more so to careless visitors. However local guides can be found who will assist anyone curious about the industrial dangers that still plague the world. On the Buriganga River, opposite Sadarghat (boat terminal)Coordinates for this place of frenzy are 23.701981°, 90.409969°",boats ships industrial
