index,attraction,location,blurb,url,description,tags
36,Zesco Cooling Tower,"Lusaka, Zambia",The abandoned tower is the last remnant of Lusaka's first major power plant.,https://www.atlasobscura.com/places/zesco-cooling-tower,"At first glance, many people assume the large cooling tower on the western side of the city is for a nuclear power plant. Although no longer operational, the cooling tower actually served a coal-fired power plant, and was the first major source of electrical power for the then-budding city of Lusaka, soon to be designated Zambia’s (then Northern Rhodesia’s) capital. The city of Lusaka was established in 1905 and named after the headman of the village where it was founded. By the early 1930s, the British authorities were looking to move the capital of Northern Rhodesia away from Livingstone, and Lusaka was a natural choice due to its central location and proximity to the railroads. Moving the capital to Lusaka meant the area needed a power station. The location of the power station was chosen for its easy access to the railroads (and therefore coal supply), the burgeoning industrial area, and the prevailing winds, which carried smoke and soot away from the plant. The power plant began operating in 1934. It was the first major power plant in Lusaka and the second in Zambia, after the power plant constructed in Ndola to support the copper mines. Today, over 90 percent of Zambia’s electricity is from hydroelectric power. The cooling tower and power plant ceased operation in 1970 and has not been used for power generation since. The cooling tower remains a looming landmark over the skyline of Lusaka, and stands as a representative of the engineering heritage in Zambia.  The cooling tower is located on the grounds of ZESCO's headquarters and cannot be accessed by the public. However, it can be seen from afar from a variety of locations. It stands directly behind the Levy Junction Shopping Mall.",coal energy power stations colonialism industrial abandoned
37,Stevenson Road,"Mbala, Zambia",This little-known colonial road helped determine the Zambia-Tanzania border.,https://www.atlasobscura.com/places/stevenson-road,"In the early days of European exploration and colonization in Africa, the only way to reach Lake Tanganyika, one of the African Great Lakes, was via an overland route from Dar Es Salaam to Ujiji. This was the route many explorers took to the lake, including David Livingstone and Henry Morgan Stanley. However, this route was controlled by the Muslim traders who dominated what would become the country of Tanzania. The control of the overland route by the Muslim traders had several impacts on the Europeans in the area. For the missionaries of the London Missionary Society, it meant they could easily be cut off from their missions on Lake Tanganyika, such as the Niamkolo mission on the southern end of the lake. For traders and others with commercial interests, it meant that the Muslim traders dominated the trade in the region, including the lucrative ivory trade and the trade of enslaved people. Creating an alternative route to the lake was, therefore, a viable option for both European traders and missionaries alike. James Stevenson, a Glasgow manufacturer and ardent supporter of African missions, hatched a plan to construct a road between the northern end of Lake Malawi (then Nyasa) and the southern end of Lake Tanganyika. This route was attractive for several options. People traveling via ship up the Shire River, along the length of Lake Nyasa, over the proposed Stevenson Road, and along the length of Lake Tanganyika could penetrate 1,400 miles into the continent’s interior with only 275 miles of overland travel. The relatively high plateau between the lakes was believed to be fairly free of the tsetse fly, making the use of draft animals possible, and the route would be over entirely British-claimed territory. Construction on the road eventually began in 1881 after a donation by Stevenson to the London Missionary Society, and the Society’s agreement to ship a small steamship (The SS Good News, the first steamship on Lake Tanganyika) via the Stevenson Road. Unfortunately, due to the difficulties of the terrain and the death of Stevenson in 1885, the Stevenson Road was in many parts more theoretical than an actual road. That did not, however, diminish its impact. Several missions and towns were eventually set up along the path of the road, such as Mambwe Mission, which helped to monitor and counter the slave trade in Africa. Other towns, such as Mbala and Fife, would be important during World War I. And when the German and British representatives at the “Scramble for Africa” were dividing the borders between themselves, the line between the eventual countries of Zambia and Tanzania was drawn parallel to, but just short of, the Stevenson Road.  The Stevenson Road today has largely been either replaced with modern tarmac road or bypassed. Some of the easiest portions of the intact road to see are near the Zambian town of Mbala. Approximately half a mile north of Mbala, there are well-preserved portions leading up to Cemetery Hill, and the along East-West road north of Lake Chila. A dirt road leading west out of Mbala to Isoko and then to the road's terminus in Kituta Bay on Lake Tanganyika is part of the original Stevenson Road. Further information about the road can be found at the Moto Moto Museum, about a mile outside Mbala.",slavery roads infrastructure history
38,Mbala Old Prison,"Mbala, Zambia",This old brick building has held everyone from prisoners of war to freedom fighters during its turbulent history.,https://www.atlasobscura.com/places/mbala-old-prison,"This abandoned red-brick building, known as the Mbala Old Prison, was built in 1912 by the British colonial administration back when Mbala (known then as Abercorn) was the seat of the colonial presence in Northern Rhodesia. It is now maintained as a historic building and a Zambian National Monument due to its long and poignant history. When World War I broke out in 1914, the Mbala prison was turned into a defense post for the Northern Rhodesia Police, which was the colonial military. The site was well-suited to repel German attacks over the nearby border from German East Africa (modern-day Tanzania). As the fighting progressed, the Old Prison was used to house German prisoners of war. When the war ended in 1918, the prison was then used to accommodate German Askaris—Africans drafted as soldiers to fight for the colonial powers—until they could be repatriated to their homelands. Later, prominent freedom fighters such as Simon Mwansa Kapwepwe, Zambia’s first vice president, were imprisoned here. Today the building stands empty and disused, preserved as a national monument and one of the oldest prisons in Zambia. Its duties as a prison have been taken over by the new Mbala Prison, located next door.  The prison can be viewed from the street at all times. Visitors interested in learning about the history of Mbala should visit the nearby Moto Moto Museum.",wwi prisons colonialism war history military history
39,'Broken Hill Man' Monument,"Kabwe, Zambia",The skull of an ancient hominid was discovered at this spot.,https://www.atlasobscura.com/places/broken-hill-man-monument,"On June 17th, 1921, a Swiss miner working in a lead mine in modern-day Zambia came across a mostly complete skull of an ancient human. Tom Zwigelaar was working in the Broken Hill mine in the modern-day city of Kabwe, when the country Zambia was still Northern Rhodesia. An English paleontologist, Arthur Smith Woodward, later assigned the skull as the type specimen for a new species of hominid he dubbed Homo rhodesiensis. This discovery established Broken Hill as an important center for the study of early humankind. In modern times, the skull has been dated to between 300,000 and 125,000 years old. The classification of the skull as Homo rhodesiensis has also largely been discarded, with the “Broken Hill Man,” as the remains became known, generally classified as Homo heidelbergensis. The skull itself currently resides in the Natural History Museum in London. Zambia, however, has made efforts to repatriate the fossil. In the meantime, a monument to the discovery of the Broken Hill Man has been erected on the grounds of the Civic Center in Kabwe. The plaque on the monument is written in both English and Bemba.  The monument is located on grounds of the Civic Center in Kabwe, Zambia. The Civic Center is on Freedom Way, east from the Big Tree and next to Tusker's. The Civic Center keeps normal business hours but the monument is best viewed from the always-accessible sidewalk in front of the center.",discovery skulls prehistoric monuments
40,Chilubula Mission,"Mporokoso, Zambia",The first Catholic Mission to the Bemba people of Zambia still stands.,https://www.atlasobscura.com/places/chilubula-mission,"Chilubula Mission was founded in 1899 by Father Joseph Dupont of the White Fathers Missionary Society. Prior to the arrival of Father Dupont, Paramount Chief Chitimukulu of the Bemba people of Northern Zambia (then Northern Rhodesia) was violently opposed to any missionaries operating in his territory. Father Dupont had first arrived at Mambwe Mission, to the north of Bemba territory, and worked to learn a great deal about Bemba culture and tradition. He was nicknamed “Moto Moto” (Fire Fire in Bemba), apparently due to his fondness for smoking a pipe. Eventually, some of the other Bemba chiefs allowed Father Dupont to start a mission at Chilubula, nearby modern-day Kasama. The mission itself includes a very large church, erected between 1899-1909, with huge Roman influence demonstrated by many Roman semicircular arches. It has been compared to a citadel because of its strength, and during the First World War served as a refuge to people fleeing the fighting between German and British forces. The site celebrates its founding by Father Dupont, with a marker identifying the location where he first pitched his tent at Chilubula under a Musashi tree, along with his dedication of the site. The Mission continues to serve the local people with a clinic on the site and St. Teresa Girl’s Secondary School. Father Dupont left Chilubula Mission in 1911 and eventually died in Tunisia in 1930. In 2000, his remains were moved and re-interred at Chilubula Mission. His grave is located inside the church to the left of the Sanctuary. Besides his legacy at Chilubula Mission, Father Dupont is also the namesake of the Moto Moto Museum located in Mbala, Zambia, which houses a very large ethnographic collection of Bemba artifacts.  To reach the Mission, head west from Kasama along the Kasama-Luwingu Road. After approximately 23km, turn right onto D20 (Mporokoso Road). Follow signs towards St. Theresa Girl's Secondary School and Chishimba Falls. After another 6km, turn left onto a dirt road that will lead you the directly to the Mission. The grounds of the Mission are accessible at all times, and the grave of Father Dupont is located inside the church. Besides services on Sunday, workers at the Mission should be able to let you inside to view the grave if you ask politely.",
41,Great Zimbabwe,"Masvingo, Zimbabwe","The largest prehistoric ruins south of the Sahara, once a powerful center of international trade.",https://www.atlasobscura.com/places/great-zimbabwe,"The ruins of this once-magnificent city are rich in historical significance, architectural wonders, and unsolved mysteries. Until fairly recently, the origin of Great Zimbabwe was a contentious issue among Western archeologists, most of whom initially refused to believe such an impressive and complex structure could be the work of native Africans. When Portuguese traders first described the massive city in the 16th century, the site was popularly believed to be one of the fabled cities built by the Queen of Sheba. Nineteenth-century archeologists posited that the city was of Egyptian or Phoenician origin. With reasoning characteristic of the racial attitudes that defined the era of Western colonization of Africa, the presence of indigenous artifacts in the city was regarded as evidence not of the original builders, but of the subsequent occupation. Attempts by Westerners to establish a non-African race as the city’s original designers resulted in the removal and destruction of numerous original artifacts and a devastating loss of archeological evidence. Despite this loss, objective findings by 20th-century archeologists eventually led to the conclusion that the city was indeed of African origin, though such findings were later repressed in attempts to undermine the African Nationalist movement. Today the builders are widely recognized to be ancestors of the Shona tribe, one of the region’s Bantu-speaking groups. The name “Zimbabwe” is said to have come from the phrase “dzimba dza mabwe” in the Karanga dialect, meaning roughly “houses of stone”. Great Zimbabwe is estimated to have been built between 1100 and 1450 AD, and its ruins span roughly 1,800 acres. The city, which may have housed anywhere from 12,000 to 18,000 residents in its prime, is divided into three distinct architectural groups known as the Hill Complex, the Valley Complex, and the Great Enclosure. The Great Enclosure bears the distinction of being the largest sub-Saharan prehistoric structure and boasts an 800-foot-long outer wall. These walls, which reach heights of 32 feet, were constructed entirely without the use of mortar; the granite used in the walls’ construction was split into blocks that fit together evenly and did not require the use of any kind of binding substance. Great Zimbabwe was once believed to be a hub of international trade, and artifacts recovered from the site were brought from as far away as China. Indigenous artifacts include eight large Zimbabwe birds carved from soapstone, which were believed to originally stand in the Eastern Enclosure of the Hill Complex. Though the identity of the city’s builders is no longer debated, many questions remain. The site, though well-positioned for trade, was not suited for the large-scale farming necessary to support the city’s population, and it is speculated that the depletion of natural resources played a role in its eventual abandonment. Despite researchers’ best guesses, however, the motivation behind the city’s initial construction and its later abandonment by the original inhabitants remains a mystery. The purpose of some of the city’s more prominent structures, such as the Conical Tower, also remains unknown.  The site is approximately half an hour from Masvingo by road. Access is possible via local minibus, as well as scheduled and chartered bus services. Masvingo is approximately five hours from Harare and three from Bulawayo.",racism cities indigenous archaeology ruins history & culture
42,Chinhoyi Caves,"Chinhoyi, Zimbabwe",The stunningly blue waters of these beautiful caves also have a violent past.,https://www.atlasobscura.com/places/chinhoyi-caves,"Chinhoyi Caves National Park is a hidden gem not far from Zimbabwe’s capital Harare. Visitors to the park will find stunningly blue pools inside preserved limestone and dolomite caves. Inside the caves, the air becomes cool and damp and silence descends as one walks down to the water. Holes in the roof of the cave usher in sunlight that illuminates its depths. One of the best parts of visiting the caves is that you’re likely to have them to yourself to enjoy in subterranean silence. What visitors can see is only the tip of the iceberg. The caves continue incredibly far underground in a complex limestone formation. The water is so clear and constant in temperature that scuba teams have descended to depths of more than 300 feet (100 meters). They have discovered subterranean passages linking the various pools. How deep these caves venture is still a mystery. Although serene, there is a bit of violent history surrounding the caves. In the early 1800s, as the story goes, an aggressive tribe swept into the region and murdered many local people. Their bodies were then tossed into the cave. The traditional name of the caves, Chirorodziva or “Pool of the Fallen” commemorates this event.  Camping is possible in the small national park, but if you are a day visitor, note that you will only be allowed in during daylight hours (about 8 a.m.-5 p.m.). The entrance fee was about 8 U.S. dollars in 2018. Going to the deepest part of each cave is highly recommended, as each has a different feel.",national parks caves natural wonders ecosystems nature history & culture
43,Balancing Rocks of the Zimbabwe Dollar,"Harare, Zimbabwe","These naturally balancing rocks were pictured on every Zimbabwean banknote, up to the 100 trillion-dollar note.",https://www.atlasobscura.com/places/balancing-rocks-of-the-zimbabwe-dollar,"These three balancing rocks were once the main design motif of one of the highest of the high denomination currencies in the world, the Zimbabwean dollar. Every note issued by Zimbabwe’s Central Bank—from the one-dollar note issued after independence in 1980 to the 100 trillion-dollar banknote (100,000,000,000,000) issued in the hyper-inflationary zenith of 2008, has pictured these three stones. The image of the stones was chosen as a conjoined metaphor for development and environmental protection following the country’s independence from white-ruled Rhodesia. The rocks themselves can be found in a national park with an abandoned feel in Epworth, a suburb in the thinly signposted outskirts of Harare. The stones pictured on the banknotes are the most iconic example of this peculiar geological feature found in many places throughout Zimbabwe: rocks formations naturally situated in perfect balance. Matopos itself is well worth seeking out. Once inside, visitors can either walk or drive around the Stone Age rock formations with evocative names like the “Giant’s Playground” and “Flying Boat.” Even rocks with no honorific convey a silent magnitude. Outside the park, some enterprising residents have built their homes among the giant boulders that pock all of Epworth. The Zimbabwean dollar, however, is no more. The government effectively abandoned its currency and was de-monetised entirely in 2015. Now, the notes can be found on eBay, on the back of playing cards, in the hands of hawkers trying to sell the dead currency to tourists visiting Zimbabwe, or as props for cautionary tales of the dangers of runaway inflation, devaluations, and mercurial government economic policy. Nowadays, Zimbabwe has a multi-currency system. Money from almost every continent in the world is legal tender: the Aussie dollar, the British pound, the Botswanan pula, the Chinese Yuan, the Euro, the Indian Rupee, the Japanese yen, the South African rand. However, the most predominant note in circulation is the U.S. dollar in which prices are quoted in shops, restaurants, and, yes, even parks housing the iconic balancing stones. “Bond coins” of 1,2,5,10, 25 and 50 cent dominations are given out as small change. But the stones are making a making a comeback in the newest type of money in Zimbabwe’s bountiful currency basket. Last year, the Zimbabwean government introduced a “bond note” that is pegged to the U.S. dollar and is illustrated with those same rocks from the old Zimbabwean dollar. Only a 2 dollar bond note is in circulation currently, but the government plans to incrementally introduce 5, 10, 20 and 50 dollar values over the next few months. Having a local currency bound to another is unusual, but by no means unique. Bosnia-Herzegovina has convertible mark tied originally to the German Deutschmark and now to the euro. For 50 or so years, there was de facto parity between the pounds of Ireland and the United Kingdom. But there remains apprehensiveness among many Zimbabweans who remember the old Zimbabwe dollar days. They live in hope that their new money will be as solid, stable, and unwavering as these three majestic rocks themselves.  Private car or a knowledgable taxi driver is the best way to get there.",money rocks geology
44,Daramombe Rock Paintings,"Chivhu, Zimbabwe",Several ancient rock paintings can be found on the hills surrounding the Daramombe High School.,https://www.atlasobscura.com/places/daramombe-rock-paintings,"Next to the big Daramombe Hill (where according to the local customs you can not complain or you will get lost), you can find different small hills consisting out of different sized boulders. Such hills also go by the name of kopjes. The rock paintings are scattered around the kopjes, some are very clear and big while others are small and slowly fading away. You can also encounter a graveyard of the first missionaries who build the school in 1939. The school as well as the big Anglican church was destroyed during the liberation war of Zimbabwe in 1970 but has been restored. The Anglican church still has its original walls, only the roof had to be completely restored. There are a lot of rock paintings that can be found at the different kopjes, some include a clear elephant, African drums, hunters, and many animals. No official research has ever been done to get to know more about the different rock paintings, so very little is known about them.  Upon arrival knock on the door of the school's headmaster to ask permission to enter, with a bit of luck, he will send someone with you that already knows the location of several of the rock paintings.",petroglyphs schools prehistoric rocks
45,Blood Falls,Antarctica,Natural time capsule containing an alien ecosystem.,https://www.atlasobscura.com/places/blood-falls,"This five-story, blood-red waterfall pours very slowly out of the Taylor Glacier in Antarctica’s McMurdo Dry Valleys. When geologists first discovered the frozen waterfall in 1911, they thought the red color came from algae, but its true nature turned out to be much more spectacular. Roughly two million years ago, the Taylor Glacier sealed beneath it a small body of water which contained an ancient community of microbes. Trapped below a thick layer of ice, they have remained there ever since, isolated inside a natural time capsule. Evolving independently of the rest of the living world, these microbes exist in a place with no light or free oxygen and little heat, and are essentially the definition of “primordial ooze.” The trapped lake has very high salinity and is rich in iron, which gives the waterfall its red color. A fissure in the glacier allows the subglacial lake to flow out, forming the falls without contaminating the ecosystem within. The existence of the Blood Falls ecosystem shows that life can exist in the most extreme conditions on Earth. Though tempting to make the connection, it does not prove, however, that life could exist on other planets with similar environments and similar bodies of frozen water—notably Mars and Jupiter’s moon Europa—as such life would have to arise from a completely different chain of events. Even if it doesn’t confirm the existence of extraterrestrial life, Antarctica’s Blood Falls is a wonder to behold both visually and scientifically.  The Dry Valleys are only accessible by helicopter from McMurdo Station (U.S.), Scott Base (New Zealand) or a cruise ship in the Ross Sea.",polar week wonders of salt martian landscapes natural wonders ecosystems water nature animals
46,Deception Island,Antarctica,"An abandoned whaling station on an active volcano offers hot springs in Antarctica, surrounded by ruined giants of industry.",https://www.atlasobscura.com/places/deception-island-2,"Deception Island has been covered and then deserted by many, and the dilapidated shells of buildings, boats, and whaling equipment remain as proof of its productive years as a Norwegian-Chilean whaling station as well as the home of several scientific stations run by Chile, Argentina, Spain, and the United Kingdom. The thing is, building and operating expensive equipment on an active volcano is risky business, even if the area is considered one of the safest harbors on the continent due to its large caldera, a famous refuge from storms and icebergs. While several countries were bickering over sovereign flags and attempting to occupy the lusted-after real estate in the 1960s, the island had apparently had enough and kicked everyone off. Erupting twice in two years, it demolished research centers and buried everything left behind in ash, including a cemetery occupied by 45 deceased whalers and a long-deserted aircraft hangar. The island’s use is now administered under the Antarctic Treaty System, and it is now a popular tourist attraction as well as a scientific outpost. The giant iron boilers and tanks of the long-gone whalers still stand, large holes cut in their sides as a deterrent to the Nazis, who were feared to have been planning to use them to store fuel. Chinstrap penguins roam around everywhere, as the west side is home to one of the world’s largest chinstrap rookeries. One of the more unusual things to indulge in while visiting the island is to take advantage of the natural hot springs. Due to its geological temperament, Deception Island has a number of microclimates, which means if you can get past the biting, freezing Antarctic winds and into a volcanic bath, you can enjoy this snowy martian landscape in your swimsuit.  Head south in an icebreaker ship - turn into opening in volcanic island; moor ship, take zodiac to shore",abandoned research stations polar week hot springs martian landscapes volcanoes geological oddities islands ecosystems water abandoned geology ruins
