index,attraction,location,blurb,url,description,tags
161,Zelionyj Bazaar,"Almaty, Kazakhstan","This sprawling market is a one-stop shop for traditional Kazakh foods, from mare’s milk to sheep’s head.",https://www.atlasobscura.com/places/zelionyj-green-bazaar,"You don’t need to love either food or shopping to understand why the Green Bazaar in Almaty is a local favorite and landmark. This two-story green market, in business since 1875, puts most farmers’ markets to shame, with its wide array of Kazakh delights, ranging from fizzy, alcoholic milk to horse sausage. Rows of vendors sell meticulously arranged baskets of kurt, smooth balls of a dry, salty cheese made from fermented mare’s or sheep’s milk. The cheesemongers also sell kumis, a lightly alcoholic beverage made with fermented mare’s milk, which they ladle out of buckets into small soup bowls. Dried apricots, raisins, figs, and other fruit and nuts lie like little jewels on trays, next to fresh fruit being pressed on hand-cranked juicers. The smell of freshly cut flowers, spices, and produce lingers as one walks through the bazaar. From salty camel’s milk to fish roe to horseradish condiments, customers are encouraged to have a taste as they peruse the stalls. The meat selection at the bazaar is extensive, including an entire section dedicated to horsemeat. Here, beneath slabs of hanging meat, butchers prepare and sell varieties of horsemeat sausages, including shuzhuk and qazı, a spicy, garlicky sausage made from horsemeat ribs seasoned and stuffed inside a horse intestine. Sheep’s heads, considered a delicacy, are sold too. On festive occasions, koy bas, a boiled sheep’s head preparation (served cold, with a garnish of onions) is a typical accompaniment to beshbarmak, the popular Kazakh meat-and-noodles dish. The first iteration of the bazaar was built in 1875, as a stopping point for traveling merchants. Though its newer modern building bears few similarities to the original, the market still serves as a place where cultures and cuisines can mingle. Rows of vendors sell spices, nuts, and dried fruit from across Central Asia, as well as honey and fresh breads. There are even stalls selling kimchi. If you’re still hungry after the generously proffered tasting samples, stop over for tea and noodles at one of the food stalls lining the perimeter. And if you must be a tourist, embroidered Kazakh hats, jackets, and intricately woven slippers are some of the beautiful souvenirs on display.  The market is open every day except Monday. The market closes at 7 p.m.",nomad foods milk cheese markets meat horses alcohol
162,Cosmonaut Grove,"Baikonur, Kazakhstan",Avenue of trees planted by cosmonauts before their space departures.,https://www.atlasobscura.com/places/cosmonaut-grove,"In a tradition that goes back to Yuri Gagarin and the Soviet space program, each cosmonaut crew member has planted a tree before their departure at the Baikonur Cosmodrome. The trees are located behind the Cosmonaut Hotel, which was designed for cosmonauts to rest before their space travels. The grove lines the Avenue of the Cosmonauts, as it’s called, and each is designated with a plaque with the crew member’s name and the year. Gagarin’s tree stands the tallest, while recent Soyuz crews have smaller saplings growing from the soil. A planting traditionally takes place the day before a voyage, although it can also be the week before, and it’s accompanied by a walk in the grove to remember the intrepid cosmonauts who came before through the trees that flourish in their absence.",cosmonauts natural wonders monuments nature
163,Khan Shatyr,"Astana, Kazakhstan",An entertainment center in a huge transparent tent.,https://www.atlasobscura.com/places/khan-shatyr,"The new Kazakh capital city of Astana is dotted with remarkable pieces of modern architecture, of which Khan Shatyr is the crowning jewel. A huge transparent tent, 150 m high and covering 140,000 m², which has been purposefully built to give the population of Astana a relief from the harsh winter climate of Northern Kazakhstan. Khan Shatyr was designed by British architect Norman Foster, who is also responsible for the pyramidal Palace of Peace and Reconciliation – another one of Astana’s architectural marvels. Inside the huge structure of Khan Shatyr are a number of entertainment options, such as a park, a boating river, a minigolf course, a shopping centre and even an indoor beach resort. Regardless of the outside temperature extremes, the internal temperature is moderate year-round, varying between 15 and 30° C, which is achieved by the use of the infiltrated sunlight, as well as air heating and cooling systems. Khan Shatyr was unveiled by the President of Kazakhstan Nursultan Nazarbayev in 2006 and was opened in 2010, on the 70th birthday of Nazarbayev. Almost a contained city to itself, Khan Shatyr provides a near-vacation destination in the center of Astana. Astana, 37 Turan Ave",architectural oddities architecture
164,Bayterek Tower,"Astana, Kazakhstan","A modern tower, symbolizing the legend of a golden egg on top of the tree of life.",https://www.atlasobscura.com/places/bayterek-tower,"The Kazakh word “bayterek” translates literally to mean “tall poplar,” as in the tree. That’s what makes Bayterek Tower such a fitting name for a national monument steeped in symbolism and meaning, connecting the old world to the modern in a celebration of progress. Located in Astana, Kazakhstan, every element of Bayterek Tower was designed with the intention of imparting meaning to visitors and citizens alike, right down to the height of the tower, which stands 97 meters tall to represent 1997, the year in which Astana was named the capital of Kazakhstan. The unusual construction of the tower is more than just a unique artistic flourish. The golden sphere that rests atop the many pointed spires of the tower is meant to symbolize an egg nestled amongst tree limbs – a nod to an age-old local folktale about happiness and beginnings, focusing on a bird who laid its egg in the sacred tree of life. This combination of the old and the new is intriguing and inspiring to both Kazakhs and visitors, who are invited to travel to the top of the tower and see views of the city from an observation deck inside its golden dome. Not only does this provide a unique tourist attraction, but also yet another means of symbolism, as visitors travel inside the “egg” of happiness and beginnings, able to see the modern world from a place of history and legend.",shops monuments architectural oddities architecture
165,Beatles Statue of Almaty,"Almaty, Kazakhstan",Beatlemania is still going strong... at least in Kazakhstan.,https://www.atlasobscura.com/places/beatles-statue-almaty,"Bronzing items which one finds important, and well worth saving, isn’t a rare practice. Attics and closets across the world are filled with bronze baby shoes, bronze hand prints and, less commonly, the occasional bronze tail. So it makes sense that somewhere in the world there would be at least one place to find The Beatles in bronze. Luckily, this shiny piece of pop culture on the side of the well-traveled tourist locale of Kok Tobe mountain in Almaty, Kazakhstan isn’t the actual Beatles dipped in bronze (so far as anyone can tell)—just a whimsical sculpture. The youthful, cartoonish representation of the worldwide musical sensation was created in 2007 by artist Eduard Kazaryan as an homage to the popularity and universal appeal of the group, and as another piece of artistic flair to go along with the existing attractions in Kazakhstan’s largest city. The statue stands near the artistic Almaty Tower on the popular mountain, which it seems is starting to be a rallying point for artists and tourists alike due to the attractive scenic vistas and popular activities the mountain provides visitors to the area.",rock and roll music monuments statues
166,Vladimir Lenin Busts and Statue,"Semey, Kazakhstan",A collection of Lenin busts and other Soviet Era statues sit idly behind the Semipalatinsk Hotel.,https://www.atlasobscura.com/places/vladamir-lenin-busts-and-statue,"Located in a small grove of trees in an otherwise unassuming park reside a collection of statues and busts from a bypassed era. Just behind the Semipalatinsk Hotel are several sculptures featuring the Soviet leader, Vladimir Lenin. There are other statues around the park of other Soviet-era figures, but none stand out more prominently than a giant statue of Lenin. The largest of all the relics, Lenin towers over the surrounding trees, a reminder of the power and magnitude of the former Soviet Union.  The statues are located directly behind the Semipalatinsk Hotel, which is next to Victory Park. Walk across the street from the park toward the hotel and walk one block. Turn right after the old-Russian-style log building, and you can see Lenin above the trees.",lenin statues
167,Ruins of Sauran,"Sauran, Kazakhstan","This was once the largest city in Kazakhstan, and a major stop on the Silk Road.",https://www.atlasobscura.com/places/ruins-of-sauran,"Located in what is now South Kazakhstan, Sauran may have been originally settled as early as the seventh century. By the 10th century it was a flourishing metropolis, described by the medieval geographer Al-Maqdisi as a “large city surrounded by seven walls.” Archeologists were puzzled when they failed to find the seven walls in these ruins, until they found another nearby site and realized that the city moved sometime in the 12th or 13th century. No one knows why the city was moved. Some believe that the original city was abandoned because of the presence of bubonic plague, likely brought from traders traveling the Silk Road. Others believe it was abandoned after it was conquered by Genghis Khan. However, it served as the capital for the Mongol White Horde through the time of Tamerlane, but it seems that as the empire declined, so did the fortunes of Sauran. By the 14th century, Sauran was undergoing a resurgence, and was rebuilt on its current site. During its heyday, the poet Wāṣefi described it in the 16th century as “cheerful and bright, with soft invigorating air” and containing “all sorts of beautiful trees.” Sauran remained a key city in Central Asia until the 18th century, when the nearby city of Turkistan, 35 kilometers (22 miles) to the southeast, began to dominate the region. The secret to Sauran’s centuries of prosperity in the desert is its extensive arrangement of underground irrigation canals. Known as a kyariz system, it used horizontal tunnels to take advantage of the natural flow from mountain aquifers and the confluence of three small rivers: Tastaksay, Aksay and Maydantal. Vertical wells were dug every 50 meters (164 feet) along the tunnels which allowed access to water and served as air vents for the slaves who dug the canals. Bellows were also used to pump fresh air underground for the diggers, who wore flotation devices made from pumpkin skins to protect against drowning during flash flooding. The city was more recognizable for what was above ground, which included two towering minarets with unique construction. Made from brick with internal spiral staircases, they were made to sway, or at least appear to sway. Early written accounts suggest they were designed to amaze visitors and enhance the reputation of the city as a center of the Islamic world. Sadly, the towers collapsed in the late 19th century. Rumors abound that J.R.R. Tolkien named the character Sauron in The Lord of the Rings after this ancient city with two towers, but in fact, “Sauron” is derived from Old Norse meaning “abominable.” Regardless, the ruins and history of Sauran stimulate the imagination as much as any fantasy story.  The ruins of Sauran should not be confused with the Village of Sauran, although they are cosily proximate.   The ruins can be easily reached from Turkistan by driving northwest along the Turkistan–Kyzylorda highway (M32) for about 46 km.  The ruins are about 12 km beyond the village and the road to them is paved.",cities roads literature ruins
168,Medeu,"Almaty, Kazakhstan",This Soviet-era athletic and recreation facility is the highest ice skating rink in the world.,https://www.atlasobscura.com/places/medeu,"Nestled in a wooded mountain valley just outside of Almaty, Kazakhstan, Medeu is an outdoor skating rink notable not only for its breathtakingly beautiful location, but also for its distinction as the highest Olympic-sized skating rink in the world. Sitting 1,691 meters (5,548 feet) above sea level, Medeu was originally built in 1949 and serves as an illustrative example of the scope, ambition, and slightly odd superlative aims of Soviet-era construction projects. Consisting of 10,500 square meters (over 110,000 square feet) of ice, it was one of the top speed skating venues in the world from its opening in 1951 right up until the disintegration of the USSR. During that period, some 120 world records were set at Medeu. Additionally, the site served as the home rink for the Almaty bandy team Dynamo Alma-Ata, and also hosted several international bandy games. Bandy is basically hockey — in actual fact it predates hockey — played with a ball instead of a puck. In 1972, Medeu transitioned from natural ice to artificial ice, and its unique artificial ice freezing system is still in use to this day. The facility fell into disrepair after the fall of the Soviet Union, but has been revived in the past decade, being used as a centerpiece for (unsuccessful) bids by Almaty to host the Winter Olympics, and serving as center ice for bandy matches in both the 2011 Asian Winter Games and the 2012 Bandy World Championship. Visitors who are neither Olympians nor professional bandy players can nevertheless enjoy a recreational skate on Medeu’s storied ice, or take a panoramic climb to the top of the dam south of Medeu, which protects the valley from mud flows. One Medeu enthusiast states that the rink’s “unique location makes its ice superglidey,” which is a rather dubious claim (although the Wikipedia entry for the Utah Olympic Oval — elevation 4,675 feet — claims that “low air resistance” at that elevation led to the extraordinary number of records set at the 2002 Winter Olympics, so maybe there’s something to it). However, the same enthusiast goes on to say that skating at Medeu, “surrounded by mountains and fir trees, spurred on by Russian pop music: it doesn’t get any better.” Now THAT sounds right on the money.",soviet architecture soviet history sports
169,Kieli Agash (Sacred Tree) of Auliyeagash,"Auliyeagash, Kazakhstan",Local lore says this 700-year-old tree has sacred and medicinal properties.,https://www.atlasobscura.com/places/sacred-tree-of-auliyeagash,"The Zharkent area of Kazakhstan doesn’t get a lot of tourists, so if you do happen to find yourself there, locals are likely to highlight one of the most important sights in their neighborhood: the Holy Elm Tree of Auliyeagash. Auliyeagash, a village about 17 miles from Zharkent, is home to Kieli Agash, a holy tree (“Agash” means “tree” in Kazakh) rumored to be at least 700 years old. The number seven is key to the tree’s power. You may hear that the tree is 700 years old, that it sprang from seven roots, and that it takes seven people joining hands to encircle the tree. Legends about the tree abound. According to one tale, a Muslim pilgrim once went to sleep under a dead, brown tree but when he awoke, the plant was alive and green. Other stories state that water springing from the roots of the tree is healing, that a visit to the tree cures infertility, and that somehow the tree saved people from invading troops led by Genghis Khan. If you are able to ask locals about these legends, you absolutely should—just don’t expect the stories to be totally consistent. The approach to the tree is from the entrance arch, via a wooden walkway through a small park full of other, much younger, trees. Those trees are all bent over, many seemingly bending towards the main tree. Believers say this is because the smaller trees are all bowing to the older tree. Nearing the tree you will see handkerchiefs and scraps of fabric tied to branches in tribute. At the bottom of the trunk, which may be swaddled in white fabric, is a hole filled with purported holy water, which people drink either for their physical or spiritual health. The main attraction has undergone some rather severe trimming in recent years, in an effort to keep the rest of the tree alive and healthy. But even if the tree itself is a bit smaller than it once was, the park is quite peaceful and beautiful and the importance of the tree to the local community is very touching.  The village of Auliyeagash can be found by heading west from Zharkent towards Almaty and then turning right at Koktal, which takes you north towards Auliyeagash. Not far past the village you can find the entrance to the park marked with some metal railings and a small entrance arch. Colored pieces of fabric are tied to the gate, left by past pilgrims.  Frankly, even with the best directions and great GPS, this might be a little hard to find without some help from locals. Fortunately, literally everyone in the area knows about the holy tree. Work out how to pronounce Auliyeagash and, as a back up, how to say tree in Russian (“derevo”). Then find a local to ask any time you worry you’ve lost your way or just want to check that you’re still headed in the right direction.",superstitions legends trees plants
170,ALZHIR,"Malinovka, Kazakhstan",A Stalinist prison camp for the wives and children of men accused of betraying the Soviet state is now a memorial museum.,https://www.atlasobscura.com/places/alzhir,"In the midst of Kazakhstan’s steppe is a former Stalinist prison camp, where a memorial complex and museum now candidly pay respect to those who suffered at the hands of the totalitarian Soviet state—in particular, the wives of the men who were accused of betraying the motherland. Visitors to Kazakhstan’s capital city, Astana, will revel in the Vegas-like atmosphere of gleaming new buildings dominated by shimmering gold and blue glass and metal. Sightseers might marvel at the height and design of the Emerald Towers, gazing at the impossibly futuristic skyline along the way to visit the top of the iconic Baiterek Tower and take in an unlikely panorama of the Central Asian steppe. Astana also has a much darker history lurking on the fringes of the affluent power hub. In the 1930s in the town of Akmol, about 20 miles west of Astana, Joseph Stalin established a special gulag named the “Akmola Labor Camp for the Wives of the Betrayers of the Homeland,” more commonly known by its Russian acronym, ALZHIR. The camp imprisoned women and children whose only crime was to be related to a man who had been denounced by the state, often for no discernible reason. In this Kafkaesque setting, the prisoners toiled at producing clothes and materials for soldiers fighting in World War II. Summers here experience temperatures approaching 100 degrees Fahrenheit while in winter, the mercury can sag to less than 40 below, and camp conditions were hardly sufficient to accommodate the climate. Remarkably, Kazakhstan’s officials do not attempt to obscure this dismal heritage, but rather have built and promoted a museum to commemorate those who suffered and died at ALZHIR.  A historic rail transport, reconstructed guard tower, and multiple sculptures surround the uniquely designed museum, which contains numerous relics and related stories that recount the painful details of prison life.  The biographies of those who survived are a true testament to the strength of the human spirit.  Sadly, as the exhibits demonstrate, too many women’s stories ended in tragedy. The museum is about 20 miles southwest of Astana and is largely accommodating for English only speakers.",prisons soviet history women memorials
171,Lisakovsk Pentagram,"Denisov District, Kazakhstan","An abandoned Soviet-era park that, when viewed from the air, looks like a pentagram.",https://www.atlasobscura.com/places/lisakovsk-pentagram,"Viewed from above, this Soviet-era park appears like a satanic sign. However, the pentagram was popular symbol with the Soviets, and is an ancient symbol with many associations over time, not just those that are devilish. Yet it does seem like an eerie place, all windswept and isolated out along a peninsula into the Upper Tobol Reservoir of Kazakhstan. The nearest city is Lisakovsk, 12 miles to the east. Until 1991 with its dissolution, Kazakhstan was part of the Soviet Union and the pentagram is likely the beginnings of a summer camp, although they only ever got to the now overgrown, ominous roads that remained etched in the earth, visible on Google Earth to the curious armchair traveler on the watch for conspiracy.",landscapes soviet history intriguing environs ecosystems
172,KarLag Memorial Museum,"Dolinka, Kazakhstan",A sober museum housed in the original administrative building of one of Stalin's largest gulags.,https://www.atlasobscura.com/places/karlag-memorial-museum,"In the village of Dolinka, outside of the large Kazakh city of Karaganda, is the former administrative headquarters of KarLag, short for the Karaganda Corrective Labor Camp, one of Stalin’s largest gulags. The attractive architecture belies the dark history of the building, which now houses a museum memorializing the victims of political repression all over, and the Soviet gulag system particular. In its nearly three decades of operation between 1931 and 1959, the administrative center at KarLag processed as many as one million prisoners. Soviet policy was to send people convicted of crimes (real or imagined) out of their home regions where they might generate sympathy among locals. So most of the prisoners housed in KarLag were not Kazakhs. In the years of World War II and immediately after, the Soviet labor camps were filled with either prisoners of war or simply people of German and, to a lesser extent, Japanese ethnicity who were rounded up and imprisoned. Consequently, the local population of the city of Karaganda was largely ethnically German until the late 20th century. While the vast Kazakh steppe provided a prison with little need for walls or fences (you can’t escape if there’s nowhere to escape to) the main reason for situating the Karaganda Corrective Labor Camp in this district was the need for cheap labor for local coal mines. This was especially crucial during wartime. Over time the labor performed here expanded from coal mining to agriculture, railroad engineering, and various scientific work. Famous residents included aircraft designer Andrey Tuplev and scientist Alexander Chizhevsky, who were expected to continue their work within the confines of prison. The administrative building includes two floors and a basement. In the basement are recreations of rooms that did not exist in this specific building, but did exist elsewhere in the gulag system: prison cells, medical clinics, torture rooms, and barracks. In the upper floors are themed rooms featuring artifacts and dioramas that tell the stories of life in the camps. Standout features include the many Soviet propaganda posters and the small gallery of art created by prisoners. Unsurprisingly, the subjects deemed appropriate for artistic expression are limited, and feature a lot of images of Vladimir Lenin. Most of the camp’s records were deliberately or “accidentally” destroyed, but a local university continues to work on piecing together the history of the prison. A ledger is provided for visitors to add their contact information and any information they have about relatives who might have been imprisoned here. If the research team finds any information about the prisoner, they will reach out.  Budget and hour or two to see the full museum. Many of the exhibits are labeled in Russian, Kazakh, and English, but if you hire a guide you are likely to get more out of the visit as they can share additional stories and context. Tours often leave from Karaganda and include transport, admission, and a guide. If you prefer to go solo, you can negotiate with a taxi driver for round trip driving and wait time while you tour the museum. A fair price is between 5,000-10,000 tenge. Those interested in even more history of the gulag system should visit ALZhIR, just outside the capital city of Astana (now renamed Nur-Sultan).",war memorial prisons soviet history war history world war ii memorials military museums
