index,attraction,location,blurb,url,description,tags
29,Sarawak Museum,"Kuching, Malaysia",The oldest museum in Borneo is a cornucopia of rare taxidermy and human skulls.,https://www.atlasobscura.com/places/sarawak-museum,"Contained in Borneo’s oldest museum is not only some rare historical taxidermy, but also an exhibit that remembers the historic (if barbaric) culture of headhunting. In 1891, the second White Rajah of Sarawak, Charles Brooke began construction works on what would be the oldest museum in Borneo. This plan came after some nudging from his friend and famous British naturalist, Alfred Russel Wallace, who had been exploring the Malay Archipelago, collecting specimens for study at the time. The Victorian period architecture, designed after a Normandy town hall, survived through the Japanese Occupation in Malaya (1941 – 1945) during World War II. It had the good fortune to fall under the protection of a Japanese officer, which is why the museum suffered very little damage and looting. A lucky thing too because the natural history collection housed in this museum is regarded as one of the finest in Southeast Asia, which dates back to the dynastic English monarchy of the Brooke family (1841 – 1946). On the ground floor of the Sarawak Museum, you’ll find taxidermied exhibits frozen in time in their wood and glass display case, ever watchful of the many visitors who had walked through the Natural History gallery for decades. They had seen the world changed, although the exhibits themselves remained the same, if not somewhat disintegrating a little as time goes by. A great deal of the collection comes from the Brooke Era, where the taxidermy procedures had been done not in Sarawak, but all the way in Britain. This preservation took place in the 1800s, so delivery by sea took about three months each way yet the fragile shipments remarkably managed to arrive at their destinations without harm. Case in point would be the Orangutan exhibit. As the story goes, the first Rajah of Sarawak, James Brooke, shot two Orangutans during a hunt. He had both packed in ice, shipped to Britain to be taxidermied and mounted, and later shipped back to the Sarawak Museum. Today, this exhibit, along with others from that era have remained as they were in the Natural History gallery. This gallery is home to various taxidermied specimens including primates, avians, felines, and rodents found in Borneo. The natural history collection is not the sole appeal of the Sarawak Museum however. The first floor features ethnographical artifacts of indigenous peoples of Sarawak, including a wide collection of traditional ceremonial masks from different tribal groups. Among the local culture, carved wooden masks are worn by the spirit doctors of a tribe and different masks serve different ritualistic purposes. They can be used to celebrate a good harvest or for spiritual ceremonies like exorcising evil spirits from a victim’s body. The museum’s collection contains mainly masks from the Iban, a tribal subgroup of the Dayak people of Sarawak. Ceremonial masks come with varied expressions, and some are even implanted with actual human hair as facial hair. Also on the first floor is a model longhouse built to depict the traditional living spaces of the historic Dayak people. In previous eras, the Dayaks practiced headhunting, and human skulls would be preserved and installed in longhouses, believing that the trophies would bring a good harvest and fertility to the community. The replica community hut is adorned with its own human skulls. Of course, the practice of headhunting has long been eradicated since the days of the White Rajahs. No need to lose your head worrying over it when visiting Sarawak today. However, maintenance of the heads is not to be taken lightly, even to this day, for as long as human skulls are present in a longhouse there are rules and rituals to follow. The heads need regular food offerings and a constant fire lit beneath them. Failure to do so would anger the spirits of the heads, and this only spells bad omens to the inhabitants of the longhouse. Just to be safe, don’t mess with the heads. Update as of February 2020: The museum is closed for renovations, but there are plans for it to reopen sometime in 2020.",taxidermy museums and collections museums
30,Pinang Peranakan Mansion,"George Town, Malaysia","The lavish, well-preserved home of a wealthy Baba Nyonya family is now a cultural museum.",https://www.atlasobscura.com/places/pinang-peranakan-mansion,"The Pinang Peranakan Mansion is one of the best-surviving examples of the lavish lifestyle of a prominent community that thrived in 19th-century Malaysia. The Peranakan, also known as the Baba Nyonya in Penang, are largely the descendants of Chinese men who came to the Malay archipelago centuries ago and married local Malay women. During the colonial era, they mainly engaged in trade and business, making them extremely wealthy in both currency and exposure to other cultures. Their opulent homes speak to the wealth and high status they enjoyed. The Pinang Peranakan Mansion is a particularly exquisite example of their culture, which has begun to decline in Malaysia and Singapore. The Pinang Peranakan Mansion belonged to Chung Keng Quee, who was among the wealthiest residents of Penang in the late 1800s. His fortune was derived mainly from his businesses in mining. His mansion was built in a style unique within this part of the world, as it’s an eclectic mix of Chinese and European design elements. Today, it serves as a museum dedicated to Peranakan culture. Inside, a large collection of furniture, silverware, dresses, decorations, collectibles, and appliances is kept on display. This collection provides fascinating insight into the culture’s lifestyles and customs.  It's open Monday through Sunday from 9:30 a.m. to 5:00 p.m. The admission fee is 20RM (~$5 USD). For tours of the mansion, please make arrangements in advance.",wealth mansions immigration colonialism architectural oddities museums and collections architecture
31,Masjid Putra (Putra Mosque),"Putrajaya, Malaysia",Next to the Malaysian Prime Minister’s office stands this rose-colored mosque.,https://www.atlasobscura.com/places/putra-mosque,"The center of Malaysia’s government, about 25 miles away from Kuala Lumpur, the city of Putrajaya sits between the capital and Kuala Lumpur International Airport. This is where the Perdana Putra, the building that contains the Prime Minister’s office complex is located facing the Putrajaya Lake. Next to this gorgeous building is another structure derived from a rose-colored dream. Completed in 1997, the Putra Mosque was crafted with unique with rose-tinted granite and can host more than 10,000 worshippers at a time. The mosque consists of three main functional areas. Inside is a simple yet elegant prayer hall, the Sahn (courtyard), and various learning facilities. Its 380 feet (116-meter) tall minaret is one of the tallest in the region. Influenced by the design of the Sheikh Omar Mosque in Baghdad, the structure is a beautiful marriage between traditional Malay and Middle Eastern architectural styles. The Putra Mosque is one of the few pink mosques in the world. However, it’s not as well-known as the Nasir-ol-Mulk Mosque in Iran or the mosque found in the Philippines, and not as pink as either. Still, this pastel pink-domed mosque’s delicate features are a sight to behold.  Hours are from 9 a.m.-5 p.m. Sunday-Saturday.",mosques buildings religion sacred spaces architecture
32,Kundasang War Memorial,"Ranau, Malaysia",Four distinctly unique gardens commemorate the POWs who lost their lives during the Sandakan Death Marches of 1945.,https://www.atlasobscura.com/places/kundasang-war-memorial,"“I’m dreaming of Australia, the land we left behind…” These are the despairing words carved into black stone at the Kundasang War Memorial and Gardens, one of the first memorials created to remember the victims of the Sandakan Death Marches of 1945. Over 1,000 Australian and British Prisoners of War perished in Sandakan, Malaysia during the three death marches from the Sandakan POW Camp to Ranau, Malaysia during World War II. A mere 6 men survived, all of them Australian soldiers who had escaped. The memorial was built to commemorate both the victims of the marches themselves and the people of North Borneo who risked or lost their lives to help the POWs by hiding escapees from the Japanese and feeding them until the war ended. The death marches are considered to be the single most atrocious calamity to ever be endured by Australian servicemen during the World War, and three Japanese commanders were eventually tried and put to death for the war crimes. In 1962 the memorial was erected, and it’s a calm and peaceful place to visit despite being located behind a bustling farmers’ market. The gardens are made up of four sections, one for each distinctly different homeland and culture of those who lost their lives, and one for contemplation. There is an Australian Garden, an English Garden, a Borneo Garden, and a Contemplation Garden and Pool. If you visit the memorial you are welcome to watch a video and learn more about the death marches, but if you don’t have the stomach for it you can simply smell the roses of the English Garden, admire the orchids of Borneo, run your fingers across the smooth white pebbles of Kundasang in the Australian Garden, or go to the pool and contemplate the sacrifices, sadness, and all-too-human fallacies of war. Kundasang is located 90 km, approximately 2 hours by automobile, from the capital of Sabah, Kota Kinabalu. Visitors may take a bus from the Jalan Padang Bus Terminal to Kundasang or Ranau for approximately RM17.00 per person. A taxi from the Ranau Taxi Stand (located beside the Merdeka Field) or from a hotel should cost around RM160.00 to RM300.00 per taxi. You may also hire a local tour guide to transport you from your hotel directly to the site by email inquiries to leslie_cbs@yahoo.com. Local tour guides can customize tours which include stops at a variety of nearby attractions therefore, prices vary.",horticulture monuments plants
33,Wat Chaiya Mangkalaram,"George Town, Malaysia",Giant relaxing Buddha in Malaysia.,https://www.atlasobscura.com/places/wat-chaiya-mangalaram-buddhist-temple-penang-malaysia,"When enlightenment is reached, the feeling is completely sublime and without trouble. Worries simply drift away into a calmer state of being. This Buddhist ethos is perfectly portrayed in Wat Chaiya Mangkalaram, a temple with a giant reclining Buddha. Unlike monuments to other spiritual figures, the Buddha is not supposed to create feelings of sadness or loss. Instead, the 100-foot-long golden Buddha is meant to inspire, showing all of those who follow in his path the supreme happiness achieved from nirvana. Sprawled across the entire temple, the Buddha is slightly smiling and natural light shimmers off of his gold and white finish. Wat Chaiya Mangkalaram is actually a Thai temple, and is not directly connected to Malaysia in origin. The temple was built in 1845 by a Thai monk, and has been a location of serious Buddhist devotion since. Many of the most devoted to the temple have had their ashes placed in niches behind the massive Buddha statue. There they rest and accompany the smiling and tranquil Buddha after their death.",giant buddhas
34,Enlightened Heart Buddhist Temple,"Tambun, Malaysia","On the outskirts of Ipoh, this sprawling temple complex is home to one of the world's tallest pagodas.",https://www.atlasobscura.com/places/enlighted-heart-tibetan-buddhist-temple,"On the outskirts of Ipoh City, located in Tambun, just off Ampang Road, resides a sprawling Tibetan Buddhist temple complex. The temple was established around 1976 by Ge Li Rinpoche as a place to practice Nyingma Tibetan Buddhism. The complex itself covers around 12 acres. Surrounding the complex are various orchids and valleys. Around the temple are more than 200 statues and sculptures, however, the temple’s most striking feature is its multicolor pagoda. Standing at 13-stories and 236 feet (72 meters) in height, it’s one of the tallest pagodas in the world. From the eighth floor of the pagoda, a high gold sheened Shakyamuni Buddha statue gazes out over the Kinta Valley toward the city of Ipoh. Around the pagoda are various pavilions that consist of traditional Tibetan prayer wheels, statues of deities, carved Buddhas, kitschy animals, and many more relics dedicated to the practice of Nyingma Tibetan Buddhism. The temple walls are decorated with carvings, paintings, and various Buddhist scriptures that are designed to present wisdom to those visiting the temple. The temple is at its busiest on Malaysia’s Wesak Day, a public holiday when devotees descend on the temple to ask for good fortune and wisdom.  The temple is open every day from 9:00 a.m. to 5:00 p.m.Admission is free and donations are appreciated.",temples design religion sacred spaces statues architecture
35,Ithaa Undersea Restaurant,"Rangalifinolhu, Maldives","An underwater restaurant, surrounded by a coral reef.",https://www.atlasobscura.com/places/ithaa-undersea-restaurant,"To enter the restaurant, visitors climb down a spiral staircase in a thatched pavilion at the end of a jetty. They enter the building, which has a curved roof like a tunnel, from above. Secured five meters below sea level at the Hilton Maldives Resort and Spa, the Ithaa Undersea Restaurant is a mostly acrylic building that only seats 14. Offering a 270-degree panoramic view to its customers, Ithaa was designed and constructed by M.J. Murphy Ltd., a design consultancy based in New Zealand. Opened in 2005, Ithaa (which means ‘mother of pearl’ in Dhivehi, the local language) charges a premium for its meals, but they might cost less than one would expect for an underwater dinner. They start in price at about $120 US for lunch for hotel guests. The restaurant serves contemporary fusion Maldivian cuisine with Western and Asian influences. Advance reservations are necessary. Designed by the Kuala Lumpur National Science Center, the building qualifies as the world’s largest aquarium tunnel. After completion in 2004, Ithaa was taken to the Maldives on the back of an ocean-going barge. It took 16 days to arrive. It is estimated that the restaurant, which is placed in extreme conditions, will only last for 20 years.  1 Hour Sea Plane from Male International Airport",underwater week underwater intriguing environs restaurants Unique Restaurants & Bars ecosystems water architectural oddities architecture
36,Sea of Stars,"Vaadhoo, Maldives",Bioluminescence in the reefs of the Maldives causes the sea to glow like a starry night sky.,https://www.atlasobscura.com/places/sea-of-stars,"The “Sea of Stars” is a beautiful phenomenon that occurs during late summer in the reefs of the Maldives, caused by bioluminescent phytoplankton called Lingulodinium polyedrum. The water here is filled with this plankton, and the movement of the waves causes it to glow, creating an incredible shimmering effect that looks like the sea is full of stars.  Vaadhoo Island in the Raa Atoll is the most well-known spot for viewing the plankton, though it is dependant on conditions and may occur on any of the islands. It is best to do more research if you are interested.",reefs glowing bioluminescence oceans natural wonders water nature
37,Subsix,"Kudahuvadhoo, Maldives",Fine dining 20 feet below the surface in the Indian Ocean.,https://www.atlasobscura.com/places/subsix,"At the uber fancy PER AQUUM Niyama resort in Maldives, tourists frolic between two private islands. They have lots of dining choices, but by far the most unique is Subsix, a gourmet restaurant six (hence the name) meters (about 20 feet) beneath the surface of the Indian Ocean. In order to even see Subsix, visitors must come by speedboat. It’s a 40 minute trip from the capital, Malé, or a 15 minute one from Niyama Resort’s islands. The entrance to the restaurant is inconspicuous, just a mysterious pair of doors atop a short dock. Once there, they descend three stories beneath the waves into the “clam-shaped” bar. The building (constructed on land then sunk below the waves) sits central to a thriving coral reef. Sea anemone chairs and soft blue light invite the diners into the ocean world, not to mention the Hawkbill turtles, eels, and parrotfish swimming just beyond the glass.",underwater week resorts underwater restaurants
38,Baa Atoll Biosphere Reserve,"Eydhafushi, Maldives",The world's seventh-largest coral reef contains an incredible amount of biodiversity.,https://www.atlasobscura.com/places/baa-atoll-biosphere-reserve,"This highly biodiverse environment is home to the world’s seventh largest coral reef. Huge quantities of plankton flow through it, which enables the whole food chain to thrive. More than 250 types of corals are found in the Baa Atoll Biosphere Reserve, sustaining about 1,200 species of fish. Baa Atoll refers to three distinct atolls that form a wider ring of islands covering a total area of 345,206 acres (139,700 hectares). Of the 75 islands in the Baa Atoll, 13 are inhabited by Maldivians, some are resort islands (where there is one tourist resort on the whole island), and the rest are uninhabited. The waters of the atoll vary in depth from 98 to 263 feet (30 to 80 meters), whereas around the atoll, the ocean plummets to more than 250 metres in depth. Look in the water, and you’ll likely spot parrot-fish, butterfly-fish, angel-fish, clown-fish, wrasses, marine turtles, moray eels, manta rays, groupers, whale sharks, and dolphins. Some threatened and endangered species found in the waters of the atoll include green turtles, hawksbill turtles, Napoleon wrasses, and tawny nurse sharks. The astonishing degree of biodiversity of the Baa Atoll extends also to above-water flora and fauna. Mangroves are present on virtually all islands, and among the most common animals are several types of lizards, skinks and geckos, fruit bats, frigate birds, and herons. The government has made a commitment to environmental protection, with a particular emphasis on recycling, which has led to the export of recyclable waste becoming a thriving business in recent years, second only to the export of fish.  Baa Atoll can be reached by ferry boats from Malé. Alternatively, there are frequent daily flights between the Island of Dharavandhoo and Malé. From Dharavandhoo, other islands can be reached by boat. The GPS coordinates for this place entry lead to the Baa Atoll Biosphere Reserve Office on the island of Eydhafushi. Scuba diving indubitably increases the number of marine creatures you may encounter but it is not a requirement. Snorkeling in waters up to 16 feet (five meters) in depth is sufficient to see more species than you can name. The environmental impact of your visit also depends on the type of accommodation you choose. In this regard, islands develop their own waste management system that must comply with local regulations, which emphasise self-reliance and sustainability. Although official inspections are rare, some islands have taken environmentally friendly practices seriously. Some research before visiting is required, but it is possible to visit the Baa Atoll with minimal environmental impact. As mentioned, some islands are entirely dedicated to tourism, with one resort being the only structure on the whole island. The range of these resorts can vary, from gaudy to luxurious. For a more authentic experience, accommodation can also be found on the islands inhabited by Maldivians. This imposes some restrictions, such as dressing modestly in the villages, no alcohol, and limited nightlife.",coral reefs biodiversity water nature
39,"Thilafushi: the ""Rubbish Island""","Malé, Maldives",The exorbitant price of paradise.,https://www.atlasobscura.com/places/thilasfushi-the-rubbish-island,"The Maldives island chain in the Indian Ocean is about as close as it gets to tropical bliss on Earth. The smooth white sand, tranquil blue water, and beautiful foliage annually attracts 750,000 visitors a year. But unbeknownst to most of these tourists, for decades the rubbish they produced - 3.5 kg per day - was being ditched on a floating, heaping pile of trash. In the beginning, Thilafushi was a lagoon composed of shallow coral reefs. In 1992, the Malé government decided to use the barrier island as the final destination for the enormous waste produced by their flourishing tourism industry. “Rubbish Island” as it was called, began receiving visitors in the form of massive refuse freighters, garbage excavators and migrant workers paid to handle the trash. For 20 some odd years, the man-made “island” was presented with approximately 330 tons of garbage a day, causing it to swell at a rate of one square meter every 24 hours. The newly-generated land was soon leased to entrepreneurs who used the island for various industrial activities. The island has of course suffered from the haphazard waste. The outrageous number of flies is a disgusting addition to the area, but isn’t the island’s biggest problem. Commercial activity along with indiscriminate dumping has brought an abundance of toxic materials to the lagoon - broken oil drums, asbestos, lead, and other noxious metals mix in with daily household garbage items creating a noxious sludge. There is little around the island that goes unpolluted as harmful substances seep into the water and smoke from burning waste floods the air. The government outlawed rubbish dumping on the island in 2011 after several freighters, impatient with the dumping process, jettisoned their loads directly into the sea. Garbage boats are reportedly now advised to shuttle their merchandise to India.",disaster areas islands
40,Dhigurashu Thun'di (Long Beach),"Dhigurah, Maldives","A narrow, serpentine spit of sand is constantly eroded and rebuilt by competing currents.",https://www.atlasobscura.com/places/dhigurashu-thundi-long-beach-maldives,"Indian flying foxes—one of the largest bat species in the world—flit from one breadfruit tree to the next, their wings silent above the rhythm of the surf. Here on the island of Dhigurah, a narrow slice of sand and coral in the Maldives’ Alifu Dhaalu Atoll, about two hours by public speedboat from the capital of Malé, the ocean is always nearby. At its widest point, Dhigurah is only 300 meters across, though most of it is much narrower. Its slender shape—Dhigurah means “long island” in Dhivehi—is most dramatic at its southwest end, a sand spit that stretches for hundreds of meters between the atoll lagoon and the open Indian Ocean. Ocean and lagoon waves constantly compete to erode and rebuild the thin, serpentine sandbar, known as Dhigurashu Thun’di, or Long Beach. Yet the water on either side of the spit is surprisingly calm. It’s not unusual to see local children splashing in the waves while their parents set out a picnic nearby. About 600 people live on the island, and the spit is a popular destination for villagers at all times of day. A thin strip of tropical forest thick with palm and breadfruit trees offers shade from the midday sun. At sunset, sand and sky turn dramatic shades of red and orange as the lights of small fishing boats wink on in the gathering darkness. Just beyond the spit, waves crash together, hinting at the powerful forces in motion beneath the surface. Even then, at low tides on calm days, it’s theoretically possible to cross from the sand spit to another sandbar that leads to a small island, home to a luxury resort—though a no-trespassing sign warns you against doing so. The Maldives began welcoming tourists in 1972, and for most of that period, visiting meant flying into the capital of Malé and being whisked by chartered seaplane or private speedboat to a high-end resort island that was off-limits to locals. Since 2009, however, several “local islands,” dotted with guesthouses and small hotels, have opened to foreign tourists. On these islands, including Dhigurah, alcohol is banned and adhan, the Islamic call to prayer, echoes across the sand several times a day. Dhigurah is located close to several nearshore sites popular with whale sharks and manta rays year-round, drawing a growing number of foreigners eager to snorkel or dive with the animals. But Dhigurashu Thun’di remains a quiet, calm place of stunning beauty shared by locals and visitors alike, a slim line of white sand curving between a turquoise lagoon and the open ocean.  Dhigurashu Thun'di is accessible by foot from the island's village in about half an hour. Walking along the northwest-facing beach requires some wading. Reaching it via the southeast beach is not recommended due to the rocky coast and stronger currents. You can also reach the spit by following the island's ""Beach Trail,"" actually an unpaved road through the jungle. The road is used by villagers to access community gardens and the island's garbage collection site, so expect to yield to motorbikes and ""Cool Rides,"" a popular local vehicle that's half motorized tricycle, half mini-pickup. Unlike at the so-called ""Bikini Beach"" for tourists on the island's north side, modest attire is appropriate for Dhigurashu Thun'di, which is very popular with local families. Everyone visiting the Long Beach should be covered from shoulders and upper arms to knees.",waves bats beaches oceans islands
