index,attraction,location,blurb,url,description,tags
24,Candy Cane Mountains,"Siyazan, Azerbaijan",Swirling layers of white and red rock earned these mountains their festive nickname.,https://www.atlasobscura.com/places/candy-cane-mountains,"On the highway between Baku and Quba in Azerbaijan, a series of red-and-white striped peaks emerge suddenly from the surrounding landscape. Part of the Greater Caucasus mountain range, the Candy Cane Mountains earned their nickname thanks to their striking resemblance to the classic Christmas treat. The color of these rocks is a product of the area’s unique geology. The Candy Cane Mountains are made of shale, a type of sedimentary rock made up of many thin layers stacked on top of each other. Long ago, before the rock was formed, changes in the environment led to differing mineral composition as the layers of sediment were deposited. As the shale came in contact with water, layers that contained iron oxidized and turned red, while layers without iron remained shades of white and gray. Over time, tectonic movement and erosion have exposed these sedimentary layers into a visual representation of geologic history. The Candy Cane Mountains also contain many belemnites, fossils of an extinct order of squid-like creatures from the Cretaceous period.","The Candy Cane Mountains are located about 50 miles from Baku on E119. You can drive to the area or take a guided tour. The main area is located just off the road and there are a few small trails through the hills. Bring plenty of food and water, as there are no facilities in the area and the nearest market is about 30 minutes away. There is no entry fee."
25,Musical Stone of Gobustan,"Baku, Azerbaijan","Resonant stone, that has been played since prehistoric times.",https://www.atlasobscura.com/places/musical-stone-gobustan,"The Gobustan National Park is an otherworldly place. More than four hundred mud volcanoes are found within the area – half of all mud volcanoes in the world. Additionally, there are bizarre rock formations, burning gas vents, prehistoric petroglyphs – and the large musical stone, called Gaval Dash (Qavaldaş). Two meters long, the stone resonates a tambourine-like sound when it is “played” by hitting it with smaller stones. It is assumed to have been used since ancient times to play ritual melodies, used for the archaic Yallı chain-dance, which is portrayed at some of the petroglyphs at Gobustan – and which is still performed in Azerbaijan to this day. Other rocks in the Gobustan area have proven to have similar capabilities, which are thought to be the result of a combination of the unique climate and the effect of the natural gas within the region. A number of Azeri musicians have used the hypnotic sound of the rock to create pieces of music, partly in combination with other instruments, or chanting. The musical stone and the Yallı chain-dance also featured in the interval act of the semi-final of the 2012 Eurovision Song Contest in Baku.",
26,Azerbaijan National Carpet Museum,"Baku, Azerbaijan",A unique museum dedicated to culture and artistry of carpet weaving.,https://www.atlasobscura.com/places/azerbaijan-national-carpet-museum,"In Azerbaijan, the art of carpet weaving is one of the most important aspects of culture and history. So naturally, the country is home to a museum dedicated to carpets and rugs—at the time of its establishment, the only one of its kind. The museum was founded in 1967 and originally housed in the Juma Mosque in the Old City district of Baku. In 1991 it was relocated to the former Lenin Museum on Neftchilar Avenue, and in 2014 it moved again to a new building in the seaside park. The current museum building, designed by the Austrian architect Franz Janz, is intended to resemble a massive rolled carpet. The Azerbaijan National Carpet Museum is home to the largest collection of Azerbaijani carpets in the world, some dating back to the 17th century, as well as archaeological artifacts and folk crafts, including ceramics, oil lamps, embroidery and jewelry. It also serves as a research site, where the art of traditional carpet weaving and its modern legacy are studied and discussed. On the first floor of the museum, visitors can walk through a timeline of Azerbaijani carpet weaving, from simple woven mats made from reed or cane to more complex woven forms. There are also weaving tools on display like looms, wool, ropes, and carpet bags. The second floor is filled with pile carpets, divided into distinct groups. Displays show information about common motifs found in Azerbaijani folk art, such as buta, dragons, the tree of life, different styles of crosses, and Islamic symbols. A 17th-century carpet called “Ajdahali,” the oldest carpet in the museum’s collection, is also on display here. The third floor focuses on modern carpeting, and how the art has developed through the 19th, 20th, and 21st centuries. Among the artists featured is Latif Karimov, a prominent carpet designer and scientist who played a role in the establishment of the museum.","Entry is 7 AZN for adults, 3 AZN for students and free for children under 6. The museum is open every day except Mondays, from 10 a.m. to 6 p.m. on weekdays and to 8 p.m. on Saturday and Sunday."
27,The Yanar Bulag Fire Spring,"Astara, Azerbaijan","Spring that emits water and fire at the same time is said to have remedial properties, and sparked its own religion.",https://www.atlasobscura.com/places/fire-spring-yanar-bulag,"The fire spring Yanar Bulag (which literally translates to “burning spring”), close to the city of Astara in southern Azerbaijan, is an unusual spring which fascinatingly combines the two elements fire and water. The phenomenon starts simply enough. Water comes gurgling from a metal stand-pipe inside a small pavilion, not looking particularly unusual. But when a lighter or another ignition source is touched to the water, the liquid itself will be set ablaze. This unique and entertaining property of the water is due to its uniquely high methane content.. Despite the methane in the water, water from the spring is said by locals to have remedial properties. People come from all over the region to collect water from the spring. Similarly, for tourists it has become almost a rite of passage to take a mouthful of the water while the top of the pipe is being set ablaze. The fire spring is but one of many weird sites in Azerbaijan that can be attributed to the country’s high gas and oil reserves. Aside from being a quirky attraction, the fire spring also evokes the spririt of Zoroastrianism, a religion in which fire and water are considered agents of ritual purity. Today, Zoroastrianism no longer exists in the country, but it was in this region that the religion was founded 2,000 years ago. Perhaps this is not surprising, considering these unusual and fascinating local phenomena.",
28,Ağdam,"Akna, Azerbaijan","Azerbaijani ghost town, decaying after a war left it an armed forces buffer zone.",https://www.atlasobscura.com/places/agdam-ghost-city,"The fall of the Soviet Union left much of Eastern Europe in chaos. From the rubble of the fallen Russian behemoth, an Armenian autonomous nation called the Nagorno-Karabakh Republic arose in the nation of Azerbaijan, causing a vicious war that eventually left the town of Ağdam in ruins, completely abandoned and falling apart. Shells bombarded the town of 40,000, reducing many of the buildings to crumbling and smoldering remains. As the invasion raged through 1993, every resident was forced to flee the area. Once the town was abandoned, the Armenian military spitefully destroyed most of the remains of the town, so it could never fall into Azerbaijani hands again. Today, only the bombed-out skeletons of buildings remain, along with the former town’s mosque, which is badly damaged and was being used to house Armenian livestock. Although the area is no longer embroiled in conflict, Ağdam is a ghost town and is used as a buffer zone by the Armenian military. As long as its status remains unchanged, this shell of a town will remain empty and decaying.",
29,Palace of the Shaki Khans,"Shaki, Azerbaijan",Foreign invaders almost left this lovely Caucasus palace alone—almost.,https://www.atlasobscura.com/places/palace-of-the-shaki-khans,"At the foot of the Caucasus mountains lies an escape: a wooden chalet called the Palace of the Shaki Khans. Gorgeous but tiny, it was built as a prayer that the world’s revolutions would pass by the Caucasus. Unfortunately for the Shaki Khans, they didn’t. The Shaki Khans’ summer palace is located a few hours from Baku, an ancient city that today is rapidly replacing its stone buildings with glass skyscrapers. Perched high in the Caucasus mountains, the palace itself looks like the setting for a Wes Anderson movie. It is painstakingly symmetrical and more cosmopolitan than one might think for a mountain refuge. French stained glass, Russian wood, Ottoman ceramics, and Iranian mirrorwork decorate all of the facets. One can easily imagine the early 1800s, when the Shaki princes sat in its now-quiet halls, speaking of their grandeur. Those same princes spent their nights fearing what would happen when the world’s warlords would finally discover their corner of the mountains. Surrounded as it is by mile-high peaks, there is no good reason for Shaki to be targeted by an invading army. The town is located in what is now Azerbaijan, but for thousands of years, it remained a forgotten front as wars between the Ottoman, Russian, and Persian empires raged on all sides. Shaki’s rulers (called “khans”) were quite happy with this arrangement. They were free to sell their silk to the world, free from the greater region’s rampaging hordes. Today, visitors can march through the palace like the Russian army eventually did in 1819. You can gape at the tile work, which depicts the bearded Shaki cavalry bearing pikes topped with mustachioed heads, or squint at the sun setting into mirrors carved like a Tsarina’s ring. While getting lost in the delicate finery of the palace’s details, one finds the mind wandering into territory involving the intricacies of maintaining the daily rituals of a fantasy kingdom in the Caucasus, and what the invading army might have felt when they burst the Shaki’s bubble.",
30,Heydar Aliyev Center,"Baku, Azerbaijan","The building's fluid, wavelike walls are a true feat of architectural ingenuity.",https://www.atlasobscura.com/places/heydar-aliyev-center,"In the city of Baku, Azerbaijan, a wave-like building rises from a bed of concrete. Its immobile white walls look as though they’ve been frozen mid-ripple. The abstract architecture is unlike anything else in the capital city. The Heydar Aliyev Center, which was designed by renowned architect Zaha Hadid and completed in 2012, is rumored to be one of the most expensive buildings per square foot. Its rolling, flowing design made waves within architectural, engineering, and design circles and garnered it much prestigious international recognition. Its odd design stands in stark contrast to the Soviet Modernist styles typically found throughout Baku. Inside, the building offers a tranquil environment full of white space and curved lines. The center contains a museum, gallery hall, and auditorium. Its fluid, folding walls are symbolic of its relationship with the physical and cultural landscape of the city. The entire design is meant to represent Azerbaijan’s dedication to blending its past with its future, as evidenced by the building’s slogan of, “To the future with values!” However, the center’s unconventional architecture and groundbreaking design weren’t the only things to put it on the world map. According to the Human Rights Watch, the government forcefully displaced locals to make room for the urban development initiative the center was part of. Over 250 homes were cleared while making space for the building.",
31,Alinjagala,"Alinja, Azerbaijan","In the foothills of the lesser Caucasus, a centuries-old fortress still stands.",https://www.atlasobscura.com/places/alinja-tower,"Atop Alinja Mountain in Azerbaijan sits an impressive fortress known as Alinjagala or Alinja Tower. Though the exact details of its origins are not known, historical evidence points to a fortification at this site dating back to the first century, established by the Armenian lords of Syunik. The mountaintop fortress had dozens of buildings, including barracks, warehouses, a bathhouse, stables, kitchens, an arsenal, treasury, and the ruler’s palace. It is surrounded by thick stone walls, and accessible by a steep hiking path. Over the centuries, multiple families of lords came and went, but the imposing fortress stands still on its sloped foundation in the slope of a mountain in the Nakhchivan Autonomous Republic, a large exclave of Azerbaijan. From its position overlooking the Alinjachay, it has withstood many attacks. A common story holds that, in the 14th century, the fortress survived a 14-year siege. In 2014, Alinjagala was recognized as a historical and cultural museum-reserve.",
32,The Maiden Tower,"Baku, Azerbaijan",This mysterious but iconic tapered tower appears in many Azeri fairytales and legends.,https://www.atlasobscura.com/places/maiden-tower,"The Maiden Tower is the oldest structure in Baku’s old walled city. No one is entirely sure when it was built, or for what purpose, or even the origins of the name. Yet this mysterious and curious tower is a symbol of Azerbaijan’s capital city and even appears on the national currency, the Azerbaijani manat. Many experts believe the tower was completed in the 12th century, along with most of the medieval walled city. But the different appearance of the stones that form the foundation and the first three stories suggests the original structure may date as far back as 600 BC. As this predates the arrival of the Islamic religion, it’s possible the building began as a Zoroastrian temple. It’s also been suggested that the tower could have been used as an astronomical observatory, speculation corroborated by the correlation between stone protrusions at the upper and lower levels and the lunar cycle. The Maiden Tower is 97 feet tall and 54 feet in diameter at the base, which narrows gradually moving upward. The truncated cone shape, thickness of the walls, and deep foundations are likely responsible for the longevity of the tower. Baku’s enigmatic tower has certainly taken hold of local folklore, being the stage where many popular legends unfold. The most famous of these tales tells the story of a king’s daughter who took her own life by jumping off the top of the tower to escape from a marriage of strategic convenience. According to the legend, this is how the tower acquired its name. Several variations of this story exist and have been expressed in the form of poems, plays, fairytales, and a famous ballet.","Inside the Maiden Tower is a museum dedicated to the history of the city of Baku. For a fee, you can climb to the top of the tower, which offers excellent views of the city and the bay."
33,Krasnaya Sloboda (Qırmızı QƏsƏbƏ),"Qirmizi Qasaba, Azerbaijan",What might be the largest completely Jewish town in the world outside of Israel now faces dwindling numbers and empty streets.,https://www.atlasobscura.com/places/krasnaya-sloboda-qirmizi-q-s-b,"Long before the holocaust and subsequent creation of the free state of Israel, disenfranchised Jews along the shores of the Caspian sea fought for, and succeeded in, the establishment of a protected settlement where they could live and thrive free of persecution. More than two centuries prior to World War II, what were formally known as the Highland Jews in Azerbaijan lived in fear of their own neighbors and members of competing religious factions. Unable to gain a foothold in any majorly settled area, the Highland Jews found themselves unsupported and disproportionally scattered throughout the region. A decision was made to form a purpose-built settlement across the river from the region of Quba, where the strength of community and larger numbers might protect the Jews from undue hardships. Not long after the settlement began, an official status was formally proposed as the state of Yevreiskaya Sloboda, or Jewish Town, and the Khan of Quba granted the town protected status, allowing the continued organization and settlement of Jewish citizens in large numbers without fear of discrimination, retribution, or clashes with neighboring towns and states. The ensuing history of the town would closely follow the major events of Eastern Europe as a whole, with citizens once again fearing for the worst as renewed fighting and waves of persecution swept through the Jewish communities of the continent at large. At the outset of World War II, the Jews of Yevreiskaya Sloboda were relatively shielded from the horrors of Nazi-occupied Europe due to the town’s location inside the newly-formed Soviet Union. To reflect that association, the town’s name was officially changed to Krasnaya Sloboda, or Red Town. Today, Yevreiskaya Sloboda faces the new and daunting challenge of a dwindling population, as a majority of its citizens have left for Israel or other now-safe locations in Europe or North America. At its height, nearly 18,000 Jews inhabited Yevreiskaya Sloboda, but the town’s numbers now barely surpass 3,500. As a result, many of the beautifully architectured buildings, with their long and rich history, sit abandoned or in disrepair.",
34,Naftalan Clinic,"Naftalan, Azerbaijan","In oil-rich Azerbaijan, people bathe in the black stuff.",https://www.atlasobscura.com/places/oil-spa-naftalan,"In the James Bond film “Quantum of Solace” (2008), Gemma Arterton is killed by getting covered in crude oil. In Azerbaijan, a country whose wealth has been built around its vast oil and gas reserves, and has been known since ancient times as the “Land of Fire,” people seem to be less concerned about the health risks of crude oil. On the contrary, in the small town of Naftalan, local oil is even regarded as having beneficial therapeutic effects, and people are happy to bathe in it. Naftalan, as local scientists eagerly point out, is the only place in the world in which oil has (allegedly) thermal qualities. Naftalan (literally translated as “taking the oils”) is thus the only spa town in the world where treatments do not involve water, but oil. Astonishingly, the first accounts of the healing oil of Azerbaijan were made by Marco Polo in the 13th century. He had never visited Naftalan, but noted in his travel accounts stories of magical therapeutic oil springs he had heard about in the area of today’s Azerbaijan. At the end of the 19th century, a German chemist began to export bottled oil from Naftalan, which soon became extremely popular in Russia and neigboring countries. The spa is not one of those contemporary ethereal beauty temples, but rather a clinical Soviet sanatorium-style affair. A number of treatments are offered, but the most popular is to simply bathe in the black stuff, which after a bathing session, is thoroughly scrubbed down the body. During the Soviet Union, when the spa town had its heyday, Naftalan was one of the most important spa towns in the Caucasus region, and received up to 75,000 visitors annually. Immediately after Azerbaijan’s independence, when relations with Russia notably cooled down and the Caucasus fell into a number of violent conflicts, Naftalan received very few guests. Back then, a number of the sanatoria had been turned into refugee camps for IDPs, who fled the horrors of the Armenia-Azerbaijan war. In recent years, the local government is working hard to restore Naftalan to its former glory, and hopes to attract Western tourists in the near future. The oil of Naftalan is claimed to be especially beneficial against psoriasis, arthritis and rheumatism.",
35,Tnjri,"Skhtorashen, Azerbaijan","Local legend says that whoever burns down this 2,000 year old tree will only have seven days to live.",https://www.atlasobscura.com/places/tnjri,"Through centuries of war and peace, countless regimes, and an uncertain future, one thing has remained constant in the small, disputed Republic of Artsakh (officially recognized as part of Azerbaijan)—the tree known as Tnjri. Estimated at over 2,030 years old the tree has grown massive, with a circumference reaching almost 90 feet and a height of over 170 feet. The hollow trunk is reportedly big enough for more than 100 people to fit inside. Some suggest that Tnjri, which in the Karabakh dialect means plane-tree, is the largest plane-tree (Platanus orientalis L.) in the world. According to lore of the local Armenian population, the tree was said to have been visited by many Armenian greats, including the inventor of the Armenian alphabet, Mesrop Mashtots, in the 5th century; Armenia’s first historian, Movses Khorenatsi also in the 5th century; and the musician and poet Sayat-Nova in the 18th century. The size and age of the tree has also garnered the plant a spiritual significance among the local people, many of whom see the tree as sacred. There is even a legend that states that anyone who burns it down will die within seven days. This likely arose as a manner of protecting the ancient arbor since it has survived multiple close calls with arsonists trying to set it ablaze over the years. At one point the problem was so bad a full time guard had to be posted under the tree. Despite the many attempts at its life, Tnjri has survived through long eras and regimes. When the country was under Soviet control, Tnjri was said to be the tallest tree in Russia. However through it all Tnjri has remained an important shrine to the local people and a popular site for visitors looking a see a physical symbol of Armenia’s history.","By foot from Karmir Shuka (Red Market), visitors can follow the Janapar Trail up the hill to Tnjri. Blue markers (some with a yellow foot) denote the trail. The tree is also accessible by car from the main North-South Highway."
36,Lahıc,"Lahıc, Azerbaijan",The village's cobblestone streets are lined with shops displaying exquisite copper craftsmanship.,https://www.atlasobscura.com/places/lahic,"Lahıc is a village in the Great Caucasus mountains that’s packed with wonderful artisanal shops. Part and parcel of a visit to Lahıc is not just what you see, but also what you hear. Upon stepping in the village, the first sounds you’ll hear are usually those of metal being hammered in and out of shape, and metal clanging together as the shop owners re-arrange their merchandise. A walk along Lahıc’s photogenic cobblestone alleys reveals a wealth of shops selling masterfully crafted copperware, and perhaps more interestingly, a glimpse at how coppersmiths can bring these wares to life. These artisans are not only keen on demonstrating their skills—they are also storytellers, and if you can overcome language barriers, you can learn about the artisans’ families and ancestry. Items for sale include swords, daggers, statuettes, cups, plates, pitchers, kettles, alembics, cooking utensils, farming tools, incense burners, jewelry, and more, both new and old. The Azerbaijan Museum of National History has several copperware items manufactured in Lahıc on display. Make no mistake: Lahıc is touristy. During those stuffy summer weekends, throngs of people flock here from Baku seeking cooler temperatures and a touch of Azeri traditions. Yet, visit Lahıc in winter and you’re likely to be the only tourist in town. For architecture buffs, Lahıc has a 1,000-year-old sewage system that has defied countless earthquakes.","Lahıc can be reached using public transport. People heading to Lahıc can take a marshrutka, which leaves at irregular intervals from Ismailli, a small town well-connected to Baku by public transport. The road from Ismailli to Lahic is scenic but at times hair-raising, with steep drops at an uncomfortably close distance."
