index,attraction,location,blurb,url,description,tags
33,Black Star Square,"Accra, Ghana",An enormous public square and parade ground built to celebrate Ghana's independence.,https://www.atlasobscura.com/places/black-star-square,"In 1957, the Ghanaian politician and revolutionary leader Kwame Nkrumah led the Gold Coast, now Ghana, to its independence from Britain. Nkrumah became the first prime minister and president of Ghana, and to celebrate his nation’s newfound autonomy, he commissioned the construction of a huge public square. Black Star Square, also known as Independence Square, is located in Accra, Ghana, and is now the site for all the major military and civic parades in the Ghanaian capital. It was completed in 1961 to coincide with the state visit of Queen Elizabeth II. The young Queen was keen to keep the unstable African republic within the Commonwealth, and was adamant on making the tour of Ghana despite a spate of bombings that were rocking Accra in protest of Nkrumah’s rule. From the first parades in honor of the Queen’s visit all the way up to the present day, Black Star Square has hosted all of the country’s major national public gatherings, national festivals, military parades, concerts, and occasional fashion shows. None of these are more important than the Independence Day parades held in the square each year on March 6. To accommodate spectators at these events, large stands with a total seating capacity of 30,000 surround the edges of the square. And while these stands and the square itself are packed with people during events, the vast space tends to be all but empty on a typical day, save for a few soldiers and a scattering of tourists who come to see the principal monuments that sit on and around the park. These monuments include the Independence Arch to the south of the square, backdropped by the Gulf of Guinea. On the opposite side of the square but facing the arch is the Memorial of the Unknown Soldier, which honors the Ghanaian soldiers who fell fighting for their country. Just to the north of the main square is a roundabout, in the center of which stands the Black Star Gate, an imposing monument topped by the Black Star of Africa, the five-pointed star that symbolizes Africa in general and Ghana in particular. The monument bears the large inscription “AD 1957” and “Freedom and Justice.” In terms of overall size, there is an oft-repeated claim that Black Star Square is the second largest city square in the world after Tiananmen Square in Beijing. That, however, is wrong on a few counts. Firstly, Tiananmen Square is not the largest square in the world, but does sit comfortably in the top 10. Secondly, Black Star Square has an approximate area of 1,057,238 square feet (98,220 sq meters), and that’s a generous approximation. That could maybe squeeze the square into the world’s top 30 at best, perhaps rivaling Millennium Park in Chicago. And then, of course, there’s the whole definition of city parks, parade grounds etc. Still, it’s fair to say that Black Star Square could well be the largest square of its type in Africa, and that’s no mean achievement.","Black Star Square is located between 28th February Road and Accra's southern coastline. It's always open to the public unless there are ticketed events taking place. Be careful when taking photographs of the square and its monuments. Since 2011, the Independence Arch has been guarded by a handful of soldiers who prohibit people taking close-up photos of the Arch. It's best to always ask permission before taking any photos of monuments on the square, especially if they're being guarded by soldiers."
34,Agbogbloshie,"Accra, Ghana",The world’s largest digital waste dump has become a site where organized criminals hack into confidential government data.,https://www.atlasobscura.com/places/agbogbloshie,"Between 1960 and 1965, the GDP of Ghana increased by nearly 50%. As the country’s economy industrialized, migrants from the rural parts of Ghana flocked to Accra, the largest city in the country, in search of economic relief. The migrants lived in a large slum on the outskirts of Accra called “Old Fadama.” The impoverished neighborhood grew in the 1980s, when another wave of migrants entered the city, fleeing Ghana’s Konkomba-Nanumba War. The residents who settled in Old Fadama were densely packed - up to 20 Ghanaians sleeping in a single 40 square foot kiosk - with little clean water or health services to be found. This neighborhood was much like other deeply poverty-stricken areas - that is, until the early 2000s, when the first ships arrived filled with electronic waste - old computers, cameras, television sets, and everything in between - from the United States, Japan, and Europe. The developed world saw Ghana as a dumping ground for their digital leftovers, as it’s cheaper to send unprocessed e-waste off in bulk to a developing country than it is to actually recycle it. This activity is illegal under the Basel Convention, but the rich nations used the legal loophole of classifying the garbage as “donations” to “bridge the digital divide” between the developed and developing world. Suddenly, a section of Old Fadama was designated as a digital dumping ground, known as “Agbogbloshie.” In the years following the first e-waste, the Korle Lagoon, located inside Agbogbloshie, became one of the most polluted bodies of water on the planet, with levels of toxins 100 times the acceptable amount. At the same time, the young children of Agbogbloshie began to burn the e-waste for trace precious metals, earning them four to six dollars per day, but in the process exposing their young bodies to toxic and carcinogenic substances, causing, among other things, a lead poisoning rate of 80%. Life in Agbogbloshie was so bad that the region was nicknamed “Sodom and Gomorrah” after the two Biblical cities synonymous with harsh living conditions. However there was another valuable asset sitting in this Ghanaian e-dump: secrets. When e-waste is shipped from the United States and other Western countries to Ghana, the data is sometimes not properly overwritten or erased - and even if it is, there are unerasable pieces of data called “bad sectors”, which are unreachable by a computer’s transistors and cannot be overwritten. On certain computers, no matter how hard you try, you can’t completely delete every file that goes to an e-dump. This is a problem, or an opportunity, depending on who you are. Agbogbloshie is filled with hundreds of organized criminals who recover gigabytes of information from the personal computers of ordinary Americans. They can find credit card information, private financial data, and personal memorabilia. The US government even dumps their old electronics in Agbogbloshie, many of which contain classified government documents. Once they are dumped, there is a chance that someone will uncover the secret data, and in fact they have. Organized criminals have uncovered secret multi-million dollar agreements from the Defence Intelligence Agency, the Department of Homeland Security, and the TSA. These are the unintended consequences, besides the lead poisoning, cancer, and general horror, of rich nations treating someone else’s home as their trashcan.",
35,Sword of Okomfo Anokye,"Kumasi, Ghana","On the grounds of a hospital in Ghana, a legendary sword said to have been plunged into the earth hundreds of years ago.",https://www.atlasobscura.com/places/sword-of-okomfo-anokye,"On the grounds of a teaching hospital in south-central Ghana, a legendary sword is buried in the ground. It is said to have belonged to Okomfo Anokye, a leader of the Ashanti people who plunged it into the earth hundreds of years ago. Kwame Frimpong Anokye, popularly known as Okomfo Anokye, was a traditional priest and leader of the Ashanti people of Ghana. He helped establish new laws and customs to help reduce the influence of old traditional customs that were negatively influencing its people. Okomfo, which means priest, was an acquired title as he was believed to possess special abilities of healing and of controlling nature. The sword was used by Okomfo Anokye as a symbol to signify peace and unity among the Ashanti Empire. According to local history, the sword was pushed into the ground over 300 years ago. It is believed that Okomfo Anokye pronounced the sword to be immovable, and so it has remained. This is not due to lack of trying—there have been many attempts, including by well-known figures such as Mohammed Ali, who attempted to remove the sword in 1994. The sword has also attracted much attention over the years and even that of the Queen of England in 1961. The Okomfo Anokye sword site is also home to the Komfo Anokye Teaching Hospital, as the site is said to be a healing ground. It is also home to the famous golden stool of Asantema, where it was said to have descended from.",
36,Keita Fodeba Centre for Acrobatic Arts,"Conakry, Guinea",The school produces some of Africa's most talented acrobats and contortionists.,https://www.atlasobscura.com/places/keita-fodeba-centre-for-acrobatic-arts,"A school like no other, a typical day here might begin with some acrobatics and progress with a trapeze class or a turn on the trampoline. The Centre d’Art Acrobatique Keita Fodeba (Keita Fodeba Centre for Acrobatic Arts) in Conakry, Guinea, trains its young students to perform spectacular acrobatic feats that have astounded audiences world over. The center was founded in 1998 and it recruits street children and youth to train in acrobatics and contortionism, and also offers pre-professional training and literacy programs. The institution is a training hub for some of Africa’s greatest contortionists and acrobats. Performers from the school have toured internationally in Europe and North America and have sought to work with Cirque du Soleil and other acts. At any given time, it houses around 50 students, aging between 10 and 20. The school’s work has received acclaim from critics and activists alike, and it has been supported by UNICEF. Visitors are able to come watch the acrobats rehearse in the mornings in their training space near the Dixinn Stadium. The agility and enthusiasm of the young performers make it well worth the visit. Shows are also held in other venues in Conakry.",Hours are approximately 10 a.m. to 2 p.m. but may vary.
37,Tourist Office of Mali-ville,"Mali, Guinea",This small building is a living testament to the remoteness and warmth of the town that it represents.,https://www.atlasobscura.com/places/tourist-office-of-mali-ville-guinea,"No traveller arrives in Mali, a town in the far north of Guinea’s mountainous Fouta Djallon region, without a story to tell. Mali, which is sometimes referred to as Mali-ville to distinguish it from the neighboring country of the same name, is as remote as it is beautiful. The town sits among rolling green mountains that include Guinea’s highest point. Crisp weather and incredibly welcoming people give the area a special feel. There are basically two ways to reach Mali-ville. You could bump over difficult roads in utterly packed transport for several days from Conakry, or hike or motorbike up across barely extant trails from across the Senegalese border. Coming from Senegal takes two days and requires sleeping the night in the forest or, if you’re lucky, in one of the several villages on the way that exist off the road and electricity network. Given the difficult journey, it feels absolutely right and just that the local tourism board maintains an active office to welcome any visitors. The office acts as a food and stationary shop most of the time. But when a visitor arrives, they provide warm welcomes and seem genuinely delighted that someone has come to town. The office has a fascinating board which shows the number of tourists who have arrived in Mali every year since 1999, when only 20 visitors came through. There have been ups and downs since then, with a peak of 1,300, but always this remote Tourist Office has stood by, ready to give them a proper welcome.","It makes sense to come here first when you arrive in Mali. You will be asked to pay a very small per-visitor fee (around 2,000 CFA in 2019) and will get a chance to set up accommodations, tours in the area, or any other service. No addresses are noted in Mali, but any local will be able to point you to the ""Bureau Tourisme."""
