index,attraction,location,blurb,url,description,tags
64,Antonov An-24,"Ulaanbaatar, Mongolia",This massive piece of aviation history calls this residential neighborhood home.,https://www.atlasobscura.com/places/antonov-an-24,"A decommissioned Antonov An-24 aircraft sits by the road, boxed in by buildings in a residential neighborhood of Ulaanbaatar. Antonov An-24 airplanes were produced in the Soviet Union between 1959 and 1979, and only 1,264 models saw the light of day. China produced another 103 models of an aircraft identical to the Antonov An-24, but under the name Xian Y-7. The Antonov aircraft was equipped with two four-blade propellers powered by a turbine engine (a turboprop). The Antonov An-24 may not be the epitome of elegance and beauty, but was built to withstand harsh conditions, and it did. It was able to take off and land on unpaved surfaces and needed little maintenance. The sturdiness and reliability of the aircraft was perfect for the challenging environment of Mongolia. In the 1960s and 1970s, several models of Antonov An-24 were acquired by the Mongolian Air Force and by two civil operators, namely MIAT and Hangard Airline. These aircraft are no longer used in Mongolia neither for military nor for civil service. They were instead parked in residential Ulaanbaatar as part of the MIAT fleet. This particular aircraft currently belongs to the School of Mechanical Engineering and Transportation. It appears abandoned but is in fact, used for educational purposes. The buildings surrounding the aircraft resemble ordinary apartment blocks found in the same neighborhood. Measuring 77 feet (23.53 meters) in length and 26 feet (8.30 meters) in height, the Antonov An-24 looks out of place and makes for a curious sight in the neighborhood.",schools airplanes design history & culture
65,Choijin Lama Monastery,"Ulaanbaatar, Mongolia",The monastery survived the Communist revolution in Mongolia as a religious museum.,https://www.atlasobscura.com/places/choijin-lama-monastery,"Choijin Lama Monastery is a compound encompassing five temples, pleasant gardens, and a few meandering footpaths. This historical monastery is dwarfed by the striking modern buildings towering around it. The meeting of the new and the old architecture is conflicting and harmonious at once. Built using blue bricks and topped by a wooden roof, the temples in this monastery are rare specimens of pre-revolution structures exhibiting Chinese architecture in Mongolia. After four years of construction work, the monastery became operative in 1908, but soon after its inauguration, the monastery faced an uncertain future. The advent of the Communist revolution in Mongolia in 1921 brought with it the resolve to erase all manifestations of religious traditions. Very few monasteries and temples survived the purges, and those that did survive were deprived of their religious significance and reconceptualized as museums, buildings of historical importance, or simply used for administrative purposes. Choijin Lama Monastery survived as a museum of religious artifacts. Each of the five temples in the monastery is dedicated to a deity. The main temple features an 18th-century statue of the Shakyamuni Buddha. On its right is a statue of Choijin Lama, and on its left is the statue of Baldan Choephel (teacher and head monk) with his mummified remains encased. Together, these temples house a vast collection of Buddhist masks, thangkas (Buddhist paintings on fabric), sculptures, and scriptures. Along the wooden panes covering one of the temples are possibly the most eye-catching paintings in the entire complex. An array of gruesome images portray mangled bodies, severed limbs, and dangling organs. This is the section of the temple dedicated to the Naraka, or Buddhist Hell. This kind of religious art is meant to encourage believers to conduct a virtuous life and remind them to make merits in order to lessen the suffering in Naraka.",communism buddhism monasteries temples history & culture museums
66,Bagan,"Nyaung-U, Myanmar (Burma)","Over 2,000 ancient temples dot the Myanmar landscape at the site of this famed archaeological site.",https://www.atlasobscura.com/places/bagan,"At its prime, the former city of Bagan on the plains of central Burma was likely a wondrous metropolis of ornate, gleaming temple spires and ritual artistry. But it’s possibly even more beautiful and mysterious now that it’s a jaw-dropping ruin. During its heyday around the 12th century, the capital of the Kingdom of Pagan contained well over 10,000 Buddhist temples, stupas, and pagodas. Eventually, the city was brought to ruin by natural disasters and hordes of Mongols, who made light work of the city’s Buddhist inhabitants. Through the centuries, thousands of the temples and pagodas crumbled under their own weight or were destroyed, leaving only a little over 2,000 of the structures today. However, this has done little to diminish the scope of the city’s grandeur. The almost impossibly ornate temples that survive rise up out of the overgrown foliage. The structures, which burst from the plains, look like the creations of a lost civilization. While that is not strictly true, as many of the inhabitants of Bagan would sire the generations that created modern Myanmar, a sense of mystery still pervades the city. Still covering 26 square miles of land, the thousands of ruined temples and religious monuments are now a protected historical site. While some of the structures have fallen into complete disrepair, many others almost look as if they haven’t aged a day, thanks to modern restoration efforts.  The best place to lodge in the area is Old Bagan. With the influx of tourists in recent times, new hotels in New Bagan and Nyaung-U are also opening. Bagan can be toured on foot, giving you an impressive perspective of the old city, although the preferred method of experiencing the ruins (technically known as the Bagan Archaeological Zone today) is via hot air balloon. Balloon rides are offered that bring visitors to a vantage point where they can view the thousands of temples at once. However, the hot air balloon season in Bagan is very short (from October 1 to March 31) due to the extremely hot weather in the region. Other good alternatives to explore the archaeological site are horse carts (the old fashioned way) or e-bikes, which can be more efficient since the ruins are spread out.",buddhism temples archaeology ruins
67,Kakku Pagodas,Myanmar (Burma),This unique temple complex remains off the typical tourist trail.,https://www.atlasobscura.com/places/kakku-pagodas,"Kakku Pagoda offers a unique alternative to the plentiful temples spread throughout Southeast Asia. Visiting this extraordinary site takes time and effort. While most of Kakku’s stupas were built in the 17th and 18th centuries, the largest is believed to have been built in the 12th century during the reign of Alaungsithu, King of Bagan, as part of expanding religious sites across his empire. Since then, two main architectural designs have created a distinct forest of 2,478 needle stick pagodas that reach out to take the shape of Buddha’s footprint. From the main stupa, where wisps of omnipresent incense smoke perfume the musty air, visitors can walk through the small channels within rows of smaller stupas, each breathtaking in their nuanced designs, many featuring stucco reliefs in differing forms of veneration. While the renovation is ongoing, plenty of the stupas suffer from varying degrees of weathering and damage from the odd earthquake that blights many temple complexes within Myanmar. Due to its remoteness and location within Shan State, visitors are few, although the authorities have created a reflecting pool for photographic delights. Thankfully, unlike at other more famous temples, there isn’t the need to wait for hours to get that cover shot.  Tours are available from the Inle area. If traveling independently, admission to the site is US $3 and a compulsory, but knowledgeable, Pa-O guide costs $5 payable at the tourism office in Taunggyi. From there a taxi will take you and your guide on a bumpy two-hour ride to Kakku Pagodas complex. Nearby, a café will refuel you after the long journey and offers local delights and trinkets.",buddhism temples archaeology
68,Inwa,"Inn Wa, Myanmar (Burma)",A grand imperial capital left to fall into magnificent ruin.,https://www.atlasobscura.com/places/inwa,"For a total of 360 years spread over the course of five centuries, Inwa was the capital of successive Burmese kingdoms. Then, in 1839, it was leveled by earthquakes and subsequently abandoned. The wheel of fortune turns on us all, human and city alike. Inwa — also spelled Innwa, known in classical Pali as Ratanapura (“City of Gems”), and known locally as Awa or Ava — was originally founded in 1365. Located at the confluence of the Irrawaddy and Myitnge Rivers on an artificial island formed by a canal connecting the two rivers upstream from their natural point of meeting, Inwa was built to be the capital of a newly unified kingdom that came to be known, appropriately enough, as the Kingdom of Ava. And so it remained for 190 years, serving not only as the seat of power in Upper Burma, but also as the center of a flourishing period of Burmese literature. In 1555 the Kingdom of Ava fell. However, the city of Inwa and its political prestige lived on, serving as the capital of all of Burma from 1599 to 1613, then again from 1635 to 1752, then again from 1765 to 1783. Then again from 1821 to 1842. The aforementioned series of devastating earthquakes struck on March 22, 1839; the entire region was affected, but the capital was hit particularly hard. Although Inwa had been sacked, destroyed, and rebuilt several times over its long history, this time it would not be so. The city was not rebuilt, the capital was officially moved to Amarapura on February 10, 1842, and Inwa was left to the elements. The former imperial city is now a rural area where livestock graze and farmers raise crops amidst the remains of pagodas, palace towers, monasteries, and massive city walls that once formed the outline of a seated lion. One of the monasteries — Bagaya Kyaung, a towering structure built entirely of teak — is still in use as a monastery and school today. Local guides provide tours of the site via horse-drawn carts.",stupas pagodas palaces ghost towns towers temples abandoned ruins
69,The Mingun Pagoda and Bell,"Min Kun, Myanmar (Burma)",Gigantic unfinished stupa and the world's 2nd largest bell.,https://www.atlasobscura.com/places/mingun,"Nice pile of bricks you’ve got here. The Mingun Pahtodawgyi is a nice pile of bricks indeed and holds the record for being the biggest pile of bricks in the world. Intended to be a 500 foot high stupa, a mound housing Buddhist relics, the Pahtodawgyi remains unfinished to this day but is still an awe-inspiring structure. Measuring 450 by 450 feet and 172 feet high, it dwarfs the surrounding area, and would easily have rivaled the size of the Great Pyramid of Giza had King Bodawpaya finished its construction. Construction began in 1790, using mostly slave labor, and causing a massive drain on resources and manpower in the area. The project was widely unpopular during its time, which some suspect caused its cessation. King Bodawpaya was a superstitious man and during the construction, it was prophesied that the completion of the great stupa would cause his death or the destruction of the country. Worried about maintaining his empire, the king slowed progress on the stupa. When he died, construction was abandoned completely. Despite not completing the stupa, construction on an accompanying bell was finished, and was similarly grand in size. The finished bell weighed over 200,000 pounds and is 12 feet high. The massive bell can be rung by striking the outside since it has no internal ringing mechanism. Since the early 19th century, the stupa has become increasingly decrepit. An earthquake in 1839 left giant cracks along the face of the stupa, and wear and tear have led it to become almost natural looking. Without the bright white entrance, visitors could easily mistake the stupa for a large earthen mound, or simply a pile of bricks. Entrance is 5000 K (US $3.50)",pagodas sacred spaces ruins
70,Kyaiktiyo Pagoda,"Thaton District, Myanmar (Burma)",A precariously perched golden rock defies gravity and brings pilgrims from across Myanmar.,https://www.atlasobscura.com/places/kyaiktiyo,"Perched dangerously on the edge of a cliff, pilgrims have been visiting the Kyaiktiyo Pagoda for centuries to meditate and give offerings to the Buddha. Whether this worship keeps the boulder from rolling down the precipice is unclear, but the gold-leaf covered stone certainly inspires all who visit. At 25 feet high and 50 feet around, the golden boulder in Mon State, Myanmar is hard to miss. According to legend, a Buddhist hermit was given a strand of hair from the Buddha himself, which he then gave to the king. For his gift, the king offered the hermit a boulder shaped like his head, and used magical powers to pull the boulder from the ocean. The king then built the small pagoda atop the rock to enshrine the Buddha’s hair for all eternity and pilgrims have flocked to the site ever since. Although the pagoda is small by comparison to other grand Buddhist places of worship, its location on the precarious boulder makes up for its miniature 24-foot spire. Seemingly barely resting on its base, the precariously placed golden rock draws thousands every year. Pilgrimage is at its peak during the Full Moon day of Tabaung in March, when 90,000 candles are lit at the site and the golden boulder shines in the night sky. There is accommodation available at the top of the Mountain, or in Kinpun, at the foot of the Mountain, where you can then travel up by pick-up truck (one way costs 2,500 Kyat). Getting to Kinpun is a 4-5 hour bus ride from Yangon, or 6 hour train journey.",pagodas buddhism temples rocks geology sacred spaces
71,Shwedagon Pagoda,"Yangon, Myanmar (Burma)",This gem-encrusted temple is said to contain some of the Buddha's hair which can make the deaf hear and the blind see.,https://www.atlasobscura.com/places/shwedagon-pagoda,"Towering over the Burmese city of Yangon, the Shwedagon Pagoda is rumored to be the oldest Buddhist pagoda in the world, and more miraculous than the priceless gems and gold plates coating its exterior, it is also said to hold hairs from the head of Buddha himself. As the legend goes, two brothers were traveling when they encountered the Buddha beneath a tree. After feeding him, Buddha offered them a gift and gave them exactly eight hairs from his head. The brothers then carried the sacred hairs in a ruby casket back to their country where, with the help of the king, they began building what would become the Shwedagon Pagoda complex. When the casket containing the holy hair was opened, the relic unleashed a flood of miracles including causing the blind to see, the lame to walk, and seeing a rain of gemstones issue from the sky. A number of other relics were also entombed at the shrine including a holy staff, a piece of cloth from a sacred figures robe, and oddly a revered water filter. If the legend is believed, the pagoda is around 2,600 years old, but many scientists have placed its construction closer to 1,000 to 1,400 years old. Either way, the opulent site has survived through war and political turmoil in the area and still looms over Yangon in glittering glory. The large central stupa is covered in real gold plates that are constantly donated from countries around the world as needed, and its tip is encrusted with rubies and diamonds. Both spiritually and materially glorious, the Shwedagon Pagoda is one of the wonders of the modern Buddhist world, and may be one of the fanciest sites ever to be founded on a handful of hair. Head towards the golden stupa that towers over Yangon. Shwedagon Pagoda is open daily, from 4-22. Last admission is at 21:45. The ticket is valid for the whole day, so you can visit the pagoda during the day and also at night. Shwedagon Pagoda on weekends and middle of the day can get really crowded, so avoid this time. If possible hire a guide, who will explain everything about the pagoda and the rituals, enhancing your experience hugely. You won't be allowed to enter the temple grounds if you're dressed in shorts. You can rent or buy a sarong outside the entry gate.",pagodas relics relics and reliquaries buddhism temples
72,Saddar Cave,"Hpa-An, Myanmar (Burma)","Caves full of Buddhist statues, incredible rock formations and a deserted lagoon.",https://www.atlasobscura.com/places/saddar-cave,"Like other sacred sites in Myanmar’s Zwegabin mountain range, Saddar Cave has been decorated with hundreds of Buddhist statues over the years. The landscape around the small town of Hpa’an in Karen State, Myanmar, combines lush open fields and single, bulbous mountains. At the bottom of one such mountain is a steep staircase, painted white. Once at the top, a narrow path leads you into the Saddar Cave, hollowed out of the rock. Buddhist statues, like road signs of all different shapes and sizes, beckon visitors into the darkness. Hundreds of miniature golden icons not much bigger than playing cards form a mosaic onto the righthand side of the cave. You’ll pass a pagoda about the size of a small van and the light then weakens. Visitors must remove their shoes. Only then does the stench of bat droppings fill the nostrils. Sometimes you can hear the bats shriek. Inside the mountain, the painted faces of Buddhist sculptures occasionally flicker into view as you wander through the darkness. Karen State is famous for its Buddhist sites, but Saddar Cave is truly a natural wonder, as well as a holy place. Flash photography illuminates stalactites dripping from the ceiling and stalagmites rise up from the ground, formed over centuries. In one section of the cave a ray of sunshine beams down directly onto one of the largest stalagmites. The path ends at the entrance to open water, where a local boatman armed with a paddle next to a flat wooden canoe will continue your journey out of the cave and out onto a pristine blue lagoon. Paddle around and watch fisherman source their lunch against a backdrop of the limestone rock face. The Soe Brothers Hostel in Hpa'an arranges travel to Saddar Caves.",buddhism rock formations mountains caves ecosystems statues
73,World's Largest Book at Kuthodaw Pagoda,"Mandalay, Myanmar (Burma)","This golden temple is surrounded by hundreds of stone tablets that comprise the ""world's largest book.""",https://www.atlasobscura.com/places/world-s-largest-book-at-kuthodaw-pagoda,"Call it the “anti-Kindle,” call it the “world’s largest book,” or call it “really hard to read,” there is no disputing that the expansive tome etched on over 700 stone slabs surrounding Myanmar’s glittering Kuthodaw Pagoda form a volume that would test even the most ardent book lover. The Kuthodaw Pagoda was built 1857 by King Mindon Min. The gorgeous temple building is completely gilded on the exterior, giving it the look of a solid gold spectacle. However the true spectacle lays within the stark white stupas that surround its base. Beneath the pinnacled roofs of the squat little structures are 730 marble tablets (729 contain body of the text, while the 730th tablet describes their creation) covered on both sides with dense script. Taken all together, these comprise the entirety of Theravāda Buddhism’s religious canon, its tipitaka (a phrase meaning “three baskets,”which is a reference to the baskets in which the original Buddhist teachings were held). The thick stone tablets each stand over five feet tall and five inches thick. When the tablets were unveiled in 1868, each line of writing had been filled with golden ink and the stones were decorated with precious stones including rubies and diamonds. Unfortunately after the British invaded in the mid-1880s, the troops looted the temple site, stripping the slabs of their gold ink and gems. However today the sprawling book still stands, and the writing has been refilled with simple black ink so that while the opulent glory may have disappeared, the messages of the writings themselves live on for future generations. It might not be light reading, but it is assuredly enlightening.",pagodas world's largest buddhism books
74,Thanboddhay Pagoda,Myanmar (Burma),"Luxurious devotion and 500,000 images of Buddha in Myanmar.",https://www.atlasobscura.com/places/thanboddhay-pagoda,"On the average cathedral tour of Europe, tourists quietly take in the immense stained glass, the high vaulted ceilings and somber atmosphere. The average pagoda tour on the other hand is the complete opposite, and in many ways the most quintessential difference between East and West. Thanboddhay Pagoda is a massive Buddhist complex in Monywa, Myanmar. It is a gilded world, brightly screaming out praise for Buddha through colorful celebration. Throughout the area, each pillar and tower of the Pagoda is carefully and completely covered with images of Buddha. From statues inside the pagoda, to miniatures climbing the sides of the building itself, there are 500,000 depictions of Buddha in total. Although it was originally built in the early 14th century, it was reconstructed in 1939, and is incredibly preserved in its golden form. Unlike many other temples in Myanmar, the entrance is not guarded by lions. Instead, two imposing white elephants stand out against their shimmering backdrop. Since its reconstruction, the pagoda has been one of the largest tourist attractions in Myanmar, drawing awe-struck tourists and pious religious visitors alike.",pagodas giant buddhas sacred spaces
75,Mount Popa,"Myingyan, Myanmar (Burma)","Myanmar's Mount Olympus atop a 2,500-foot volcanic plug.",https://www.atlasobscura.com/places/sacred-mt-popa,"Established and maintained by a hermit in the early 20th century, the Mount Popa shrine and monastery precariously sits 2,500 feet off the ground on a massive volcanic formation in central Myanmar. Climbing 777 steps from the base of the vertical pedestal takes you to a monastery honoring what has come to be known as the center of Nat spirit activity in the nation. In Buddhist traditions of Myanmar, Nats are spirits of humans that met tragic ends and are portrayed accordingly in shrines across the country. One of the most well-known of the 37 spirits in the shrine of Mount Popa is Ko Gyi Kyaw, who died from his wild lifestyle and alcohol abuse. As the patron saint of tramps and alcoholics, his shrine is often covered in bottles of whiskey. Due to the Nat activity and shrine on Mount Popa, the area is known as the Mount Olympus of Myanmar. The shrine subsequently draws thousands of pilgrims every year, especially during full moon ceremonies two times per year. Non-religious visitors can enjoy panoramic views of the lush mountains, as well as the monkeys that live and beg for food around the monastery. Estimated 2,000 Rhesus macaques live in the monastery today and because of this, monkey poop is prevalent on the monastery steps (which pilgrims and visitors are supposed to climb barefoot). Consequently, a high number of people make their living cleaning up after the monkeys in exchange of a donation, and this fact has originated mixed feedback from visitors to Mount Popa.   Mount Popa is roughly 30 miles Southwest of Bagan. Wearing comfortable clothing covering the neckline and shoulders, cotton skirts (or pants) is ideal. The dress code is the same as for visiting Bagan temples. Since you are expected to walk barefoot, you can also bring socks to protect your feet.",rites and rituals geological oddities natural wonders geology nature sacred spaces
76,U Bein Bridge,"Mandalay, Myanmar (Burma)",The oldest teak bridge in the world is made from the remains of a royal palace.,https://www.atlasobscura.com/places/u-bein-bridge,"Stretching across Taungthaman Lake in Myanmar, the U Bein Bridge might look like just another rickety wooden crossing (which it is), but this historic span is actually made of the remains of a royal palace. Construction on the wooden bridge was completed in 1851 after three years. The bridge was built at a slight curve, and is supported by over a thousand wooden pillars that were hammered into the bottom of the shallow lake. The planks of teak that make up the surface of the bridge were taken from the old royal palace of Inwa, a former Burmese capital, that had been razed a number of times. The resulting bridge might not look very royal, but its history certainly is. Reaching three-quarters of a mile in length, the ramshackle span is surprisingly long for a wooden bridge with no rails, but it cuts a striking figure. The bridge has become one of the region’s most popular tourist attractions and most photographed features. It is especially striking in the evening when the colors of the sunset paint the scene in natural color. This of course means that the bridge becomes more crowded during those times. All the attention has taken its toll on the span. Some of the pillars have been replaced with concrete, and many of the original planks will need to be replaced or refurbished, lest they come off completely. Nonetheless, the bridge is still a beautiful and popular place to capture the beauty of Myanmar.",bridges architectural oddities architecture
