index,attraction,location,blurb,url,description,tags
23,Loango National Park,"Ndougou, Gabon","The true jewel of Africa's west coast known as ""Africa's Last Eden.""",https://www.atlasobscura.com/places/loango-national-park,"Imagine this: Walking along a pristine, uninhabited, unspoiled beach, the only sound is the waves crashing upon the shore, when you hear another less familiar sound that catches you off guard. The thundering trumpet of an elephant herd sauntering along the coastline, watchful mothers guarding their calves that frolic in the surf of the Atlantic Ocean. How about a hippopotamus caught among the waves and surfing to the shore? If this sounds impossible, you’ve never been to Loango National Park, ‘Africa’s Last Eden’. Situated between the Nkomi and Ndogo Lagoons, Loango National Park is home to a stunning diversity of habitats within its 1,550 km range, from savannas to 100 km of pristine, unoccupied beaches; from seemingly untouched virgin rain forests to the serpentine bends and gnarls of mangrove forests, Loango offers many sights for any true nature lover. Loango National Park also includes part of the 220 km² Iguéla Lagoon, the only significant example of a typical western African lagoon system that is protected entirely within a national park. For animal lovers, Loango National Park is a true paradise on earth. Gabon holds one of the highest densities of wildlife in the world, and Loango National Park proudly shows off its bountiful harvest to the world: forest elephants, hippos, red forest buffalo, leopards, crocodiles, western lowland gorillas, chimpanzees, sitatunga, duikers, a vast array of birds, a variety of different monkey species, and the world’s largest concentration of humpback whales and dolphins after South Africa. Visit while it still remains one of the few pristine places left on Earth.",
24,Oklo Reactor,"Mounana, Gabon",The world's first and only natural nuclear reactor.,https://www.atlasobscura.com/places/oklo-reactor,"Many people think nuclear power is an invention of mankind, and some even think it violates the laws of nature. But nuclear power is in fact a naturally occurring phenomenon, and life could not exist without it. That’s because our sun (and every other star for that matter) is itself a giant power plant, lighting up the solar system through a process known as thermonuclear fusion. Humans, however, generate power through a different process called nuclear fission, which releases energy by splitting atoms rather than combining them as in the fusion process. No matter how ingenious our race may seem though, even fission reactors are old news to Mother Nature. In a singular but well-documented circumstance, scientists have found evidence that naturally occurring fission reactors were created inside three uranium ore deposits in the west African country of Gabon. Two billion years ago, the uranium-rich mineral deposits became flooded with groundwater, setting off a self-sustaining nuclear chain reaction. The energy that was subsequently released then raised temperatures enough to begin boiling away the water, but when the mineral deposits eventually cooled down the nuclear reactions would start back up again. By examining the levels of certain isotopes of xenon gas (a byproduct of the uranium fission process) in the surrounding rock, scientists have determined the natural reactor proceeded in this start-stop fashion at intervals of about two and a half hours. In this manner, the uranium deposits in the Oklo region of Gabon created a natural nuclear power plant that operated for hundreds of thousands of years until most of the fissile uranium was depleted. While a majority of the uranium at Oklo is the non-fissile isotope U238, only about 3% needed to be the fissile isotope U235 for the chain reaction to start. Today, that percent of fissile uranium in the deposits is around 0.7%, indicating that the deposit had sustained reactions for a relatively long period of time. But it was this exact characteristic of the rocks from Oklo that first puzzled scientists. The low levels of U235 were first noticed in 1972 by employees of the Pierrelatte uranium enrichment facility in France. During routine mass spectrometry analysis of samples from the Oklo mine, it was discovered that the concentration of the fissile uranium isotope differed by three thousandths of a percent (0.003%) from the expected value. This seemingly small difference was significant enough to alert authorities, who were concerned that the missing uranium could be used to develop nuclear weapons. But later that year, scientists found the answer to the two-billion-year-old secret: the world’s first, and only natural, nuclear reactor.",
25,Kakum Canopy Walk,"Assin South, Ghana",This series of rope-style bridges brings visitors into a jungle layer that is usually reserved for birds and monkeys.,https://www.atlasobscura.com/places/kakum-canopy-walk,"Unique on the African continent, the Kakum Canopy Walk allows hikers to experience a portion of the jungle usually reserved for climbers and fliers thanks to a trail of precariously hung suspension bridges. Located in the thick tropical jungle of Kakum National Park, the canopy walk was actually designed by a pair of Canadian engineers and five Ghanaians. Looking to increase tourism (specifically ecotourism) in the largely ignored national park, the designers wanted to create a unique feature that would make the park a destination, thus an elevated trail through the canopy was devised. Opened on Earth Day in 1995, the canopy walkway consists of seven separate bridges that hang from the trees over 130 feet above the ground. Across over 1,000 feet of walkway, the bridges look as though they are constructed like a traditional rope bridge made from the materials of the forest, however the sturdy spans are made of wire rope, aluminum, and wooden planks, and even have safety netting to keep people from plummeting off the trail.","Easiest to visit by car but you can easily find a taxi for a day trip in Cape Coast. Also worth stopping for lunch at Hans Cottage Botel, where you can pet a crocodile."
26,La Tante DC 10,"Accra, Ghana","This grounded passenger jet is now a restaurant, complete with rows of seats and “flight attendant” servers.",https://www.atlasobscura.com/places/la-tante-dc-10,"Anyone can board the McDonnell Douglas DC-10 passenger jet parked on Airport Road. The aircraft sits along the route to Kotoka International Airport in Accra, Ghana’s capital city, but it won’t take you anywhere. However, the food is a far cry from the tray of disappointment that most passengers are accustomed to picking at while aboard a plane. Now a restaurant known as La Tante DC 10, this aircraft was once operated by Ghana Airways on flights to Europe and the United States. In 2005, the DC-10 ended up impounded at London’s Heathrow airport as a result of unpaid company debts. Nearly a decade later, a business partnered with Ghana Airports Company Limited, to transform the retired vehicle into an eatery. Today, curious visitors and residents alike can enjoy unique meal service delivered by waitstaff in flight attendant uniforms. Customers board just as they would an operational vessel, by embarking up a covered stairway. For some, it’s their first look inside an airplane. The plane’s new management reduced capacity from 380 seats to 118, clearing space for wider walkways and dining tables. First-class seats accented with festive pillows serve as a waiting area and bar seating, while the economy section houses the dining room, which is composed of tables with rows of airplane seats facing each other. Menu offerings include an extensive array of traditional cuisine, as well as international dishes. Foreign fare, such as spaghetti and sandwiches, populate one section of the menu, but the “Proud to be Ghanian” page offers diners a selection of the country’s authentic culinary mainstays. Don’t miss local specialties such as palm nut soup, grilled tilapia, and garden eggs stew. Update as of February 2023: The restaurant no longer has a dine-in option on the plane. They only offer food to go and do not allow you into the plane. It is unclear if this is permanent.","The restaurant is located just a few minutes away from the terminals at Kotoka International Airport. If you are coming in through the Holiday Inn side of the restaurant, you may encounter security. Simply let them know you're heading to the restaurant. Hours are 12:00 p.m. to 10:00 p.m."
27,Cape Coast Castle,"Cape Coast, Ghana","Where thousands of slaves passed through the ""Door of No Return.""",https://www.atlasobscura.com/places/cape-coast-castle,"When President Obama visited Ghana’s Cape Coast Castle in July, 2009, he remarked that “it reminds us of the capacity of human beings to commit great evil.” This castle in Cape Coast, Ghana—once known as the Gold Coast of West Africa—was one of around 40 “slave castles” that served as prisons and embarkation points for slaves en route to the Americas (the Caribbean, South America, and the U.S.). Thousands of enslaved Africans from regions near and far, sometimes hundreds of miles away, were taken to these castles to be sold to slave ships. One of the most well known parts of Cape Coast Castle, that you can visit today, is the “Door of No Return,” which led slaves out of the castle and onto the ships setting off on the Middle Passage. Their boat journeys could last several months, and an estimated 15 percent of slaves died aboard, en route. Somewhere around 12 millions slaves were sent from Africa, millions of whom died in the process. Cape Coast Castle was a way station in history’s largest, and darkest, forced human migration. The history of the castle, which could also be termed a fort, is predictably complicated and contentious. Possession of it was stolen back and forth as the slave trade grew bigger and more lucrative in the 1600s and 1700s. The site’s first establishment was built by the Swedish Africa Company, whose officers had established good relations with local chiefs. In 1650, Swede Hendrik Caerloff finagled the King of Fetu’s permission to build a fort, and in 1653, Carlusborg Fort was erected. It was snatched by the Danish West India Company in 1657, and seized back and forth between the Danish, Dutch, and Swedes, competitors in the growing slave economy. When the King of Fetu died in 1663, the Dutch seized control for a hot second before the British swooped in, in 1664. The British renamed it Cape Coast Castle and managed to maintain possession, though there were a few close calls. In 1757, for example, an attack by the French badly damaged the fort, leading to a complete reconstruction. Tens of thousands of bricks and tiles were imported from England in 1797 for the reconstruction effort, which was also intended to expand the castle’s slave-holding capacity. When you visit Cape Coast Castle today, the main destination in the calm and breezy seaside town of Cape Coast, you can tour the entire expansive building, from the ramparts lined with cannons to the nearly lightless dungeons. These dungeons, called “slave holes” by the British, had essentially no ventilation nor windows, with 200 slaves, separated by gender, crammed in one room, and the floor covered in human waste. Diseases like malaria and yellow fever were common under such wretched conditions. As many as 1,500 slaves (two-thirds of whom were male) were held in the castle dungeons at any one time. When you walk through the dungeons today, it is terrifying to imagine the reality of what took place in these suffocating spaces just over two centuries ago. Then, moments later, you’ll be out of the dungeons and wandering by the church or strolling down long hallways leading to officer’s quarters with pleasant views over the sea—two adjacent spaces set entire worlds apart. The Brits formally declared the slave trade illegal in 1807, though Cape Coast Castle remained their local headquarters on the Gold Coast until 1877. The British Public Works Department later restored the premises in 1920s, and retained ownership right up until Ghana’s independence in 1957, at which point the castle came under the purview of the Ghana Museums and Monuments Board. Though the remains of other slave castles exist along the former Gold Coast, Cape Coast Castle is one of the most well restored and well known. It is well worth a visit to remind each of us of the many corners of the globe involved in the former slave trade—and a reminder that many more such corners still exist.","Cape Coast can be reached by car or bus (a tro tro is your best bet) from Accra, Ghana's capital city. Travel time will probably be between three to four hours."
28,Sacred Crocodile Ponds of Paga,"Paga, Ghana",The souls of the dead have made these Ghanese crocodiles shockingly docile.,https://www.atlasobscura.com/places/sacred-crocodile-ponds-of-paga,"Along Ghana’s northern border, many villagers are inside of crocodiles. Luckily, they have not been eaten; the reptiles simply hold their souls. In the town of Paga, nestled right up against Burkina Faso, is a sacred crocodile pond where locals believe that crocodiles hold the souls of the village’s deceased. High profile deaths in the community have even coincided with the deaths of some of the sacred crocodiles. Ancestors’ souls or not, the crocodiles of the sacred pond in Paga are protected and allegedly as safe as any domesticated pet. The residents of Paga certainly treat them as such, regularly interacting with the 110 crocodiles in the main crocodile sanctuary, Chief’s Pond. What’s even more stunning, no one has ever been harmed by one of the crocodiles. Young children swim in the pond and Ghanaians along with tourists are invited to touch and practically play with the reptiles. The people of the town wash clothes next to the bumpy ridges of the crocodiles’ jaws without a hint of fear. Even more remarkable than the docile nature of this crocodile population, is how these massive crocodiles made the pond their home. The pond is completely landlocked and apparently the oldest beasts in the water are over 80 years old. Yet here they are, ready and waiting for tourists to feed them live chickens, sit on them, or lift their spiny tails. Crocodiles have been on earth for over 200 million years, even outliving the dinosaurs. And more importantly, their behavior in Paga is without comparison. For the legions of tourists seeking a wild Africa full of the world’s most impressive and dangerous beasts, Paga’s a good start to their journey. A small fee to a local tour guide is required for interpretation and the purchase of the crocodile’s live chicken dinner.",Paga is North of Bolgatonga near the border of Ghana and Burkina Faso.
29,Mole National Park,"West Gonja, Ghana",At Ghana's largest wildlife refuge you feel like you're right in the animals' backyard.,https://www.atlasobscura.com/places/mole-national-park,"As you walk around the restaurant and visitor’s center at Mole National Park, you’ll pass by warthogs wandering along on their way, possibly even an elephant that has strayed from the group. At Ghana’s largest wildlife refuge, life is relaxed and no one is in a rush to get anywhere. Mole National Park (pronounced Moh-lay) is located in northwest Ghana, about 90 miles from the major city of Tamale. The grounds are still fairly undeveloped and untouristed due to the park’s remote location, which makes it feel like you are truly wandering around the animals’ backyard. The park was established in 1964, though the land was first set aside as a game reserve in 1958, a year after Ghana’s independence from Britain. The park spans about 3,000 square miles, fed by the seasonal Lovi and Mole rivers. On the grounds there is a motel and pool that look from a cliffside out across the savanna woodland, from which you can watch herds of elephants meandering by the water holes below. The park is home to 90 mammalian species (including five types of primates), 734 species of flower plants, 56 butterfly species, and enough bird species to attract avid birders—at least 300 species, including the white-backed vulture and Senegal parrot. However, because of the few dozen villages located near the park boundaries, subsistence hunting continues to pose a problem for preserving the wildlife. What’s more, the elephants’ former migration route into southern Burkina Faso has been obstructed by human settlement, and seemingly less frequented as a result. You can take jeep safari tours around the park’s rust red dirt roads, and are often able to get right up close to the elephants (there are around 500 total) and possibly pass by antelopes, hippos, hartebeests, buffalo and monkeys. The poor maintenance of the roads—which access only a small fraction of the park—is a loss to visitors, but a gain for the wildlife.","The park is 146km (90 miles) southeast of the major city of Tamale. The best way to get there is a bus, shared car, or van, through which you can likely arrange transport both ways."
30,Tengzug Shrine,"Bolgatanga, Ghana",Topless shrine of northern Ghana.,https://www.atlasobscura.com/places/tengzug-shrine,"The Talensis people of Northern Ghana require you to be topless to observe one of their sacred rituals. With the smell of animal blood and feces bombarding their senses, man and woman alike must bare themselves to the sub-Saharan heat to enter the Tengzug Shrine in the Tongo Hills. The Tengzug Shrine, one of the most famous in the region, was once a hideout for slaves evading their captors. Now, it is used more traditionally for religious animal sacrifices for good luck and to please the ancestors of the Talensis. With a guide, visitors can scale the rocks up to the Tengzug Shrine, remove their tops and witness the sacrifice of birds and chickens. In the shrine, among the remnants of the recently sacrificed, visitors get a panoramic view of the region and the surreal world of the Tongo Hills. Giant Baobab trees and boulders define the dry landscape that draws both tourists and religious pilgrims. The Tongo Hills comprise only twenty square kilometers, but are richly packed with history, religious significance, and fantastic hiking. Along with the many shrines tucked away in the rock formations of the area, the local population has rebuilt a number of classic Talensis homes. Shaped like cylinders and grouped into neighborhoods, the homes have miniature doorways, followed by a short wall inside the home that allows for protection from intruders. Other than the doorway and a few holes for smoke to exit the structure, they are completely closed off to the outside world. The Tongo Hills give visitors a window into the world of the Talensis, and visitors coming at the right times can experience one of the region’s vibrant festivals. In March, the Talensi celebrate the Golob Festival focusing on the sowing of the fields. With a bit more show to it, the Bo’araam Festival in October and November includes drinking traditional beer and the sacrifice of donkeys, goats, and fowl.",Located just a short drive from Bolgatanga in northern Ghana.
31,Larabanga Mosque,"Larabanga, Ghana","The first mosque in Ghana is known as the ""Mecca of West Africa.""",https://www.atlasobscura.com/places/larabanga-mosque,"The Larabanga Mosque is the oldest in all of Ghana, possibly in all of West Africa. It has survived for centuries despite inclement weather and bad reconstruction projects. As the legend goes, Ayuba, a Moorish trader, was traveling across the Sahara in 1421 when he spent the night in the village of Larabanga. He received instructions in a dream to construct a mosque in the village, and when he awoke the foundations had already been set for him. He built the mosque in the traditional Sudanic-Sahelian style, from mud and reeds. Each side of the building bore a separate entrance: one for men, one for women, one for Larabanga’s chief, and one for the muezzin who calls the community to prayer. Ayuba remained in Larabanga for the rest of his life, and when his remains were buried beneath a nearby baobab tree, the leaves were said to have special healing powers. By the 1970s the mosque was badly deteriorated and in need of reconstruction. A reconstruction crew applied cement to the walls in the hopes of strengthening them, but the mixture allowed moisture to penetrate the ancient wooden beams. A termite infestation followed, and a storm toppled the weakened minaret. With support from the World Monuments Fund, the Ghana Museums and Monuments Board, and American Express, the conservators then employed local artisans to fix their mistakes. They carefully removed the cement and reapplied a mud paste much like Ayuba had used 550 years prior. The minaret was rebuilt, the walls were whitewashed, and the mosque was restored to its former glory. Today, perhaps because of the mistakes of the 20th century, the mosque is largely maintained by the local community. They still worship in the ancient building, but they also reap the profits of the many tourists who come to visit the holy site.","If you can, find a man from the village named Ibrahim. He works with the local orphanage and at Mole, and can help you coordinate a visit to the mosque. He is very passionate about his community and wants to share his culture with visitors. The official viewing fee for the mosque is GH¢ 1.00. Non-Muslims are not allowed to enter the mosque."
32,Ga-Adangbe Caskets - Kane Kwei Carpentry Workshop,"Accra, Ghana",The clever workshop that has been designing some of the most unusual coffins imaginable.,https://www.atlasobscura.com/places/ga-adangbe-caskets,"When members of the Ga-Adangbe in Ghana die, they move into their next life and affect the living from beyond the grave. To guarantee smooth transfer into the next world, their descendants bury them in elaborate coffins, made to symbolize their lives. In the 1950s, a fisherman from Accra was buried in a fish-shaped coffin. He had made his livelihood from the sea and wanted to move into his next life in a reflection of the being that had supported him. Shortly after the first symbolic fish coffin was built, a number of skilled carpenters popularized the practice around Accra. Seth Kane Kwei, one of the original creators of the coffins, opened the first special workshop dedicated to making the specialized caskets and the trade began to blossom. Coffins range from representations of careers, such as the fish or a taxicab, to more detailed depictions of the deceased habits. Alcohol bottle and cigarette-shaped coffins portraying the vice of the dead is also not unknown. Anything representing the life of the family member is chosen, and serves as the vessel guiding the deceased to their next life. Today, the Ga-Adangbe are well known for their coffins, which often appear bizarre to Western visitors used to solemn funerary rights. Although Ga funerals are still a sad event, the unique coffins allow them to celebrate the life of the deceased and cull favor with their ancestors. Even though many Ga have very low income, they spend massive amounts to buy the specialized coffins, which can cost anywhere from $50 to $600. Kwei’s sons and grandsons are still designing caskets in a quirky variety of shapes. Their creations range from bananas and robots to firetrucks and spoons - whatever most encapsulates the spirit and personality of the loved one.",
