index,attraction,location,blurb,url,description,tags
50,Dhaka Shipyard,"Keraniganj, Bangladesh",The shipyards along the outskirts of the Bangladesh capital are a flurry dangerous boat breaking and rebuilding.,https://www.atlasobscura.com/places/dhaka-shipyard,"Towering near the banks of Buriganga River on the outskirts of Dhaka, the crude shipyards are a frighteningly dangerous if, fascinating, hive of industrial activity. While it is not the largest shipyard in the country (that honor belongs to the Chittagong Ship Breaking Yard), the Dhaka yard in the town of Keraniganj shares the seeming disregard for worker safety that can be found in simialr industrial sites around the country. The facilities, which employ around 15,000 workers at around $5 a day, work to both break down massive shipping vessels as well as create new ships from the parts. Workers can be seen torches and welding equipment to tears huge pieces of metal from the vessels, sans eye, hand, or face protection. Other workers will be found scaling the tall ships on ramshackle ladders or strolling along the high edges of the ship decks, the only thing to keep them from falling is their own balance. Injuries are common on the site, but the buzz of activity doesn’t stop. The ships being worked on are propped up on crude chalks creating the appearance that the river simply receded and left these hulks stranded on dry land. The space is tight so many of the boats are right up to small homes and other structures. This is clearly a worksite that is dangerous to its employees, and even more so to careless visitors. However local guides can be found who will assist anyone curious about the industrial dangers that still plague the world.","On the Buriganga River, opposite Sadarghat (boat terminal)Coordinates for this place of frenzy are 23.701981°, 90.409969°"
51,Armenian Church of Dhaka,"Dhaka, Bangladesh",All that is left of an Armenian community that thrived in Dhaka 200 years ago.,https://www.atlasobscura.com/places/armenian-church,"In the Armanitola district of Old Dhaka there is an unexpected sight: an Armenian Catholic church. Unbeknownst to many, there was a thriving Armenian population in Dhaka during the 17th and 18th centuries, and this 200-year-old church is all that’s left of that community. There is no record of when the first Armenians moved to Dhaka, but it was likely in the early 17th century, soon after the Persian Shāh Abbās conquered Armenia and deported 40,000 of its traders to Persia. Following this mass deportation, records of Armenian communities began appearing throughout the region. The move from Persia to Dhaka is not implausible considering that Persian was the official language in the Mughal Empire at the time. The textile business was booming and Armenians traded in jute, leather, and silk. Thanks to this industry, the community grew wealthy and in 1781 it commissioned the construction of a Catholic church, the Armenian Church of the Holy Resurrection. Measuring 75 feet in length, the white and yellow-trimmed church is rather small; the main hall can accommodate about 80 people. A fine painting depicting the Last Supper hangs on the wall, and a wooden spiral stair leads to the upstairs balcony, where another 20 or 30 people can find room. From there, two low, narrow openings give access to the roof. The lot on which the church was built was previously used as a cemetery by the Armenian community, and the churchyard is still an old burial ground where Armenian script is clearly visible on headstones. On one of the oldest graves is a skull and crossbones carving, indicating that the person was killed by pirates, in 1783. Service is no longer held on a regular basis, but on special occasions, such as Easter, a group of Catholic expats organizes a service in the historic church.","The gates to the Armenian church are usually closed, but knock or wait around a while, and someone will open them. There is no entrance fee, but a tip is expected."
52,Chittagong Ship-breaking Yards,"Bhatiari, Bangladesh",Where giant ships go to die.,https://www.atlasobscura.com/places/chittagong-shipbreaking-yards,"Supertankers and giant cargo ships are the backbone of our global consumer society. Hundreds of meters long, ferrying millions of tons of goods across the globe, the sheer size of these immense vessels is awe inspiring. Construction of one such behemoth is a fascinating feat of engineering. However, the destruction and final resting place of these steel giants is even more intriguing. Even when such a ship is not seaworthy anymore, and repairs are not economically viable, the raw material it is constructed from has some value. Nowadays ship-breaking yards tend to be located in third world countries, places far out of sight of the consumers whose supermarkets they helped supply, and where labor is cheap and environmental protection laws are lax. There ships are chipped down bit by bit, usually by hand, and stripped of every last bit of value. Fauzdarhat, 20 kilometers northwest of Chittagong in Bangladesh, is where many of the world’s ships go to die. Over twenty ship-breaking yards dot the 16 miles of coastline. It is an industrial wasteland of epic proportions, where thousands of workers are forced to scratch their meager existence out of these hulking steel ruins, working with rudimentary protection, risking injury and illness, poisoned by toxic fumes and exposure to asbestos and other hazardous materials. Chittagong is but one of many such places. Gadani in Pakistan is perhaps even larger. Alang in Gujarat in India is another. Environmental groups such as Greenpeace have tried to raise awareness of the threat that these ship-breaking yards pose to both the people employed in them and to the environment. There is some hope that public pressure will force major shipping companies to make greater use of so called “Green Ship Recycling” facilities in developed countries.",Follow the N1 road north from Chittagong city.
53,Paro Taktsang,"Paro, Bhutan",The small cliffside monastery known as the Tiger's Nest is said to be the meditation site of an eighth-century Buddhist master.,https://www.atlasobscura.com/places/paro-taktsang-tigers-nest-monastery,"This temple complex hangs far up on a cliff overlooking the Paro valley in Bhutan. It is one of 13 small monasteries, or “tiger lairs” where the Buddhist master Padmasambhava, also known as Guru Rinpoche, is said to have meditated in the 8th century. Padmasambava, which translates as “he who came into being in a lotus,” was a Brahmin royal who spread Tantric Buddhism through Bhutan and Tibet in the 700s, and is seen in those areas as nearly as holy as the Buddha himself. As legend has it, Padmasambava landed at Paro Taktsang to meditate when he brought Buddhism to Bhutan in the 8th century. He is said to have arrived on a flying tiger which had recently been his Tibetan concubine. He then meditated in a cave high on the mountain for four months after which he subdued the local ‘demons’ and began the conversion of the Bhutanese to Buddhism. For those without flying tiger concubines, getting to the Tiger’s Nest is significantly more difficult. There is a two hour climb from the valley floor, which is already quite high at 7,000 feet, to the Tiger’s Nest 3,000 feet above— 10,000 feet above sea level. As one climbs the well-maintained but very steep trail over ever more vertical switchbacks, the monastery seems to appear and disappear in and out of the trees and the mists. After two hours of a long slow climb—going slow is recommended to help manage the pace of the altitude—one arrives at the only beginning of the entrance to the Tiger’s Nest, a rock outcropping overlooking a vast chasm, with the monastery on the other side. Beneath the promontory of rock, and across the chasm from the monastery, the cliff drops a couple of thousand feet to the gorge below. Carved into the exposed cliff face are stone steps; handrails have only recently been added. This is the way to the Tiger’s Nest monastery. Despite reservations that visitors may have about navigating the intimidating steps, it’s common to see Bhutanese locals, including mothers carrying small babies, walking up the steps with ease. The steps lead down into the gorge, which provides the separation and isolation the Tiger’s Nest has enjoyed for all these centuries. As one climbs into the canyon, a 100-meter high waterfall at the deep end of the canyon appears immediately in front, with the path traversing directly across its base. Once down and across the front of the water fall the steps start back up toward the Tiger’s Nest once again, over 700 steps in all. Visitors can enter Paro Taktsang (after removing their shoes) and climb the several levels within, which contain three temples and a spectacular view. High and deep inside is the site where Padmasambabva is said to have meditated for three years, three months, three weeks, three days and three hours. You can feel the chill breath coming from inside the cave. The return journey is much faster, but equally dramatic. In conjunction with the Long Now Foundation. Modified from original text by Peter Schwartz at the Long Now Blog.",Plan your trek as early as possible in the morning to enjoy the perfect weather. Many cabs are available in the city centre that can be availed to get dropped off to the start point.
54,Dochula Pass Meditation Caves,"Dochula, Bhutan",The small sanctuaries lie just off the beaten path near one of Bhutan's most famous attractions.,https://www.atlasobscura.com/places/dochula-pass-meditation-caves,"Dochula Pass is one of Bhutan’s most famous sites, perched at an altitude of 10,200 feet and located along the road from the country’s current capital of Thimphu to its former capital Punakha. A hidden surprise awaits the few who take the time to venture away from the touristy hub. These curious visitors will discover the meditation caves tucked into the hills just above the pass. At first resembling Hobbit homes, these tiny, open-faced caverns are built from stone and painted in colorful detail with Buddhist symbolism. The druk, or dragon—Bhutan’s long-time national symbol and spirit animal—stretches over the cave entrance, bringing good luck and good tidings. Meditation is a critical exercise for serious practitioners of Buddhism. To achieve enlightenment, monks and nuns will stay in one location, such as a meditation cave, for three days, three months, and three years. Each period is a trial for the next—if one can manage three days, one proceeds to three months. During this time, one may not speak with or cast eyes on another person. If you make it through three months, it’s time to take on three years. While you may not have three years to spare while visiting these caves, you’d be missing a hidden gem of Dochula Pass if you didn’t take the extra 10-minute climb into the forest to explore these carefully constructed meditative retreats that nearly blend into the hills. The short trek to the caves is a respite from the famous pass, which is home to 108 memorial chortens, or stupas, built in 2004 in honor of fallen Bhutanese soldiers killed in the battle against insurgents from India’s Assam region in 2003. Most visitors come to the pass for the magnificent views. On a clear day (which you’re lucky if you catch), you can take in Himalayan peaks including Mount Masanggang and Mount Gangkar Puensum, both over 22,000 feet tall.","There is a cafe just up the hill from the chortens. Head this way and continue upwards, following paths built from oval-shaped stone steps. As long as you continue following any of these paths, you'll soon encounter the meditation caves. If you continue farther, you'll discover an area strung with hundreds of worn prayer flags, and then a gate locked and decorated with barbed wire. Suffice it to say, time to turn back if you've made it this far."
55,Motithang Takin Preserve,"Thimphu, Bhutan","Strange, gentle beasts resembling goat-cow hybrids roam within this patch of forest.",https://www.atlasobscura.com/places/motithang-takin-preserve,"Strange muskox-looking creatures roam within the trees in Bhutan’s capital city. The hoofed beasts, which look like a mishmash of cows and goats, are held in extremely high esteem. The takin is a rare type of goat-antelope living in the Eastern Himalayas. The four subspecies of the takin live in high altitudes throughout Bhutan, Northeast India, Northwest Myanmar, and the Chinese section of the Himalaya. The odd-looking animals are the national animal of Bhutan. According to local legend, a 15th-century saint concocted the curious creature after he agreed to conjure up a miracle in exchange for lunch. He then slapped the head of a goat atop a cow’s skeleton and brought this new animal to life. In reality, the takin is the result of convergent evolution. The animals’ protracted noses, large heads, and sturdy torsos give them a distinctive look. Taxonomists, biologists, and zoologists are all keen to study the creature because though it resembles a muskox, it’s actually more genetically similar to sheep. The takin found at the Motithang Takin Preserve were once part of a small zoo. But when the King of Bhutan declared it was improper for Buddhist country to keep animals in such confinement, the big beasts were set free. Yet they didn’t wander far. The freed takin, which at this point were used to humans, preferred to converge within Thimphu. The Motithang Takin Preserve was created to provide shelter to the capital city’s four-legged residents. Now, the takin live within 8.4 acres of carefully managed forest. The Bhutanese authorities are particularly attentive to the health and wellbeing of the takin due to its status as the national animal. Other takin roam in the Dihang-Dibang Biosphere Reserve in India. Surprisingly, you can also spot an actively breeding herd in Cumberland, Ohio, which was planted there as part of a Species Survival Plan.",
56,Buddha Dordenma Statue,"Thimphu, Bhutan","This giant Buddha statue has 125,000 smaller Buddhas hidden inside it.",https://www.atlasobscura.com/places/buddha-dordenma,"Atop a hill in Thimphu, the capital and largest city of Bhutan, is a massive, golden Buddha sitting atop a gilded meditation hall. But the monument holds an invisible secret: Unbeknownst to many people viewing the statue, they aren’t actually looking at one Buddha, they’re looking at 125,000 of them. Inside of Thimphu’s 169 foot Buddha Dordenma statue, there are 125,000 miniature Buddhas encapsulated inside of its enlightened bronze chest, ranging from 8 to 12 inches tall. This means that in Thimphu, which has a population of around 100,000, there are more Buddhas than there are human beings. Like the large Buddha, these thousands of miniature Buddhas are also gilded and made of bronze, a major reason that the statue cost almost $100 million to build when it was constructed in 2015 to honor the 60th birthday of Jigme Singye Wangchuck, the fourth king of Bhutan. The statue also fulfils two prophecies. The first, foreseen by yogi Sonam Sangpo, is that a Buddhist statue would be built in the region to “bestow blessings, peace, and happiness to the whole world.” In addition, the statue is said to have been mentioned by Guru Padmasambhava, widely referred to as the “second Buddha,” in the eighth century. This statue kills two birds with one stone by fulfilling both prophecies in glimmering fashion.",
57,Garden of Phallus (Wangchuk Chenmoi Dümra),"Thimphu, Bhutan",This garden is very fertile.,https://www.atlasobscura.com/places/garden-of-phallus-wangchuk-chenmoi-dumra,"Within the living museum of Simply Bhutan in the country’s capital of Thimphu, you’ll find a garden rather unique in its flora. Phalluses are not an uncommon sight in Bhutan. The symbol is meant to bring good luck, promote fertility and harmony, and ward off evil spirits. They’re painted in and on buildings, displayed on the headgear of Atsaras (masked clowns), and even used as scarecrows. A traditional housewarming ritual involves hoisting a basket of wooden phalluses onto the roof on the new home. The symbols date back to the 15th century, when the eccentric Buddhist teacher Drukpa Kunley, known as the “Divine Madman,” popularized the symbol when he brought Buddhism to Bhutan (showcased by his “penis-focused monastery,” Chimi Lhakhang). The Garden of Phallus is found in Simply Bhutan, a museum, restaurant, and photography studio built to resemble a Bhutanese village. Larger-than-life phallus statues mingle with plants in front of a mural which features several hanging smiling faces whose noses look an awful lot like, well, we’ll let you guess what they look like.",The garden is inside the Simply Bhutan museum and restaurant complex on Genyen Lam.
58,Punakha Suspension Bridge,"Punakha, Bhutan",This colorful overpass is one of Bhutan's longest suspension bridges.,https://www.atlasobscura.com/places/punakha-suspension-bridge,"The high mountains and deep gorges of Bhutan lend themselves to suspension bridges. Punakha Suspension Bridge, which is always adorned with colorful prayer flags, is the perfect example of this. Linking Punakha Dzong to Shengana, Samdingkha, and Wangkha villages across the Tsang Chu River (aka Po Chu), this is one of the longest suspension bridges in Bhutan. Yet, for a roughly 520-foot-long suspension bridge, it’s surprisingly stable. The bridge offers a spectacular view of the river and valley, and the east bank is a good starting point for multi-day treks in the nearby mountains. Traditional Bhutanese bridges make use of cantilevers, beams anchored to one bank and projecting horizontally to reach the other bank. This simple but effective structure can be upgraded by using interlocking beams. A prime example of this is the bridge in front of Punakha Dzong. Unlike these bridges, the one in Punakha relies on cables anchored to massive cement blocks on the banks. Being suspended, the bridge does have some inbuilt flexibility that makes it swing in strong winds, but not as much as you may expect. This is due to the stabilizing cables that taper off on both ends of the bridge. The deck is made of solid planks of wood nested in the deck truss.","Punakha Bridge is only about half a mile from Punakha Dzong, but it can easily be missed, as it’s not on the main road. To find it, head north from the dzong past the cremation grounds, following the Puna Tsang Chu River, either via rural roads on the west bank or via Trashigang-Semtokha Highway."
59,Trongsa Dzong,"Trongsa, Bhutan","The largest and, arguably, most scenic fortress in Bhutan.",https://www.atlasobscura.com/places/trongsa-dzong,"Trongsa Dzong was first built in 1647, and it was from this dzong (fortress) that the first two Bhutanese kings ruled the country. The structure is strategically located on a steep slope commanding an extraordinary view of the Mangde River, approximately in the middle of the Kingdom of Bhutan. Narrow stone stairs, alleys, and corridors connect the buildings at all levels of the fortress, creating a veritable labyrinth on the slope. Within the walls of the dzong are 25 temples dedicated to Tantric deities, a watchtower (Ta Dzong) dating back to 1652, a printing shop producing religious texts following an ancient tradition, and a museum honoring the Wangchuck dynasty. In addition to its military importance, Trongsa Dzong was a major administrative and religious centre, still housing around 200 monks during the winter months. The historic fortress was badly damaged by an earthquake in 1897, and eventually restored in 1927 and 1999. It now annually hosts Trongsa Tsechu, a 5-day religious festival where traditional costumes and masks are deployed for the dances.  The date of the festival falls in December or January, in accordance with the Tibetan Lunar Calendar.",
60,Chimi Lhakhang,"Punakha, Bhutan","This penis-focused monastery is dedicated to Buddhism's ""Divine Madman.""",https://www.atlasobscura.com/places/chimi-lhakhang,"In general Buddhism is associated with serenity, peace, and beauty, and Bhutan’s Chimi Lhakhang monastery is no different, it just has a lot more penises. Also known as the “Fertility Temple,” the single building site was originally built in 1499 on a short hill that had been blessed by rogue Buddhist leader Drukpa Kunley, known as the “Divine Madman.” Drupa Kunley, also known as “The Saint of 5,000 Women” worked overtime to spread enlightenment through an active sex life. He was known to live a truly bacchanal lifestyle full of wine, women, and poetry. He is also credited with bringing Buddhism to Bhutan, hence the common phallic imagery found throughout the country. The phallus became Drupa Kunley’s symbol, signaling both fertility and the power to bring enlightenment to those who… learned from its teachings. Because of this, his penis as a symbol is sometimes known as the “Thunderbolt of Flaming Wisdom.” Drupa Kunley’s mad antics were a statement on the stuffiness of the Buddhist leaders at the time, but his exploits seemed to strike a chord with the locals, and illustrations of penises became a more common sight, said to be able to ward off evil spirits. This came from the legends that Drupa Kunley could bop demons on the head with his thunderbolt and turn them into protective spirits. In modern Bhutan, use of the penis as a symbol is frowned upon, as it might be any place in the world where wearing pants is the norm. But at Chimi Lhakang, the penises still adorn the walls of the nearby buildings, and wooden phalluses are still kept by the monks, used to bless women that seek to be blessed with children. Visitors from all over the world still travel to the monastery for a blessing of fertility.",
61,The Burning Lake,Bhutan,Legend has it a sacred treasure hidden by an ancient guru was revealed with a burning butter lamp from these waters.,https://www.atlasobscura.com/places/the-burning-lake,"Though it’s known as Mebar Tsho, or “the Burning Lake,” this sacred site is not quite a lake at all, but rather a pool along a river in the Tang Valley. Local legend says that the water contained a hidden holy treasure uncovered through divination by one of Bhutan’s most important religious figures, Terton Pema Lingpa, in the late 1400s. Terton Pema Lingpa is thought to have been the reincarnation of Padmasambhava, an ancient guru also known as the Second Buddha. According to religious tradition, in the 8th century Padmasambhava hid secret teachings containing Buddhist wisdom for terton, treasure revealers like Pema Lingpa, to unearth in the future so his principles could live on. In the 15th century, Pema Lingpa had a vision that treasure was hidden in a pool where the Tang Chhu River widens. When the locals questioned the validity of his prediction, he submerged himself in the water holding a lit butter lamp, and resurfaced with a chest and a scroll, the lamp still aflame. Until that point, the pool had been referred to as Nya Ring Brag, translating to “Long-Nosed Cliff” for the cliff faces that surround the area. But from then on, this body of water assumed the name Mebar Tsho, or the Burning Lake. A conflicting hypothesis presents the slightly different narrative that the name Mebar Tscho actually references another treasure revealer by the name of Terton Sherab Mebar, who is also said to have uncovered treasure teachings from the lake. Still, the Burning Lake remains one of the region’s most sacred places and a pilgrimage site for many Bhutanese people. Colorful prayer flags fly around an altar dedicated to Terton Pema Lingpa, and butter lamps can be found scattered on the riverbanks as tribute.","The Burning Lake is a 30-minute drive from Chamkhar Town, located along the road to Ura or the Tang village in central Bhutan's Tang Valley. It takes about five minutes to walk from the road to the lake. The lake is accessible throughout the year at all times."
