index,attraction,location,blurb,url,description,tags
48,Ternate Island,"Ternate, Indonesia",The remote island home of the overlooked explorer who co-discovered the theory of evolution by natural selection.,https://www.atlasobscura.com/places/ternate-island,"In an 1858 letter to a friend, English naturalist and biologist Alfred Russel Wallace wrote that he’d spotted an insect whose colorings were almost imperceptible against the muddy ground it was on. He was perplexed by the markings, but, he wrote, “I have lately worked out a theory which accounts for them naturally.” Wallace was mulling over the theory of evolution by natural selection, which he identified around the same time as Charles Darwin, who would end up with most of the credit. Darwin achieved lasting fame while Wallace fell into relative obscurity. While working in separate hemispheres, Darwin and Wallace were both full of curiosity, and committed to exploring these ideas. Wallace spent nearly a decade exploring the wildlife across a remote chain of islands east of Sumatra, what was at the time the Dutch East Indies, and studying the impact of a geographical boundary on the natural world, later named The Wallace Line. He collected tens of thousands of natural specimens that would help lead to the formulation of his theory. It was during this island-hopping expedition that Wallace rented a house in Ternate, a small, lush volcanic island in eastern Indonesia, to serve as a home base. Here is where he wrote many of his scientific papers and letters. It was from Ternate that he sent a letter on March 9, 1858 to Darwin along with a detailed paper describing his theory. Darwin had come to the same conclusion on his own years earlier, and was emboldened by Wallace’s realization. They jointly published a paper arguing their groundbreaking and then-controversial theory that year. Darwin published The Origin of Species a year later, which became a sensation and would propel him to fame. While both men were brilliant, Darwin had one major advantage: He had backing from the scientific community and the money to do his work, which meant that Wallace’s work was largely unknown. Wallace collected specimens to prove his theories, and his trips to collect and learn more were funded by selling those specimens to museums and private collectors. During his travels, Wallace would take advantage of any time he spent in a city to send his findings back to other scientists and scientific journals. He would also note his findings in a journal he kept. It was his journal that would later form his seminal work, The Malay Archipelago, a bio-geographical book outlining Wallace’s finds and travels on the islands. Today, these islands are either Malaysia or Indonesian sovereignties, but as one researcher noted, in Wallace’s time these would have been “a great Milky Way of land masses and seas and straits, little explored by Europeans, sparsely populated by peoples of diverse cultures, and harboring countless species of unknown plant and animal in dense tropical forests.” In other words, a researcher’s dream. Wallace cataloged plants and animals (“It is remarkable that an animal so large, so peculiar and of such a high type of form as the orang-utan (sic) should be confined to such a limited district”), and tasted local foods (Wallace on durian fruit: “a rich butter-like custard highly flavored with almonds generally gives the best idea of it, but intermingled with it comes wafts of flavor that call to mind cream-cheese, onion sauce, brown-sherry, and other incongruities”). He wrote in flowery prose about catching butterflies (“My heart began to beat violently, the blood rushed to my head, and I felt much more like fainting than I have done when in apprehension of immediate death.”), and he tracked the months and miles and species that eventually led him to his most notable achievement. The tiny island of Ternate may have been lost to obscurity as well if not for a resurgence of interest in the scientist. Today, tours of the island are even offered to allow visitors to follow in Wallace’s footsteps. One spectacular local bird, which can be found inhabiting the neighboring islands of Halmahera and Bacan, was named Semioptera wallacii (Wallace’s Standard-wing Bird of Paradise) after Wallace who collected the first specimens. Over 100,000 specimens collected during Wallace’s exploration of the islands were sold to British museums and collectors. Unfortunately, there is no plaque honoring Wallace on Ternate, and, according to Wallace historian Dr. George Beccaloni, it is likely that the house where Wallace lived and worked is no longer there. However, the beauty of the island—which Wallace wrote as having “grand views on every side,” and “lofty volcanic peaks” with huge mountains rising behind them covered in “perpetually faint wreaths of smoke … calm and beautiful” is itself worth seeing. You can still explore the impressive old Fort Oranje, which was just below Wallace’s house, and imagine the wonders he saw and the mysteries he wanted to unlock, ultimately forming a theory that would change the way that people viewed the natural world.",naturalists biodiversity fauna exploration geographic markers flora islands science plants nature animals
49,The Equator Monument,"North Pontianak, Indonesia",This monument marks where the exact middle of the world used to be.,https://www.atlasobscura.com/places/the-equator-monument-north-pontianak-indonesia,"Pontianak, a developing port city on the Indonesian side of the island of Borneo, is the largest city on the Earth’s longest invisible line, the equator. Also known as “Equator City,” Pontianak is the capital city in the province of West Kalimantan. Standing a mere two miles north from the city center is a monument constructed to represent the otherwise conceptual equator. The spot was first marked simply with an arrow on a pole in 1928 by a Dutch geographer when he visited Borneo. The first monument, originally consisting of four wooden pillars surrounding the pole, was rebuilt ten years later by architect Silaban who turned the simple marker into a permanent monument. A globe was added to cap off the work, and a guard was added to keep it safe. A dome was finally built over the landmark in 1990 to cover the original monument and a grander replica, five times the size of the original marker monument, was added to the top. Due to constant global shift, the monument no longer lies on the exact line of the equator. In 2005, the true equatorial line was recorded a short distance south of the monument and, according to GPS readings, the line continues to move south. Despite this increasing inaccuracy, the city of Pontianak holds a party each year during the time of the spring and autumn solstices, when the shadows of the monument and everything around it disappear at noon.",location markers geographic markers monuments
50,Grasberg Mine,"Tembagapura, Indonesia",This mile-wide crater high in the mountains of Indonesia is the largest gold mine in the world.,https://www.atlasobscura.com/places/grasberg-mine,"The Grasberg Mine is a vast open pit mine in Papua, Indonesia, forming a crater an entire mile wide. For years it has been one of the most productive mines in the world, with massive reserves of gold and copper. Situated high in the rugged Sudirman Mountains near two rare equatorial mountain glaciers, it is also the world’s highest quarry, some 14,000 feet above sea level. This massive mine sits at the collision point of two tectonic plates, where millions of years ago hot magma intruded into sedimentary rock layers during the uplift of the local mountains, resulting in the formation of copper- and gold-bearing ore. Since the early 1990s, the Grasberg operation has been busily extracting this ore at a staggering volume. In 2016, the vast mine produced more than 1 billion pounds of copper and 1 million ounces of gold. Once the precious metal is extracted, it is crushed in the mine’s milling and concentrating complex, which is the largest in the world. The grinding units at the mill can process a daily average of 265,000 tons of ore. The ore is then sent in a slurry along three pipelines to the seaport of Amamapare, over 70 miles away. It is filtered and dried at the port, after which the copper, gold, and silver can be shipped to smelters around the world. Today, the pit mine has been all but exhausted. But while production has temporarily fallen away, the huge reserves of gold and copper remain—albeit deeper underground. Grasberg is now transitioning to underground block carving, with underground mines replacing the work in the pit. Unsurprisingly, such a massive mining project has not gone without its share of controversy. To start are the environmental concerns: Each year, the mine dumps tens of millions of tons of waste into the local river system, which is now almost devoid of fish and generally considered unsuitable for aquatic life. Freeport-McMoRan, the U.S. company in charge of the mine, has long insisted that its practices meet industry standards. That, however, is not a position held by environmental groups and local citizens. Tensions have also flared at Grasberg due to the low share of revenue going to local Papuans, and questionable payments made by the mine to the Indonesian security forces that protect it.  Grasberg Mine is located in the village of Tembagapura in the Papua province of Indonesia. It’s about 60 miles north of Timika, and not far from Puncak Jaya, the highest mountain in Papua. Tours of the mine can be arranged.",copper gold environment world's largest mines
51,Blanco Renaissance Museum,"Kecamatan Ubud, Indonesia","Visitors to this museum will find architectural oddities, an art gallery, and an unlikely bird sanctuary.",https://www.atlasobscura.com/places/blanco-renaissance-museum,"Dedicated to the life and work of Don Antonio Blanco, this complex in Bali is a mansion turned art gallery. In 2004, the building also became a bird sanctuary after it gained legal permission from the government to act as a conservation area. The Bali myna, also known as Rothschild’s mynah, Bali starling, or Bali mynah is a critically endangered bird with fewer than 100 adults existing in the wild. The sanctuary has helped increase the species’ population with a government-approved breeding program. Blanco lived and worked in his magical hilltop home until his death in 1999. The museum has a collection of more than 300 works from the artist. There is also an exhibition called the Erotic Room, which displays a large collection of paintings featuring the elegance of the male and female bodies. However, to enter this chamber visitors must be older than 17. There is also a painting studio inside that was often used by Blanco. The stone arch over the top of the stairs, the Kori Agung, is actually a giant signature of Blanco. It was created by folding the paper vertically while the paint was wet and doubling the signature. There is a little cafe inside as well, a nice place to sit after taking in the artwork. There is also a fountain in the garden designed to resemble waves in the ocean.",sanctuaries birds architectural oddities animals art museums architecture
52,Bayung Gede Placenta Graveyard,"Kintamani, Indonesia","In this Balinese village, coconut shells containing placentas are hung from trees.",https://www.atlasobscura.com/places/bayung-gede-placenta-graveyard,"A sacred garden grows along the southern edge of a Balinese village. The trees’ branches bear more than just fruit: they’re also draped with coconut shells containing human placentas. In Bali, Indonesia, a newborn’s placenta is seen as an invisible, spiritual sibling to the child (the word for placenta, Ari-Ari, translates to “younger sibling”). Traditionally, the placentas are bathed in fragrant, floral water, then sealed inside a coconut shell before being buried beneath a plant within the family’s yard. But the village of Bayung Gede has a different custom. In this village’s Setra Ari-Ari (placenta graveyard), the placenta-carrying coconuts are hung from the branches of the bukak trees, forming a sacred garden. The residents of Bayung Gede have been following this unique tradition for centuries. According to local legend, the custom is as old as the village itself. It’s believed that the bukak tree’s sap and fruit can help absorb the smell of the decaying organs. After a tree has been adorned with placentas, its branches are sliced to better release the sap held within.  It is worth noting that the ground-breaking anthropologist Margaret Mead lived in Bayung Gede from 1936 to 1939. Rumor has it that her western-style toilet, which was an object of fascination for the locals, still exists in the village.",coconut anatomy flora tradition rites and rituals graveyards gardens trees cemeteries plants
53,Mie Lethek Garuda,"Srandakan, Indonesia","In this rare traditional factory, three generations of know-how, several strong cows, and a one-ton mortar come together to make Yogyakarta's famous ""ugly noodles.""",https://www.atlasobscura.com/places/mie-lethek-garuda,"It’s hard work being a cow. If you happen to be one in the village of Srandakan, in Indonesia’s Yogyakarta Sultanate, you may avoid a more grisly culinary fate by spending your days walking in circles to turn a six-foot-wide, one-ton mortar. This mortar grinds dried cassava and sweet potatoes into flour for use in mie lethek, Yogyakarta’s signature noodle variety. As thanks for all that hard work, you’ll eat a steady diet of sweet grass meant to keep you strong and healthy. But it’s the end result that really matters: You’ll be part of the culinary legacy of Srandakan’s Mie Lethek Garuda, the last remaining traditional mie lethek factory. Mie lethek means “ugly noodles,” dubbed so because the blend of cassava and sweet potato flours yields squiggly carbs of a pasty, grayish tint. More appealingly, the noodles have a delicate sweet-potato flavor and chewy texture. They’re a regional specialty of Yogyakarta, which is the last remaining Indonesian region to be ruled by a Sultanate. Served either fried or boiled, with eggs, chicken, vegetables, garlic, and candlenuts—an oily nut with a flavor similar to macadamia nuts—they are famously delicious. Barack Obama, the former United States president, is said to have enjoyed mie lethek on a visit to Yogyakarta, though no word on whether those noodles came from the Garuda factory or a more high-tech equivalent. Yasir Feri, the current owner of Mie Lethek Garuda, credits his grandfather with the invention of these noodles. Feri’s grandfather was a Yemeni immigrant who married a local woman of Chinese descent. It was Feri’s grandmother who had the bright idea to try out cassava flour, and she supplied the noodle-making experience that led to the factory’s success. They opened up shop in the 1940s. Eighty years and two generations later, the younger Feri is the last producer to continue making mie lethek by hand, cow and all. After grinding the cassava and sweet potato flour, factory workers mix it into dough, which they then manually press into noodle form. Then, workers steam the resulting noodles and dry them in the sun for at least a day before sending them to local markets and for distribution throughout Yogyakarta. Today, the Garuda factory employs around 30 local workers. While Feri could certainly sit back, relax, and savor his status as noodle king, he continues to work alongside his employees, many of whom have been around since his parents’ tenure as factory managers. And of course, Feri always remembers to save some sweet grass for his loyal cows, who have helped give the world a beautiful gift in the form of an ugly noodle.  As in many rural areas, the Garuda factory doesn't have a conventional address. But the factory itself is a well-known landmark in Srandakan, a small village in Bantul district. If you're interested in paying the factory a visit, your hotel owners or host in Bantul should be able to show you the way and help arrange transportation. Otherwise, you can try Garuda's noodles in restaurants and markets across Yogyakarta.",noodles potatoes cows factories
54,Mount Tambora,Indonesia,Mount Tambora is the site of the largest and deadliest volcanic eruption in recorded human history.,https://www.atlasobscura.com/places/mount-tambora,"Mount Tambora (Gunung Tambora) is a 9,354 foot-tall volcanic mountain located on the Indonesian island of Sumbawa and is the site of the largest volcanic eruption in the past 2,000 years. When the volcano erupted in April 1815, the mountain lost about 4,000 feet of elevation and created a five mile wide, half-mile deep caldera. The eruption was also the deadliest ever in recorded human history, killing an estimated 60,000 to 120,000 people from pyroclastic flows, ashfall, and the poisoning of water and soil. The reach of the volcanic eruption was felt far beyond Indonesia. The sulfur ejected into the atmosphere disrupted weather patterns around the globe, causing what would be known as “The Year Without a Summer.” Cold and wet weather destroyed crops and helped spur epidemics like typhus and dysentery that destroyed vulnerable populations. It’s said that this period inspired Mary Wollstonecraft Shelly to write her classic, Frankenstein. The volcano is also partially blamed for a cholera epidemic that began in the Bengal region of India in 1817 and created the world’s first cholera pandemic. Views from the top of Tambora are stunning and provide a peek into the caldera itself. Tambora is still an active volcano and fumaroles (steam vents) can usually be seen at the bottom of the caldera. A myriad of endemic birds and plants can also be found along the trail.  The area around Tambora was made into a national park in 2015, but there is little infrastructure for visitors. The summit, which is at the edge of the massive caldera, can be reached by a two to three-day roundtrip moderate hike. Hikes in the caldera are possible as well. Most people start the hike in the village of Pancasila, although other routes are available. A guide is recommended, especially for hikers that want to walk the last section of the trail in the early morning to see the summit at sunrise. A car route is available partway up the western side of the mountain and the Indonesian government is planning for new 4-wheel-drive roads in the park. Watch out for leeches and a local stinging nettle called jelatang. Dress warmly for the summit.",volcanoes mountains geology nature history & culture
55,Tsunami 'Noah's Ark',"Kuta Alam, Indonesia","After a 2004 tsunami, this stranded boat was left in place.",https://www.atlasobscura.com/places/tsunami-boat-memorial,"In December 2004, one of the largest earthquakes ever recorded triggered a tsunami and caused a lethal disaster in Indonesia. In and around Banda Aceh, 90,000 people died, and about a third of the city was destroyed. When the giant wave swept ashore, it carried this boat with it. The boat was deposited on top of a house and survived the storm, sheltering dozens of people who lived in the area and who may not have survived otherwise. One survivor described the sound of the boat hitting the roof of the house as “like thunder.” The group spent seven hours in the boat, waiting until the waters receded to leave it. Because it saved those people from the flood, the boat is sometimes called “Noah’s Ark.” Other boats were stranded on the roofs of the city, but this is the only one of those that was left where it landed. Another, larger stranded ship, the PLTD Apung 1, was stranded further inland and has been turned into a memorial. While the stranded Noah’s Ark saved people during the flood, the Apung 1 crushed two houses with people still inside. The boat is near the harbor, and there should be signs, reading ""Kapal di atas rumah,"" guiding the way. The boat is well-known locally, and it should be possible to hire a bike or car to go directly there.",disasters boats
56,Barelang Bridge,"Bulang, Indonesia",A striking series of six bridges connect islands in Indonesia.,https://www.atlasobscura.com/places/barelang-bridge,"There are 6 bridges that connect the islands in Kepulauan Riau, but they are far from matching–each bridge is a different type of structure. Beginning in 1992, the 2 kilometers-worth of travel spans took their names from 15th- to 18th-century rulers of the Riau Sultanate, and are made up of a selection of engineering greatness. The longest bridge, the Tengku Fisabilillah (connects Batam and Tonton island), is a cable-stayed bridge that has 642 meters of stretch, and is by far the most popular of the bunch due to its regal appearance and size. Narasinga (Tonton-Nipah) and Sultan Zainal Abidin (Setokok-Rempang) are cantilever bridges, 320 m. and 365 m., respectively. Ali Haji (Setokok-Nipah) Bridge is a girder bridge, and stretches a good 270 meters, and Tuanku Tambusai (Rempang-Galang Bridge) is an arch bridge, 385 m. in all. The last is the Raja Kecil Bridge on Galang Island (Galang-New Galang), the smallest of the six. Although Raja Kecil Bridge is the smallest, the historical value of the island it connects is very high. Sijantung Village of Galang Island was previously used to accomodate 250,000 Vietnam refugees (1975-1996) which buildings and remains could still be seen today. Despite the fact that each bridge has its own identity, they are seen as one, in the sense that they have brought this entire pocket of islands a way to connect their communities and improve access, and they are referred to as a whole, simply as The Barelang Bridge.",inventions bridges architectural oddities architecture
57,Goal Bola-Bola,"South Jakarta, Indonesia",Concrete balls on wires constructed to stop train surfing in Indonesia.,https://www.atlasobscura.com/places/goal-bola-bola,"Along with electrocution, commuters who ride on top of trains in Indonesia now have to worry about Goal Bola-Bola; wires strung with concrete balls hanging above the train tracks. Implemented by the Kereta Api, Indonesia’s state railway, the Goal Bola-Bola are dangling grapefruit-sized chunks of concrete. Hanging off of poles above the railways, the concrete balls hang the entire way across the tracks and would easily knock off any one of the hundreds of free riders who surf the trains on their commute everyday. The concrete balls are the latest innovation in a string of attempts to stop free-riding that has included greasing the tops of trains with oil and barbed wire.",inventions
58,Sipiso-piso Waterfall,"Merek, Indonesia","One of Indonesia's tallest, this waterfall takes a 390-foot plunge into the Lake Toba caldera.",https://www.atlasobscura.com/places/sipiso-piso,"As a caldera formed by the eruption of a supervolcano, Lake Toba is surrounded by interesting geological formations. One of these is Sipiso-piso waterfall, which translates literally as “like a knife.” An underground river that runs along the Karo Plateau comes to a sudden 390-foot plunge before joining the waters of the lake. Water pours out of an opening in the cliff as if it had just broken through it. Sipiso-piso is located in the hills, at an altitude of about 2,600 feet above sea level. The land surrounding the falls is filled with pine forests. In Sumatra, vegetation tends to be lush, but a massive waterfall is a never-ending source of mist, and the resulting emerald-green of the nearby flora is simply spectacular. A well-trodden but badly maintained trail leads from the main viewpoint down to the base of the waterfall.  It requires medium physical fitness to descend and, above all, ascend back to the viewpoint.  There is a snack shop along the way up/down. Getting anywhere near the base of the fall entails a wet and slippery hike. A sad drawback of the hike is that it is strewn with rubbish left behind by disrespectful visitors.",waterfalls volcanoes water geology
59,Nias Ceremonial Stone Jump,"Bawolato, Indonesia",Warrior training: The Indonesian tourist trap.,https://www.atlasobscura.com/places/nias-ceremonial-stone-jump,"From the age of 10, boys on the Indonesian island of Nias prepare for their stone jump. It’s not complicated, and the act is exactly as it sounds. Boys become men on the island by leaping over a stone wall, sometimes as high as six feet. Before Bawomataluo, a city on the island of Nias became a hotbed for tourist activity and Western backpackers, the stone jump was a ritual taken very seriously. Boys leapt to their adulthood, dressed in warrior garb, signifying that they were ready to fight and assume the responsibilities of men. Leaping the stone barrier, ranging in height from 1.5-2 meters, was essentially a final task in warrior training. There is even some historical indication that sharpened bamboo was placed atop the barrier to increase the stakes of the jump. Today, the jump is still taken seriously and many boys begin training at a young age. However, it has also become a serious spectacle for gawking tourists that want to see traditional rites of another culture. Along with the stone jump, the traditional war dance on the island similarly draws in the gazes of visitings Westerners.",wondrous performances rites and rituals
