index,attraction,location,blurb,url,description
13,Carnivore Restaurant,"Nairobi, Kenya","Kenyan restaurant is a carnivore's paradise, serving exotic meats at its ultimate 'Beast of a Feast.'",https://www.atlasobscura.com/places/carnivore-restaurant-nairobi,"Hidden within a tropical garden and adorned with a loud, colorful décor, The Carnivore opens up into a vegetarian’s fiery nightmare, or a meat eaters Shangri-la, depending on your culinary leanings. Twice making the world’s 50 best restaurants by Restaurant Magazine, Carnivore opened in 1980 to immediate popularity. Borrowing aesthetic from medieval banquet halls, the decor is indoor/outdoor with tropical plants and streams weaving around tables. A giant roasting pit resides near the entrance of the building, covered in traditional Maasai swords ladened with hunks of meaty goodness from just about every animal you can think of that’s not on the endangered species list. Constantly being turned and basted over the pit are selections of the likely suspects at any BBQ–chicken wings, spare ribs, lamb, and different cuts of pork and beef. For the more adventurous there are bolder choices, such as camel, crocodile, tasty kidney morsels, and mutura, a local sausage consisting of cow or goat meat, tripe, and cooled blood seasoned with onions, salt, pepper, and chili. After being seated and served some gratuitous soup and bread and introduced to a double-decker revolving tray of exotic sauces, the diners are then inundated with servers carrying the meat-encumbered Maasai swords, offering the succulent outside cut of whatever strikes the customers fancy. Truly a practice in excess, visitors are encouraged to continue shoving food down their gullets until they can take no more, signaling their surrender by lowering a white flag provided for them in the center of the table. When the servers have been alerted to their victory, they will then bring around desert and coffee to those who are up to the challenge. Besides the meat orgy, Carnivore also has a nightclub, gardens, a playground for children, signature cocktails, an events area, an African heritage gallery, and believe it or not, a vegetarian menu.  Near Wilson Airport"
14,Bomas of Kenya,"Nairobi, Kenya",This tourist village in Nairobi celebrates the traditional lifestyles and customs of Kenyan tribes.,https://www.atlasobscura.com/places/bomas-of-kenya,"Billed as “Kenya in miniature,” Bomas of Kenya is a tourist village and cultural center six miles outside of Nairobi. It features replicas of traditional homesteads, or bomas, from 23 of Kenya’s ethnic groups, as well as traditional dances performed in its large auditorium. Bomas of Kenya was founded by the Kenya Tourist Development Cooperation in 1971. It was conceived and planned by Barack Obama Sr., although you won’t find any mention of him on the official website. Despite being the driving force behind the project, Obama Sr. was fired in controversial circumstances, his superiors unhappy at what they saw as his overuse of unilateral decision making. Despite the acrimonious beginning, the center went on to become a successful celebration of more than 40 ethnic groups in Kenya. The name of the tourist village comes from the Swahili word boma, meaning homestead, referring to the 23 replica villages found on the site, each displaying the unique characteristics of their respective ethnic group. At first glance, these round huts all appear much the same. But on further inspection, important and distinct social structures emerge. The organization of the various homesteads reveals telling details about the particular ethnic group. For example, the planning of homesteads in polygamous groups reflects this distinct hierarchy (first wife’s hut, second wife’s hut etc.). In other homesteads, the size and distribution of granaries reveals the responsibilities and importance of particular family members. Different construction methods, and forms of partitioning and decorations within homes, also vary between groups, highlighting important cultural differences. Along with the homesteads, one other key structure at Bomas of Kenya is the 3,000-capacity auditorium, one of the largest of its kind in Africa. Build in the shape of an African hut, the auditorium hosts daily song and dance performances from many of Kenya’s ethnic groups. These represent a diverse tribal cultural spectrum, and include everything from Kalenjin warrior dances to Swahili taarab music and Kikuyu circumcision ceremonies (minus the actual circumcision). Completing the cultural showcase is the Utamaduni Restaurant, where traditional Kenyan gastronomy is celebrated with dishes from various parts of the country.  Bomas of Kenya is located about six miles from Nairobi’s city center, and not far from the main entrance to Nairobi National Park. The bomas (homesteads) are open from 10 a.m. to 6 p.m. daily. Performances take place Monday to Friday from 2:30 p.m. to 4 p.m., and 3:30 p.m. to 5:15 p.m. on weekends and during public holidays. The entrance fee is 1,000 Kenyan shillings for non-residents, which is about $10 US."
15,Fort Jesus,"Mombasa, Kenya",This colonial fort is an intriguing example of Renaissance military architecture.,https://www.atlasobscura.com/places/fort-jesus,"The structure of Fort Jesus resembles the shape of a human body, with the head pointing toward the sea. The structure is an interesting blend of colonial and indigenous techniques. It’s a showcase of Renaissance military architecture built with locally available coral stone and lime mortar worked on using local techniques. Fort Jesus was completed in 1596. It was commissioned by King Philip I of Portugal and designed by renowned architect Giovanni Battista Cairati In the subsequent 300 years, the fort changed hands at least 10 times, with the Portuguese, Swahilis, Omani Arabs, and eventually British vying to own it. Possession of this strategic fort indicated the power a given government had in controlling trade over the Indian Ocean. The original walls, which were designed to withstand cannon balls, used to be nearly 50 feet (15 meters) high, and the Omanis increased their height by nine feet. Eventually, the walls were used to not only keep invaders out, but to keep people in as well. The British converted the fort into a prison in 1895, and it served this purpose until 1958, when it was declared a national monument. And in 2011, the fort became a UNESCO World Heritage Site. The fort in its current form is an amalgamation of European, African, and Middle-Eastern building styles, which blend seamlessly. The ramparts offer an expansive view of the Port of Mombasa. The rooms of the fort now house a museum shedding light to the history of the fort and Mombasa.  The museum is open daily from 8 a.m. to 6 p.m. You can find a map of its various exhibits here."
16,Donkeys of Lamu Island,"Lamu, Kenya","Kenya’s oldest town is more than 700 years old and home to 6,000 donkeys.",https://www.atlasobscura.com/places/donkeys-of-lamu-island,"Off the northern coast of Kenya, close to the border with Somalia, sits Lamu Island. Founded in 1370, it is the oldest continuously inhabited settlement in the country, and has largely remained unchanged over the centuries. The streets are narrow—often no more than two shoulder lengths in width—meaning that traversing the island by car is impossible. Instead, there are donkeys—more than 6,000 of them, used for transporting goods and people through the town. So important are these animals that the largest nonprofit on the island is a donkey sanctuary and one of the two cars on the island is an ambulance for donkeys. Each year the Lamu Cultural Festival celebrates the animals with a donkey race down the island’s beaches. Crowds of thousands gather to watch the local donkey jockeys compete head to head for the title. Strategically located along ancient trade routes between the Middle East and South Asia, Lamu Island was once the most important trade hub in the region. It is one of the clearest example of Swahili architecture—a fusion of South Asian, the Middle Eastern, and the East African styles—where ornately carved wooden doors are the gateways into multigenerational family homes made of local coral stone."
17,Lake Turkana,Kenya,The world’s largest permanent desert lake is a UNESCO World Heritage Site.,https://www.atlasobscura.com/places/lake-turkana,"Lake Turkana, Africa’s fourth largest and most saline lake, is a desolate wonder located in the arid desert region of the Kenyan Rift Valley, piercing the border of Ethiopia at its northernmost end. Also referred to as Lake Rudolf after European visitors named the lake after a 19th century Austrian prince, and Jade Lake for the verdant color of the water, Lake Turkana is a vast but shallow body of water that stretches over 150 miles long and up to 20 miles wide. The lake is an imperative resource for peoples in the surrounding desert region, migratory birds including flamingos, cormorants, and kingfishers, and local wildlife like the Nile Crocodile, hippos, and fish such as Nile perch, tigerfish, and tilapia. Lake Turkana and its islands were designated national parks in the 1970s and 80s. In 1997, Lake Turkana National Parks were collectively made a UNESCO World Heritage Site for the region’s extraordinary biodiversity. While UNESCO status requires the lake’s protection, Lake Turkana has since been placed on the World Heritage “In Danger” list for poor conservation practices and overdevelopment.  Visitors can reach Lake Turkana by car, boat, and public bus. The region is strictly accessible by 4-wheel drive vehicles only, and muddy roads make for difficult driving conditions during the rainy season. It’s recommended that visitors who choose to drive don’t venture solo in case of a breakdown in this remote area. The eastern side of Lake Turkana is slightly more populated, but supply stations are few and it’s suggested that travelers bring extra gas, drinking water, and camping supplies. Daily buses provide transportation between towns. Schedules are typically unreliable, but several bus companies offer routes within the region. Those who wish to cross the lake by boat must hire a private boat far in advance. Lake journeys are only possible in fair weather conditions. It is not advised to go swimming in Lake Turkana as the lake is home to saltwater crocodiles, including the Nile Crocodile."
18,Nairobi Railway Museum,"Nairobi, Kenya",Strolling through these vintage locomotives offers a surprising amount of insight into the history of Kenya.,https://www.atlasobscura.com/places/nairobi-railway-museum,"The construction of the so-called “lunatic line,” or Uganda Railway, began in 1896 from Mombasa on the Kenyan coast and finally reached Kisumu on the eastern shore of Lake Victoria in 1901, costing an estimated four lives for every mile of track laid along the way—including some deaths infamously caused by a pair of man-eating lions on the Tsavo plains. Today, in the centre of Kenya’s capital city, the Nairobi Railway Museum is dedicated to the history of the country’s rail network. There you’ll find an intriguing jumble of artifacts plus a variety of exhibits and ephemera that illustrate the construction and running of the railway. There are models of railway engines that operated on the line, photographs of the railway throughout its history, and a varied selection of other oddities, including an interesting motorized railway bicycle. In the surrounding yard are a number of mostly steam and some early diesel locomotives which operated as part of what was initially the Kenya-Uganda Railway, then the East Africa Railway Company and currently the Kenyan Railways Corporation. The most impressive are some of the company’s old “Garratts,” a particularly large articulated steam engine that was capable of hauling heavy loads over the long distances and steep inclines of the narrow gauge track. The museum is connected by track to the main Nairobi station and some of the engines are reportedly used for excursions. Wandering on and around the locomotives makes for a lovely outing and gives you a surprising amount of insight into the nation’s development. The museum itself is almost a time capsule within a time capsule—a well preserved effort from the post-independence days of the 1970s to conserve an emblematic part of its colonial past. Fitting then is the location of the museum, tucked away amid the modern skyscrapers of the central business district. The rising buildings are a constant reminder that all these days are past, a fact further underlined by the ongoing replacement of the obsolete track laid in the 1800s.  The museum is located in the centre of Nairobi near the railway station and is open daily from 9am-5pm. For those visiting and not well acquainted with Nairobi it would be advisable to take a taxicab to the museum and ask the driver to wait or call them when you are finished. The entrance fee for non-Kenyan residents is currently 600 Kenyan Shillings."
19,Karen Blixen Museum,"Nairobi, Kenya","The farmhouse owned by the Danish author who wrote ""Out of Africa"" is now a museum honoring her legacy.",https://www.atlasobscura.com/places/karen-blixen-museum,"Some 6 miles outside the center of Nairobi, the Karen Blixen Museum is located in a century-old farmhouse on 6,000 acres of land at the foot of Kenya’s Ngong Hills. The farm was once owned by the Swedish Baron Bror von Blixen Fincke and his wife, Baroness Karen Blixen, who gained significant prominence for her 1937 memoir, “Out of Africa.” The couple bought the property in 1917 and lived in the farmhouse until 1921, when Karen Blixen became the sole owner of the home following the end of her marriage. Blixen fell in love with an English game hunter named Denys Finch Hatton, who died in a plane crash in 1931. The tragedy prompted Blixen to return to Denmark that same year, and the farmhouse passed through several successive owners. In 1964, the Danish government purchased Blixen’s former farmhouse house and gifted it to Kenya as a token of the country’s newly gained independence from Britain. The house appeared in the film adaptation of Out of Africa in 1985, after which the National Museums of Kenya acquired the property to convert the house into a museum. The Karen Blixen Museum opened in 1986 in honor of Blixen’s life and work at her beloved residence “in Africa at the foot of the Ngong Hills,” as she so famously wrote.  The Karen Blixen Museum is open seven days a week from 9:30 a.m. to 6 p.m. Visitors are suggested to arrive no later than 5:30 p.m. Guided tours are offered daily."
20,Ha Kome Cave Dwellings,Lesotho,An 18th-century hideout became a permanent and ongoing residence for one Lesotho tribe.,https://www.atlasobscura.com/places/ha-kome-cave-dwellings,"The cliff overhangs of Ha Kome are a series of cave dwellings an hour’s drive from Maseru, the capital of Lesotho. While their exact history is unknown, the current inhabitants are descended from Basia tribesmen and women who first made the overhang home in the late 1800s. The Mefcane (“the Crushing”) was a period of intense socio-political unrest during the 1820s and 30s throughout southern Africa, defined by widespread drought, forced migration, and inter-tribal warfare. To flee the ongoing violence, the Basia began using the overhang as a hideout at some point in the late 1800s, though trademark cave paintings indicate San Bushmen dwelt here even earlier. In time, the Basia came to build homes out of mud, which have been continuously occupied since then. Today, several families who live in these dwellings welcome visitors into their homes.  Ha Kome is easy enough to find using Google Maps, but you'll need a vehicle with a high clearance to make it down the dirt road.  Stop in at the Visitor's Center, and a friendly guide will hop in to show you the way."
21,Masitise Cave House Museum,"Quthing, Lesotho",This odd little home was built right into an African rock face.,https://www.atlasobscura.com/places/masitise-cave-house-museum,"Built directly into the rock, the Masitise Cave House Museum is the former private home of Revered David-Frederic Ellenberger, a Swiss missionary. Ellenberger created the small residence in 1867 after he and his family were forced further South by the Basotho-Boar War. Ellenberger found a well-known cave in the rocky mountains of Lesotho and decided it was the perfect spot to found his new church, and bring God to the people of the country. The missionary built a brick edifice on to the opening of the cave and spent 55 years ministering to the peoples of the area. The cave had previously been used as a shelter for the local tribes, but soon became a beacon of Christianity. In addition to its half-natural construction the cave house also had a handful of other features. There is a dinosaur track in the ceiling and it is said that Ellenberger’s son is entombed in the wall. The home is now a small museum holding an eclectic group of objects, including family photos, traditional clothing, taxidermied animals, and of course a dinosaur footprint in the ceiling. The Cave House is about 5 kilometers west of Quthing. You have to turn onto the road for the Masitise Primary School. Before you reach the school, follow the road to the right. You'll reach a small cluster of buildings and someone there can open the Cave House for you."
22,Ha Baroana Cave Paintings,"Metolong, Lesotho","The walls of this sandstone outcropping are covered with 2,000-year-old artwork.",https://www.atlasobscura.com/places/ha-baroana-cave-paintings,"Deep in the cradle of civilization, you can still find traces of our ancient ancestors. Lesotho’s amazing Ha Baroana site is only an hour’s drive from the capital of Maseru, and on the far side of the Liphiring River, tucked inconspicuously beneath a black-and-tan cave, sit a remarkably preserved stretch of paintings. The walls of Ha Baroana, which translates as “home of the bushmen,” are decorated with paintings of animals like leopards, lions, antelope, cranes, and guinea fowls, as well as paintings of people hunting and dancing. It has been estimated that the paintings were made about 2,000 years ago by the San people, a group of hunter-gatherers who have inhabited southern Africa for thousands of years, long before the arrival of Bantu-speaking nations. Though the paintings are faded from years of exposure to the elements, it’s still possible to make out a series of hunting scenes, a sight that is sure to give even the most jaded wanderer chills.  It's best to take a local guide with a 4x4, as the last several kilometers of the trip call for crossing a series of working pastures.  Although the steep, scenic hike down into the river valley will be almost as impressive as the paintings themselves, the path isn't suitable for anyone for mobility issues, and can be downright treacherous during the rainy summer season."
23,Lion Rock Mountain,"Maseru, Lesotho","Just outside Lesotho's capital city, a rock formation takes the shape of a powerful predator.",https://www.atlasobscura.com/places/lion-rock-mountain,"Less than a 30-minute drive from the heart of Maseru stands one of the most unique rock formations in the world. Lion Rock Mountain might only rise a few hundred meters above the horizon, but it still somehow manages to create an amazing landscape, something straight out of The Lion King. If you’re headed away from the capital en route to Lesotho’s more remote attractions, a quick stop here is sure to fill you with wonder and inspiration.  Without any tourism infrastructure, there’s nothing more to do at Lion Rock Mountain than just stop and admire the formation.  The best views are from the parking lot of nearby Leqele High School, where the staff and students have grown accustomed to seeing groups of tourists and wanderers pull in and linger for a few minutes."
24,Subeng River Dinosaur Prints,"Jonathans, Lesotho",Take a step into the Cretaceous Period with these preserved dinosaur tracks.,https://www.atlasobscura.com/places/subeng-river-dinosaur-prints,"Just over two hours from the city of Maseru, the narrow Subeng River in northern Lesotho has been home to a series of fossilized dinosaur prints for hundreds of millions of years. The reward for wading across the shallow water is a chance to get up close and personal with the tracks of several types of dinos, including the unique three-toed prints of the chicken-sized Lesothosaurus. The fossilized footprints were first identified as dinosaur tracks in 1955. Footprints from at least three species of dinosaurs, possibly more, can be found at this site. In the preserved tracks, you can see that some had five toes on their feet, while others had three. By placing their hands down on the rocks, a visitor can instantly bridge the gap between the Cretaceous and the present.  The Subeng River rises quickly during the rainy summer months, obscuring several varieties of prints altogether.  If possible, it's best to plan your visit during the dry wintertime.  Bring a pair of boots if you have them, or a towel if you plan on going barefoot."
25,Thaba Bosiu Cultural Village,"Motloang, Lesotho",This sandstone plateau once served as a stronghold for Lesotho's King Moshoeshoe I and his subjects.,https://www.atlasobscura.com/places/thaba-bosiu-cultural-village,"More than a museum, more than a cultural center, Thaba Bosiu would be best described as the pride of Lesotho.  Featuring a full-scale recreation of a traditional village as well as a fascinating museum, this flagship tourist attraction is a must-visit on your first trip to the Mountain Kingdom. A blanket-clad guide is available on request, and their tour will change the way you view this fascinating enclave country. Thaba Bosiu is a sandstone plateau located between the Orange and Caledon Rivers in the Maseru District of Lesotho. It was once the capital of Lesotho, and served as the residence and military stronghold of Moshoeshoe I, the kingdom’s founding father, throughout most of his reign in the mid-19th century. In 1967, Lesotho’s government declared the mountain a national monument.  Thaba Bosiu is just a short drive from Maseru, and the paved road is well-marked.  The center hosts a number of events and special programs, so it's best to call ahead and see what's on."
26,Basotho Hat,"Maseru, Lesotho","Not only does this shop sell mokorotlo, the traditional hat of Lesotho, the building is shaped like one.",https://www.atlasobscura.com/places/basotho-hat,"The Basotho people comprise 99 percent of Lesotho’s population, so it seems fitting that the remote enclave country’s only official Visitor’s Center was fashioned after their traditional straw hat. The hat has a wide brim and a pointed top, a design that is said to be inspired by the shape of Mount Qiloane. A similar style of hat was worn by Basotho tribal chiefs, who performed a type of song known as mokorotlo at certain ceremonies. In the 1950s and 60s, the hats became popular among the wider population, and were called mokorotlo because of their connection to Basotho identity. It became such an important symbol that when Lesotho gained independence from Great Britain in 1966, it was selected to appear on the country’s new flag. Basotho Hat is a two-story arts and crafts collective that hosts a wide assortment of baskets and weavings, all of which were manufactured throughout the Mountain Kingdom. It’s a great way to support local businesses in a place where the average salary is less than $2 USD per day.  Located just a few kilometers after you cross into the kingdom from South Africa via the busy Maseru Bridge, the Basotho Hat makes a natural first stop for day-trippers and adventure travelers alike. Free on-street parking is available."
27,Abandoned Ducor Hotel,"Monrovia, Liberia","Empty since 1989, now falling into ruin.",https://www.atlasobscura.com/places/abandoned-ducor-hotel,"Once operated by Intercontinental Hotels, this hotel was abandoned in 1989 due to political uncertainty just before the coup and first civil war. Due to looting and locals taking up residence in the hotel through the years, the hotel is dilapidated and dangers exist throughout. However, able-bodied individuals should be able to navigate the stairways without too much trouble, and the sight from the rooftop - giving a full panoramic view of Monrovia - easily merits the effort. When the security staff ask you for a “small thing” to enter, just let them know you’re a teacher, Peace Corps volunteer, etc. and they should let you in - and likely escort you through - for two or three dollars."
