index,attraction,location,blurb,url,description
70,Failaka Island,"Zoor, Kuwait",Wander among the ghostly ruins of an island where civilization flourished for thousands of years.,https://www.atlasobscura.com/places/failaka-island,"Failaka Island lies about 20 km off the Kuwaiti mainland.  Archaeological excavations unearthed tools dating from 3000 BC, and ruins show that Mesopotamian civilization existed on Failaka island in 2000 BC.  Other artefacts show that the island has been continuously inhabited since then.  This record was almost broken in 1990. Prior to 1990, two thousand people inhabited the island, most living in or around Zoor (also spelt Zawr), the only town on the island.  During the weeks leading up to the Iraqi invasion of Kuwait, most people fled to the mainland, and the few that remained behind were forcefully deported by Iraqi troops.  Over the last few months of 1990 and the beginning of 1991, Iraqi forces used Failaka Island for target practice.  Beaches were mined and infrastructures damaged.  In February 1991, a US-led coalition forced Iraqi troops stationed on Failaka Island to surrender. In the aftermath of the Persian Gulf War, some of the original inhabitants returned to live on the island, some others turned their property into a weekend retreat, but most did not return.  The beaches were demined and the infrastructure was partly restored.  Today, most buildings on Failaka Island lie abandoned, riddled with bullet holes, covered by a layer of sand and overgrown with the sturdiest indigenous vegetation.  The ground is littered with cartridges, bomb casings, and other miscellaneous military items that have stood the test of time.  North of Zoor, Iraqi tanks and military vehicles, semi-destroyed and abandoned, make for an eerie sight. Another notable location on Failaka Island is the National Bank of Kuwait building, which must have been a particular favourite for target practice considering the amount of damaged inflicted on it.  There is no public transport on Failaka Island. Ikarus is a ferry boat company running tours of the island, but they are a bit rushed. An alternative is to rent a car in Kuwait City, put it on a KPTC ferry, and stay on the island overnight. Accommodation options are limited, but they do exist in Zoor. Parts of the island are off limits as the Kuwaity Army uses them for military maneuvers."
71,Kuwait Water Towers,"Kuwait City, Kuwait",Kuwait City's uniquely designed water towers look straight out of a retro sci-fi cityscape.,https://www.atlasobscura.com/places/kuwait-water-towers,"Dotted around Kuwait City are six groupings of eye-catching water towers. Five are composed of striped mushroom-shaped towers, and a sixth features towers that look like they’re about to take off for Alpha Centauri, albeit in a retro sci-fi kind of way. In 1953, the city set up two large seawater distillation plants. A lack of a piped water distribution system, however, meant that this water had to be transported to customers in tankers. So in 1965, a Swedish engineering firm was commissioned to build a modern water distribution system to connect the distillation plants to Kuwait City with an expansive system of water towers erected around the city. But the Amir of Kuwait at the time, Sheikh Jaber Al-Ahmed, didn’t want just any old water towers. He wanted structures that would also function as works of art—landmarks that would impart a sense of modernity and technological advancement upon all who gazed upon them. The firm presented a number of tower designs, and two types were selected. Five of the groups, consisting of 31 towers in total, feature the so-called Mushroom Towers, completed in 1976. These vertically stripped towers do indeed resemble mushrooms, supported on shafts of varying heights. Each concrete tank has a capacity of 3,000 cubic meters, with the groups placed in strategic locations around the city. Part of the reasoning behind the mushroom design was to create a kind of pillared hall, where shade was cast on the desert floor beneath the giant mushrooms. The idea was to create landscape gardens in the grounds beneath them, but not all of the groups have yet been decked out as such. For the sixth and final tower group, the Amir wanted something even more impressive, as these were to stand prominently on the bay across from the Amir’s palace compound. The engineering firm presented a handful of designs, and the Amir chose one that wouldn’t look at all out of place in a retro sci-fi cityscape. This group of three towers, known simply as the Kuwait Towers, was completed in 1979. The largest is a 607-foot concrete “needle” supporting two spheres along its length. The spheres themselves are clad in enameled steel plates, arranged in spiral patterns and in eight shades of blue, green and gray—a design chosen to imitate the mosaic surfaces of Islamic domes. The lowest but largest sphere is divided in two; its upper half contains a restaurant, banquet hall, and indoor garden, while the lower half holds a large reservoir. The second and highest sphere holds no water, instead functioning as a rotating viewing platform and café. The second tower is 482 feet tall and serves only as a water tower. The third is a bare needle with no spheres, but does hold equipment and lighting that illuminates the other two towers.  The five groups of Mushroom Towers can be seen sprinkled around Kuwait City, and are typically admired from afar as nothing more than landmarks. The map coordinates above point to the Kuwait Towers, located in downtown Kuwait City, on the bay and just off Arabian Gulf Street in the Sharq District. The Viewing Sphere opens from 9 a.m. to 11:30 p.m. daily. The entrance fee is 3 Kuwaiti dinar (about $10 USD). The restaurant is free to enter and is open from 8 a.m. until midnight."
72,Tareq Rajab Museum of Islamic Calligraphy,"Jabriya, Kuwait","A private collection of over 30,000 ancient and modern items showcasing the beauty of Islamic calligraphy.",https://www.atlasobscura.com/places/tareq-rajab-museum-of-islamic-calligraphy,"This remarkable museum houses the private collection of Tareq Sayed Rajad, a Kuwaiti national with a passion for art, history, archaeology and, of course, calligraphy. Rajad’s collection was first opened as a museum in 1980, but suffered a setback in August 1990 when Iraqi forces invaded Kuwait. Fearing destruction, the museum staff packed up each item in the collection and hid the boxes in a secluded place that was eventually blocked off. Not all the items in the museum could be rescued, but in spite of this, the museum reopened again in 1991. A little over a decade later, Rajad decided to open a museum entirely dedicated to Islamic calligraphy. The Tareq Rajab Museum of Islamic Calligraphy consists of two sections, one dedicated to manuscripts, miniatures, pottery, metalwork, and carvings, and the other to clothing, jewelry, musical instruments, and other items. Given the size of the collection, it is difficult to single out individual items. But among the most prized artifacts on display are an extremely rare folio with Hijazi script from the 7th century and manuscripts by Yaqut al-Musta’simi, a famous 12th-century calligrapher. The museum doesn’t only focus on pieces with historical value, however. Islamic calligraphy is about creating a harmonious work of art that expresses feelings, traditions, and aesthetics. These themes can be seen displayed throughout the collection, on different media, influenced by different cultures, and ultimately imbued with the aesthetic sensibility and mastery of the artist.  The museum is located on Street 1 in Jabriya, about 5.5 miles (9 km) southeast of Kuwait City."
73,'Highway of Death',"Abdali, Kuwait",This road earned its macabre nickname after hundreds of Iraqi troops died along it in 1991.,https://www.atlasobscura.com/places/highway-of-death,"Highway 80 was used by Iraqi troops to invade Kuwait. It became known as the “Highway of Death” when Iraqi troops later used it to retreat. A six-lane highway linking Basra to Kuwait City, Highway 80 proved to be extremely useful to invading Iraqi forces in early August 1990.  In a short time, approximately 300,000 Iraqi troops poured into Kuwait, mostly using this roadway. On August 8, 1990, Iraq officially annexed Kuwait, and on the same day, the first United States Air Force planes began to amass in Saudi Arabia, while NATO and other Arab countries joined military efforts to contain the conflict. On January 17, 1991, a U.S.-led coalition started hitting strategic Iraqi targets. It wasn’t until February 24 that coalition ground forces were deployed, and three days later, Iraqi troops started retreating from Kuwait. It was over these few days that coalition forces bombed the head and tail of the military convoy, trapping the Iraqi troops on Highway 80. For 10 hours, one airstrike followed another, destroying hundreds of vehicles. The death toll on Highway 80 is a matter of contention, from an unlikely low estimate of 200 casualties to a more credible estimate of 500 or 600 casualties. Highway 80 was repaired soon after the invasion was over. And, in a strange twist of fate, the road was used by U.S. and British forces in the 2003 invasion of Iraq. Pictures of hundreds of torched vehicles along a strip of asphalt in the desert became iconic images of the Persian Gulf War. As a result of this, Highway 80 has appeared in poems, movies, and video games. These days, it’s a busy road cutting through desert and farming land. The only reminders of what happened on this road are a handful of road signs thanking U.S. troops.  Highway 80 runs from Kuwait City (Kuwait) to Basra (Iraq). As it's still an active road, take caution if you decide to stop and take pictures."
74,Al-Qurain Martyrs Museum,"Qurain, Kuwait",The site of a bloody showdown between invading Iraqi forces and a cell of the popular resistance in Kuwait.,https://www.atlasobscura.com/places/al-qurain-martyrs-museum,"In the aftermath of the Iraqi invasion in 1990, several cells of popular resistance arose throughout Kuwait. One of these groups was formed by 31 young men who took a collective oath to defend their native land. They called themselves the Al-Messilah Group. First, the group collected all the weapons they could get their hands on, including buying them from Iraqi soldiers who were desperate for cash to buy food and water. Second, Al-Messilah began carrying out urban guerrilla activities. Between the end of 1990 and the beginning of 1991, they bombed Iraqi military targets and sniped Iraqi soldiers. When security became tighter, the group decided to relocate to Al-Qurain, about 12 miles south of Kuwait City, due to the small presence of Iraqi troops in the area. Al-Messilah Group went underground for some time, but when the U.S.-led coalition announced its plans to liberate Kuwait, Iraqi operations became more and more ruthless, and the resistance decided to restart its activities. On February 24, 1991, Al-Messilah, housed in a private house in Al-Qurain, was readying itself to support the liberation troops. At 8 a.m., 19 members of the group were in the building when an Iraqi contingent approached. A soldier knocked at the door, and, receiving no answer, jumped over the fence and attempted to break into the house. It was standard procedure that if people were found, they would be imprisoned, and if people were not found, the building would be ransacked. Al-Messilah Group could either surrender or fight, and they chose the latter. A member of Al-Messilah Group shot the soldier dead. Another Iraqi official was shot at and injured. The contingent retreated in a hurry, but in a short time, Iraqi forces surrounded the mansion, and a bloody battle ensued. The battle lasted 10 hours, during which Al-Messilah Group is said to have killed hundreds of troops. At about 6 a.m. Iraqi troops managed to overpower the Kuwait fighters and entered the building, but their reconnaissance was made difficult by the darkness and the amount of rubble piled up everywhere. Buried under the rubble, undetected, were seven members of Al-Messilah Group, injured but alive. Of the 19 members who were trapped in the house, only they survived. In the aftermath of the liberation, the Kuwaiti government turned this semi-destroyed house into a national museum, the Al-Qurain Martyrs Museum. The rubble was cleared, but holes pockmark all the walls of the building, both in and outside. Sections of the floors and walls have collapsed, and destruction can be seen everywhere. Across from the museum is one of the Iraqi tanks used in the battle. Two exhibition rooms were opened on the ground floor. On display are the weapons used by Al-Messilah Group and the ammunition used by Iraqi forces, alongside documents related to the battle. One of these documents is an official order found in an Iraqi vehicle instructing troops to “burn and destroy all homes on which there were slogans hostile to our leadership.”  Al-Qurain Martyrs Museum is located in the densely populated town of Al-Qurain, about 12 miles (20 km) south of Kuwait City. Public transport can take you to Al-Qurain from Kuwait City, but you are likely to be dropped on King Fahed Bin Abdul Aziz Road. The museum is about half a mile (1 km) from there."
75,Beiteddine Palace,"Beiteddine, Lebanon",After this one-of-a-kind palace was built the architect's hands are said to have been cut off to keep it that way.,https://www.atlasobscura.com/places/beit-ed-dine-palace,"When first laying eyes on Beit ed-Dine Palace it’s easy to see why it is seen as one of Lebanon’s greatest cultural treasures with its elaborate architecture, historic mosaics, and priceless decorations. However, all of this beauty was created at a high human cost. Built over 30 years beginning in 1788, the palace was the personal home of emir Bashir Shihab II who wanted the mansion to be a place of singular beauty and legendary opulence. The castle was built on a hermitage called Beiteddine (House of Faith) and featured all manner of amenity including a lush personal apartment for the emir, a harem, and a rich guest house that was often offered to passing luminaries and dignitaries. Many of the surfaces were inlaid with intricate mosaics and designs, many of which have survived remarkably well to this day. Unfortunately all of this grandeur is said to have come at a great price. While it is likely an apocryphal story, it’s been said that the emir ordered that the architect of his palace have his hands cut right off so that the Beit ed-Dine Palace could not be duplicated. In addition he is said to have conscripted all of his healthy male subjects to work on the project for days at a time for no pay. Despite the possible labor tragedies associated with it, the palace was eventually taken over by the Ottomans and used as a government building before eventually being turned into a protected historic site. Today the palace still retains its stunning architecture and hand-made mosaics and is an important site for both visitors and the people of Lebanon."
76,The Grudge (Al Ba’sa),"Beirut, Lebanon",Beirut's thinnest building was the result of feuding brothers.,https://www.atlasobscura.com/places/the-grudge-al-basa-beirut-lebanon,"A sliver-thin house in Beirut, built in 1954, is the ultimate display of how deep sibling annoyance can go. Known as The Grudge, or Al Ba’sa in Arabic, the house is just a bit over 13 feet at its widest point, and just around 2 feet at its narrowest. At a side view, the “house” built of brotherly spite looks more like a wall than a place to live. But despite its narrow dimensions, Al Ba’sa is habitable, and is the skinniest building in the city. As the story goes, two brothers inherited land from their father. They couldn’t decide how to split the land between them, a dispute complicated further by the fact that one part of the property had been cut over the years by various municipal infrastructure projects, leaving a portion of the land a small and sort of odd shape. One brother decided to take that small, oddly shaped bit of land and build on it, constructing a building that fit the confines of the land with the added bonus of blocking his brother’s ocean view. Not only would his brother not be able to enjoy his spectacular sea view, but because he was now facing what was essentially a wall his property values would sink, too. The perfect plan. Over the years, there have been some tenants in the house that sibling rivalry built. Each floor of the structure contains two apartments. For years, one was in use as a brothel, while the others served as refuge for a family fleeing the war. Today the house stands as a reminder of a long-ago feud, and it probably will for a very long time; current city zoning laws state that the plot of land the house sits on is too small to build on. If The Grudge comes down, nothing else can be put in its place, making the land more profitable with the house than without it. As architect Sandra Rishani pointed out in her essay on the house, Al Ba’sa “continues to exist grudgingly and also defiantly in one of Beirut’s most prime locations, only time will tell what will become of it.” The Atlas Obscura Podcast is a short, daily celebration of all the world’s strange and wondrous places. Check out this episode about spite houses.  The location of the Grudge house is just north of the old lighthouse on Bliss. Google Earth shows it as a school."
77,Baalbek Trilithon,"Baalbek, Lebanon",The largest hewn stone in history.,https://www.atlasobscura.com/places/baalbek-trilithon,"There were many stone movers in the ancient world. From Stonehenge to Macchu Picchu, ancient peoples found a way to move stones of massive proportions. The Olmec of Central America moved enormous stone heads, possibly by floating them down rivers on rafts. The Inca created mountaintop kingdoms out of enormous yet intricately fitted stones, each dragged for dozens of miles. Easter Islanders carved and moved some of the largest stone sculptures ever created. The largest hewn stone yet discovered, however, was not found in any of these places, but in the Lebanese town of Baalbeck, in the ruins of a city once known as Heliopolis, “the City of the Sun.” In the base of the ruins of the Jupiter Baal Temple lie three hewn stones known together as the “trilithon.” Each is estimated to weigh over 750 tons. Construction on the massive Roman temple of Jupiter began roughly 27 years before the birth of Jesus, and while most scholars agree the blocks were cut by the Romans, there is some evidence that the trilithon may predate their presence in the Middle East. In fact, the stones may predate even Alexander the Great, who founded Heliopolis in 334 B.C. Whether Roman masons or some other group, someone devised a way to move these massive blocks from the quarry over many miles and to then lift them onto a base of smaller blocks. In addition to the trilithon, there is a fourth stone in the temple, the largest of them all—indeed, the largest stone ever hewn by man. Known as the “Stone of the Pregnant Woman,” it weighs an estimated 1,200 tons—equivalent to three Boeing 747s. This massive weight apparently proved too much for anyone to move, and the stone was left in the place where it was cut, an enormous rectangle sticking up at an angle from the ground. How Roman architects (or whoever it was that moved the trilithon) ever thought they would move such an enormous block remains a source of much debate. The Atlas Obscura Podcast is a short, daily celebration of all the world’s strange and wondrous places. Check out this episode about the Baalbek Trilithon."
78,Jeita Grotto,"Jitta, Lebanon",A monumental underground karstic wonderland is also the water source for over a million citizens of Beirut.,https://www.atlasobscura.com/places/jeita-grotto,"In 1836, American missionary Reverend William Thomson was poking around in a cave in Lebanon when he happened upon an underground river. Intrigued by the find and suspecting the cave held more to be discovered, Thomson—in remarkably American fashion—pulled out his gun and squeezed off a shot to aurally investigate further. The resulting echo made him believe he’d happened upon something rather impressive. He wasn’t wrong. Jeita Grotto (Arabic: مغارة جعيتا‎‎) is a spectacular underground system consisting of two separate cave systems intertwined with one other, with a total astounding length of 5.6 miles (9 kilometers), making it the longest cave system in the Middle East. The Lower Cave is home to an underground river some 3.9 miles (6.2 kilometers) long, while the Upper Cave features innumerable dazzling rock formations including one of the largest hanging stalactites in the world, measuring 27 feet (8.2 meters). It is more accurate to say that Thomson rediscovered Jeita Grotto, as various chambers were inhabited during prehistoric times, and the remains of an ancient foundry in an exterior portion of the Lower Cave suggest that it was used for swordsmithing in antiquity. Today the subterranean river that flows through it forms the headwaters of Nahr al-Kalb, a river that provides fresh water to over one million people in Beirut. The Lower Cave was opened to the public in 1958, at which time the previously unknown Upper Cave was also discovered. Visitor access to the Upper Cave commenced in 1969 with an inauguration ceremony featuring an electronic music concert by François Bayle. The Lebanese Civil War led to the closure of Jeita Grotto in 1978, as the tunnels were being used to store ammunition. Treasured as one of the national symbols of Lebanon, the site was reopened to the public in 1995. Today, visitors can tour three chambers in the Upper Cave via platforms and raised walkways that permit exploration without disturbing the natural landscape. The Lower Cave can only be toured by boat. The annual swelling of the river leaves the Lower Cave unnavigable and thus closed to visitors in the winter. Grab a coat or something to keep warm! Summers in Lebanon may be hot, but the grotto sure isn't. Best route is the scenic route through the mountains in the cable car."
79,Byblos Archaeological Site,"Jbeil, Lebanon",A patchwork of ruins from various civilizations in one of the world's oldest continually inhabited cities.,https://www.atlasobscura.com/places/byblos-archaeological-site,"One of the oldest continuously inhabited sites in the world, the historical significance of this place is literally still being uncovered. Wandering around the various ruins offers visitors a fascinating walk through history. People have lived in Byblos since the Neolithic era, and the city witnessed the rise of the Phoenician civilization. This archaeological site exists as a preserved timeline of the many people who once called this patch of land home. Ruins from different eras speckle the space. Some of the older structures, like the L-shaped temple, date from as far back as 2700 BC. Newer structures were built on top of older ones as various civilizations settled the space, each one leaving behind fragments of their own histories. Bits of Roman pillars litter the tomb of a 4,000-year dead king of Byblos. Roman structures and a later Crusader castle are built with mysterious pink granite quarried in Egypt. There’s also a Persian fort, the Temple of Obelisks (which was built on top of the L-shaped temple), Phoenician dwellings and tombs, and a charming Roman theater with the Mediterranean sea as its backdrop. A large proportion of the ancient artifacts you can see at Beirut’s National Museum were excavated here.  Easy to locate from Jbeil, entrance is around $10. The handy map at the entrance helps you identify what you see."
80,The Egg,"Beirut, Lebanon",This modernist cinema has survived war and reconstruction to become a symbol of Lebanon’s revolutionary spirit.,https://www.atlasobscura.com/places/the-egg-beirut,"This modernist movie theater was once the jewel of a bustling downtown in pre-war Beirut, but today it is full of bullet holes. The district is a short walk from the rocky Mediterranean coast, and was once dotted with cinemas. The Egg, which was officially part of the never-finished Beirut City Center complex, was one of the most unusual. It was popular among Beirut residents until civil war broke out in the 1970s, and the building suddenly found itself on the front line separating the West and East. The structure was built in 1965 by Lebanese architect Joseph Philippe Karam, part of a golden age of construction when modernist designers were commissioned to experiment with new ideas and materials across the city. Karam envisioned two large towers on either side of the cinema. Only one was built, and it didn’t survive the war. What did survive years of fighting was the distinct, egg-shaped shell of the cinema—with the scars to prove it. The Egg remained off-limits to the public as downtown Beirut was razed and reconstructed after the war. For years, it remained a curiosity to a generation of Lebanese with no connection to the old downtown area. Only after massive protests swept the country, beginning in October 2019, were the barriers torn down. Protestors flooded the building, decorating it with art and holding raves and film screenings inside. Now, any passerby is welcome to explore the building and witness an iconic piece of Beirut’s history.  The structure is impossible to miss from Martyrs’ Square in downtown Beirut. Simply walk over the remnants of a barricade to go inside the building. Take care, as the site hasn’t been inspected for safety in decades."
