index,attraction,location,blurb,url,description
98,Belval Blast Furnaces,"Esch-sur-Alzette, Luxembourg",Two standing giants remain as a tribute to Luxembourg's metallurgical past.,https://www.atlasobscura.com/places/belval-furnaces,"In the heart of the campus of the University of Luxembourg, surrounded by the modern buildings of the Luxembourg Institute of Science and Technology, stand two tall blast furnaces. These holdovers from the region’s industrial past recall a time when Luxembourg was one of Europe’s principal sources of iron ore. At the time of its independence in 1867, the landlocked Grand Duchy of Luxembourg was one of the poorest nations in Europe. However, during the 20th century, a competitive steel industry is developed in the southwestern part of the country along the border of France—an area known as the “red lands.” Much of Luxembourg’s current prosperity was built on the exploitation of the region’s rich stores of iron ore. Despite its small size, Luxembourg was once the seventh-largest iron producer in the world. It was one of the six founding members of the European Coal and Steel Community, which laid the early foundations for the European Union. Around 1910, the forest surrounding the small town of Esh-sur-Alzette was cut down to build Belval’s ironworks. More than 3,000 men worked at the site, which was home to three massive blast furnaces. In 1993, a switch was made to electric furnaces, and in 1997, the country’s last active blast furnace was shut down for good. As the steel industry in Luxembourg declined, the economy diversified into production of construction materials, engineering, and chemical manufacturing. The furnaces of Belval were integrated into the main campus of the University of Luxembourg. Since 2014, the furnaces have been open to the public, who can follow the self-guided tour to learn more about their functioning and the history of the iron industry in the region. Moreover, it is possible to climb up to a 40-meter (131-foot) platform on the furnace “A”, to the level of the feedstock inlet, and discover an impressive panorama on the region. The furnaces are also open several nights a year, during which visitors are able to roam the furnaces with hard helmets and frontal lamps.  The furnaces are open to visitors between April and October, Wednesday through Friday from 10 a.m. to 7 p.m., Saturday from 10 a.m. to 6 p.m., and Sunday from 2 p.m. to 6 p.m. Admission costs €5. The Belval-University train station is very close to the furnaces, and has regular trains from and to Luxembourg City."
99,Melusina Statue,"Luxembourg, Luxembourg",This magenta statue commemorates the legendary marriage between a mermaid and the city's founder.,https://www.atlasobscura.com/places/melusina-statue,"Medieval legends about a legendary figure known as the melusine or melusina can be found throughout Europe, from Germany to Albania. Similar to a water elemental or fairy, the melusine is typically depicted as a mermaid, sometimes with a dragon’s tail from the waist down. In Luxembourg, legend has it that Count Siegfried, who founded the city of Luxembourg in 963, married one of the legendary creatures. After hearing the singing of a beautiful maiden, Siegfried was entranced. The maiden agreed to marry the Count as long as she was allowed to be left alone every Saturday. The morning after their wedding, a castle, known as Lucilinburhuc, magically appeared on Bock, an area in the northeastern corner of Luxembourg City’s historic district. Eventually, after the pair had seven children, curiosity got the better of Siegfried. He snuck in and took a peek at his wife while she bathed through the keyhole. Siegfried saw his wife combing her long hair in a tub of water, but when he looked down at her legs, he say they were replaced with a long serpent’s tail. In an instant, she was gone, disappearing into the depths of the Alzette river. Since then, it has been said that melusine returns every seven years in human form to seek redemption. Another version of the story says she holds a key, and that she can only leave the river if the key is taken from her. If you take a walk along the Alzette, you may find a magenta, polygonal statue of the mythic mermaid seated on the bank. Local artist Serge Ecker created the statue in 2015, utilizing 3D printing, to belatedly celebrate the country’s 1050th anniversary. The statue was also featured on the commemorative 10-Euro gold coin issued in 2021 for a limited number of 1,500."
100,Old Watertrough of Stone,"Saeul, Luxembourg","Resting peacefully between two majestically-slanted trees, this roadside water trough circulates water peacefully.",https://www.atlasobscura.com/places/old-watertrough-stone,"Resting peacefully between two majestically-slanted trees, the Old Watertrough of Stone circulates water peacefully at the roadside. Based on the carving style, cistern shape, and the worn smoothness of the stone, the water trough appears to be a Belgian bluestone horse trough made between the 17th and 19th centuries. The stone has held up remarkably, but it has also softened from use over time. The trough is roughly 300 centimeters long and 50 centimeters wide, with 26 centimeters exposed above the ground. The water cistern depth measured 32 centimeters to the bottom, which included a large amount of sediment. There were nine centimeters of fresh water above the sediment, meaning the trough extends at least six centimeters below the ground level, due to the difference in depth of the cistern and the exposed trough. Each end of the trough gives ample flat space for setting and filling jugs or just taking a rest. When looking at the Old Watertrough of Stone with your back to the road, you can see the water entering the trough on the left, circulating through the cistern, then draining out on the right side. It creates a beautiful sound that washes away stress. The views while stilling on the trough were lovely. In summer, grass grows up around the trough, making it harder to find.  No dedicated parking is available near this site, so use caution when pulling over to park and walking along the country road where the Watertrough is situated. No indication is given as to whether the water is potable, so drinking the water is not recommended."
101,Les Saltimbanques,"Luxembourg, Luxembourg","Statues of a fire-breather, a clown, and a whole performing troupe celebrate Luxembourg's creative side.",https://www.atlasobscura.com/places/les-saltimbanques,"IN A SMALL SQUARE CALLED Place du Théâtre, flanked by the Cinémathèque and the 17th-century Kapuzinertheater building, stand a set of statues representing Luxembourg’s longstanding tradition of celebrating the performing arts. Created in 1987, the Saltimbanques, or “acrobats,” sculptures were designed by local artist Bénédicte Weis, who won the first prize at a national competition with the design a year prior. The bronze statues depict a group of street performers in medieval attire, including a clown and a fire-breather, as well as a whole troupe of dancers and musicians. Traveling performers like these are believed to have been quite common in Luxembourg during the Middle Ages. The statues are both a tribute to the city’s history and the timeless nature of the arts.   The sculptures are a favorite photo-op for visitors to the city."
102,Popeye Village,"Mellieha, Malta","An abandoned set from the 1980 film ""Popeye,"" claimed and repurposed as a theme park by creative locals.",https://www.atlasobscura.com/places/popeye-village,"The set from Robert Altman’s film Popeye, shot in Malta, was never fully struck and remains on the island as a sort of misplaced relic. The live-action film based on the popular comic strip and animation character, a spinach-loving sailor, marked the film debut of Robin Williams in the title role. Over 20 wooden structures were built with the tree trunk logs imported from Holland and wooden shingles brought in from Canada, making the town quite the production. Eight tons of nails and 250 gallons of paint were used in constructing the set, and a 250-foot breakwater was built to protect the filming area from the high seas. The film itself was a box-office bomb. But rather than tearing the set down or leaving it abandoned, the islanders saw it for what it was: a pre-built theme park. They eventually took over the abandoned set, hired actors, and the Popeye Village was born.  Boat trips and some parts of the village are not open during off seasons or when the weather is bad. Entrance fees and special package costs also vary by season."
103,Mnajdra,"Qrendi, Malta",Stone Age solar temple is aligned with the sun on each equinox and solstice.,https://www.atlasobscura.com/places/mnajdra,"Mnajdra (“mna-ee-dra”) is a Neolithic temple complex on the southern coast of Malta, less than a kilometer from the famous Hagar Qim temple. Built around the fourth millennium BCE, Mnajdra is among the world’s most ancient religious sites. It is also the site of an astronomically aligned solar temple, positioned so that the sun’s light illuminates the structure in special ways on equinoxes and solstices. At sunrise on the vernal and autumnal equinoxes, when the earth is tilted neither away nor towards the sun, brilliant rays of sunlight penetrate the door of Mnajdra’s lower temple and light up the building’s main axis. And on the summer and winter solstices, when the earth’s spin axis is tilted the farthest amount towards and away from the sun, respectively, the sun’s beams fall directly on the edges of megaliths to the right and left of the temple’s central passage. According to archaeologists, Mnajdra also served as the backdrop for ceremonial sacrifice. This notion is evidenced by the flint knives, restraining ropes, and animal remains found at the site. The presence of stone benches and tables also suggests the temple may have had a sort of medical function, serving as a center for healing and promoting fertility. Since 2009, the temples have been covered by a metal truss and fabric canopy to protect the soft stone from erosion and deterioration in the elements. These structures were built without disturbing the site, and do not obstruct sunlight during the astronomical alignment. Bus: 32, 35"
104,Maltese Catacomb Complexes,"Rabat, Malta","The remains of more than 1,000 people lie deep under the modern town of Rabat.",https://www.atlasobscura.com/places/maltese-catacomb-complexes,"From the 3rd to the 6th centuries, the Roman city of Melite developed a complex system of burial grounds on its outskirts under the modern town of Rabat, a village outside of Mdina, the medieval capital of Malta. Roman law prohibited burials within the city, which derives its name from the Arabic word for suburb. Known today as St. Paul’s and St. Agatha’s catacombs, the burial grounds form an important part of Malta’s early Christian history. The catacombs include tombs for more than 1,000 bodies in 2,200 square meters. The organizational and architectural complexity of the catacombs points to the ritual importance of burial grounds in early Christianity. The catacombs were planned in a centralized manner, providing private space for numerous family units, while leaving a lot of communal space for festivals and rituals. The entrance to the main complex of St. Paul’s leads to two large halls, adorned with pillars made to resemble Doric columns and painted plasters. The main hall is equipped with large circular tables and couches, carved out of rock. They were probably used during burial rituals and festivals of the dead. In some places the burial corridors were cut in three subterranean stories. The catacombs were abandoned sometime in the 7th century during the later stages of the Byzantine Empire. They were reopened during the re-Christianization of the Island after 220 years of Fatimid rule. The catacombs became a popular site for religious pilgrimages in the 12th century and a Christian shrine was recut in the 13th century. There are a number of smaller catacombs dating back to antiquity in Malta. One was rediscovered within a traffic roundabout close to the Malta International Airport in 2006. The Hal Resqun tomb was originally excavated in 1912. Soon after its discovery, the catacomb was covered up by a road surface, following the development of the Luqa Airfield.  Hours: Monday to Sunday: 09.00-17.00hrs. Last admission at 16.30hrs. Closed on 24, 25 & 31 December, 1 January & Good Friday"
105,St. John’s Co-Cathedral Skeleton Tombstones,"Valletta, Malta",The floor of this spectacular Baroque sanctuary is covered in memento mori.,https://www.atlasobscura.com/places/st-john-s-co-cathedral-skeleton-tombstones,"While exploring St. John’s Co-Cathedral, it’s easy to be dazzled by the gilded walls and ceilings adorned with historic frescoes and glittering gold leaf. But don’t let this ornate splendor steal all your attention. Be sure to turn your gaze downward, too, to admire its marble floor covered with images of skeletons. The story of these cadavers is inextricably linked with the history of the Order of Knights of the Hospital of Saint John of Jerusalem. In 1530, the Knights were given permanent headquarters on Malta and the island of Gozo. In return, they had to send a single Maltese falcon to the King of Spain each year on All Saints’ Day as payment. The presence of the knights here was considered important for maritime defense, as the Mediterranean was then a region of continuous conflict. Barbary pirates in search of slaves raided towns and cities, and the Turkish Ottoman Empire continued its military expansion. Such a danger would soon become a gruesome reality, when in 1565, the Sultan of Turkey, Suleiman the Great, sent a force of 40,000 men to invade and conquer the island, which was then defended by only 700 knights and 8,000 soldiers. Heavily outnumbered, the besieged Knights lost approximately half of their men in battle and many more of the ordinary soldiers lost their lives too, though Malta did win the battle. The decadent cathedral that stands today was built between 1572 and 1577. The nearly 400 Knights who fell during the Great Siege of Malta were originally buried elsewhere, but were later reinterred within the spectacular structure. The skeleton-covered floor is comprised of their tombstones.  The Cathedral of St. John is in center of Valleta and is open Monday to Friday from 9:30 a.m. to 4:30 p.m. and on Saturdays from 9:30 a.m. to 12:30 p.m. The entrance fee costs €10 Euro. The skeletons themselves are very easy to find, as they feature in almost every image on the floor."
106,Secret Passage in St. Gregory's,"Iż-Żejtun, Malta",A hidden tunnel of bones in one of Malta's oldest churches.,https://www.atlasobscura.com/places/secret-passage-in-st-gregorys,"In the 1960s, locals discovered a secret passageway in one of the oldest churches in Malta. Within, they found a wooden shoe sole, a small wooden cross, three coins, pieces of pottery, chainmail armour, and a large pile of human bones. St. Catherine’s Old Church sits on the outskirts of Żejtun. It’s dedicated to St. Catherine of the Wheel, but locals call it Saint Gregory’s for a traditional procession held yearly on the first Wednesday after Easter Sunday. Very little remains of the original medieval church, built before 1436. The church’s present edifice is a fusion of Gothic and Romanesque and dates back to the 16th century. Its dome is one of the oldest Maltese cupolas. Around the dome is a secret passage built in the walls of the southern transept. The passage is U-shaped and contains a large number of human bones. Local legend claims that the people were buried alive within these passages during the siege of 1614. Studies conducted between 1978 and 1980 concluded that the bones were probably exhumed and moved there from a cemetery, and that the deaths had all occurred around the same time. For about three centuries St. Gregory’s served as the parish church for all of southeast Malta. The church once doubled as a watchtower; the orientation of the southeast transept of the church is aligned with the bays of Marsaxlokk harbour, St. Thomas Bay, and Marsascala Bay. The church occupies the highest point that overlooks the harbours in the south, a once frequent landing spot for Barbary pirates. The secret tunnel was ideal for the lookouts who watched for pirates in the bays. Unwanted landings were communicated to French troops in the north via smoke signals from the roof of the church. The church is generally not opened. They only open it a handful of days a year, on special local holidays."
107,Ħal Saflieni Hypogeum,"Paola, Malta",This subterranean necropolis holds three floors of antler-dug grave caves.,https://www.atlasobscura.com/places/hal-saflieni-hypogeum,"A labyrinthine early neolithic catacomb complex and the burial ground of about… 7000 bodies or so. Inhabitants of the small and arid island nation Malta have been digging cisterns for water storage for eons, but in 1902, while laborers worked on one, they stumbled into one of the most remarkable and well preserved neolithic sanctuaries yet found. Buried only 10 meters beneath unpromising city streets lies an incredible network of elliptical chambers and winding corridors cut into the limestone. It is the only prehistoric burial site that is open to the public and is recognized by UNESCO. It is believed that its first chambers were cut into a small natural cave around 4000 BCE or earlier. Two even deeper levels are believed to have been finished centuries later, between 3000 and 2500 BCE. For context, the first megaliths at Stonehenge are thought to have been raised around 2500. The Ħal Saflieni Hypogeum is also unique in that certain chambers, notably the “Holy of Holies” have shed light on what the insides of prehistoric structures may have looked like. For instance the corbelled ceiling has been taken as a hint that the temples on Malta’s surface, now uncovered, could have once sported similar roofs. The Oracle Chamber has beautiful red-ochre spiral motifs, while others house bones and clay figurines, or simply water. Certain walls reveal that the complex was excavated by drilling the walls with antlers and then using stone (obsidian, flint, and chert) tools to break away the rock. No matter how it was made, the Ħal Saflieni Hypogeum makes for a fascinating underground kingdom that makes modern burial techniques look quaint. Advance reservations required. UNESCO limits the number of people admitted to 60 per day to carefully regulate light and Carbon Dioxide levels. Tickets now available online!"
108,The Old Prison,"Victoria, Malta","This prison on the Maltese island of Gozo is almost 500 years old, and they have the graffiti to prove it.",https://www.atlasobscura.com/places/the-old-prison-victoria-malta,"The nation of Malta is an archipelago of 21 islands, the second largest being Gozo, home to the Citadel, an ancient fortified city within a city. Inside the walls you’ll find the Old Prison, where you can get a glimpse into some pretty grim prison-digs from centuries gone by. Covering the walls and floors is centuries of graffiti, etched-in proof that carving your initials and crude drawings go back long before “Kilroy was here.” Known simply as “The Old Prison,” it was an active jail beginning in the mid-16th century, originally run by the Crusades-era Knights of St. John. At the time it was used for knights who were a little rowdier than the others, and their 5x10-foot block cells gave them some time to cool their heels, and apparently let off a little artistic steam. Much of the graffiti relates to the knights and their symbols, including crosses, medallions known as the “Malta Cross,” and lots of plain old handprints, names, and dates. There are also some intricate carvings of ships, some with multiple planks on the hulls. One theory is that the planks were used as a kind of calendar system for the prisoners, as a tally of their time served. The Old prison was later controlled by the British after the Knights were kicked out of Malta, and it was in some use up until 1962 when it closed completely, eventually being meticulously restored for visitors to see. Notable prisoners included Jean Parisot de La Valette, the founder of Malta’s capital city of Valleta, who spent four months there in 1538. He was convicted of attacking a man, and he later went on to become the Grand Master of the Order of St. John. Not bad for an ex-convict. The Old Prison is in the fortified Citadel of the capital city of Victoria on the island of Gozo, the second largest of the many islands that make up the archipelago of Malta. The Prison is open every day from 9am to 5pm (last entry at 4:30) except holidays. Admission is €8 for adults, €5 for age 12-17 and seniors, €4 for age 6-11, and under age 6 are free. Your admission also gets you into other Citadella Sites, the Folklore Museum, the Gozo Archaeology Museum, and the Natural Science Museum."
109,Ta’ Bistra Catacombs,"Il-Mosta, Malta","These lesser-known Maltese catacombs date back over 1,700 years.",https://www.atlasobscura.com/places/ta-bistra-catacombs,"Concealed beneath a traditional Maltese farmhouse in Mosta, the Paleochristian Ta’ Bistra catacombs date back 1,700 years. They were built sometime during the fourth century AD and were rediscovered in 1891. The Ta’ Bistra catacombs are important because they could potentially reveal the burial rituals of some of Malta’s earliest Christian dwellers. They’re the largest set of catacombs that have been found outside Rabat, where the island’s more famous catacombs are located. The site is 300 feet long and consists of 57 tombs laid out in 16 chambers. It was excavated in 1933. Unfortunately, the farmhouse that was built on top of the catacombs had caused some damage to the ancient chambers. At one point, the tombs were occasionally used as an animal pen, while during World War II, the catacombs also served as an air raid shelter. The farmhouse has since been converted into a visitor center. The visitor center, and the catacombs, are wheelchair friendly. Opening Hours: every Tuesday, Thursday and Saturday between 9:00 a.m. and 5:00 p.m. Last admission is at 4:30. Closed on December 24, 25, and 31, January 1, and Good Friday."
110,Jesus Tree of Malta,"Mdina, Malta",The Jesus tree of Malta bears a striking resemblance to Christ on the cross.,https://www.atlasobscura.com/places/jesus-tree-malta,"According to Maltese legend, a local tree was struck by lightning many years ago, and changed in appearance. Its contorted bark metamorphosed into an image of Jesus hanging from the cross. Although the Catholic Church officially recognizes miracles, it has declared that these types of apparitions are no longer worthy of “public revelation.” The issue of public vs. private revelation has been a contentious one for the Church, but was recently clarified by the current pope, Joseph Ratzinger. Ratzinger declared that public revelations (essentially big, flashy miracles), ended with the death of the last living Apostle in 100 A.D. Apparitions, even though officially recognized by the church, are now deemed to be “private revelations,” which means one doesn’t have to believe in them. Such revelations are binding on whoever has them, but not upon all Catholics. Of course, for non-believers the tree is neither public nor private revelation, but rather an example of the psychological phenomenon of pareidolia, the perception of meaningful significance in a meaningless, random stimulus. Regardless of religion, these sorts of images of Jesus, Mary, the name of Allah, or a Singaporean monkey god, continue to appear in the oddest of places, and to intrigue the faithful. The Jesus Tree of Malta is located right off the main road from Zebbug to the walled city of Mdina, the former home of the Knights Hospitalier.  Take the road from Zebbug to Mdina. After leaving Zebbug, at the base of Mdina, there's a round-about. Proceed up towards Mdina, and the tree is located approximately half way up on right-hand side. You'll notice first all the flowers, plaques and homage that locals place daily at the foot of the tree."
