index,attraction,location,blurb,url,description
117,Semipalatinsk Polygon,"Semey, Kazakhstan",One of the most horrible legacies of the Cold War is a site where the Soviet Union tested nuclear bombs on civilians.,https://www.atlasobscura.com/places/semipalatinsk-polygon,"Prior to 1990, Semipalatinsk (today known as Semey) was one of the numerous closed cities of the Soviet Union. Only high-ranking officials of the politburo knew about the going-ons within these cities. Nobody except those few with clearance were allowed to enter or leave these areas, and these closed cities did not even appear on maps or road signs. When the Cold War ended, most of these closed cities were abolished, and the secrets they concealed became known to the public. While most of these places were only strategical military locations or sensitive mining areas, some of these places truly hid incredible secrets – like the formerly closed city of Semipalatinsk. The Polygon was the primary nuclear test site of the Soviet Union. In total, 456 nuclear tests have been conducted between 1949 and 1989 at Semipalatinsk, including 340 underground and 116 atmospheric explosions. Altogether, the number of nuclear explosions at Semipalatinsk equals more than 2,500 Hiroshima bombs. A huge number of craters, partly filled with water, testify to these experiments. It was not the only nuclear test site of the Soviet Union, but it was the only one close to major settlements. The Soviet Union conducted these nuclear tests without regard to the health effects on the 200,000 residents of the Semipalatinsk area, who weren’t evacuated or warned during the actual explosions. Local residents soon became aware of what was going on, and witnessed health problems soon after the first tests. Cancer rates in the Polygon area skyrocketed and a couple of years following the first tests, a disturbingly high number of children with genetic defects were born. There was nothing the people could do about it, since they were not allowed to leave the boundary of the closed city area. Finally, in 1989, an anti-nuclear movement called “Nevada Semipalatinsk“ was formed, that forced the weak and crumbling Soviet Union to refrain from further nuclear tests and to close the site. Following the independence of Kazakhstan, the closed city status was abolished. The site may have been closed and the tests may have stopped, but the legacy of the nuclear tests lingers on. An area of more than 18,000 square kilometers is heavily contaminated and seemingly as many as 1.5 million people – a tenth of the total population of the country – have been diagnosed with health problems that can be attributed directly or indirectly to the nuclear tests. Even today, people continue to live in the Polygon area. Since this is one of the poorer regions of Kazakhstan, few people have been able to move away. Those who stayed continue to rely on contaminated local crops and water, and even dismantle structures of the Polygon to obtain scrap metal they can sell. Cancer rates, including leukemia, are still as extraordinarily high as they were decades ago, as are infertility and depression. Still, one in twenty children are born with severe birth defects – and almost none of the other nineteen are born healthy. The disturbing 2010 documentary film “After the Apocalypse“ describes the current situation of the site.  The place can be visited with a permit. Therefore you need to buy a tour of one or two days."
118,Soyuz 11 Memorial,"Zhanaarka District, Kazakhstan","The remains of a monument in the remote Kazakhstani desert dedicated to the only men to die in outer space, the crew of the Soyuz 11 rocket.",https://www.atlasobscura.com/places/soyuz-memorial,"Located in the center of Kazakhstan, 16 miles of desert away from the nearest road, lies a giant, black monument that only a small handful of people have ever laid their eyes on. This is the Soyuz 11 Memorial. Every man who has ever lived was born on Earth — a record that it’s estimated won’t be broken until 2050. But there have been men — three, to be exact — who died far outside of Earth’s atmosphere. Of the 439 people ever sent into space, only 18 never made it back, and of these 18, only the three-man crew of the Soyuz 11 died in “outer space”, defined by the U.S. government as at least 50 miles away from the surface of the Earth. The Soyuz 11, a Russian rocket which launched in June of 1971, was the only manned mission to ever board the world’s first space station, Salyut 1. There, the crew set the world record for the longest amount of time spent in space, at 22 days, which was broken by the American “Skylab 2” two years later. Despite a fire on day 11 and the fact that the entire spaceship vibrated when the treadmill was turned on, the mission went well. That is, until it was time to go home. Just after leaving the space station, the three crew members died of asphyxiation. This was caused by a minor technical mistake when the two bolts linking the orbital module and the descent module were popped open simultaneously (as opposed to sequentially). This doubled the exerted force, rupturing the valve that automatically stabilized the spacecraft’s pressure. The pressure inside the spacecraft dropped to zero in three and a half minutes. The rocket landed in rural Kazakhstan hours later, where a rescue crew went to retrieve the bodies. According to the chair of the Russian State Commission, the crew found that the bodies of the three men were “motionless, with dark-blue patches on their faces and trails of blood from their noses and ears.” To honor their memory, at the exact location that the Soyuz 11 landed in the middle of nowhere, the Russian government built a large black monument with three sides, each engraved with the face of one of the three crew members. Constructed in 1973, it was hardly ever visited due to its remote location, but it paid due respect to those who lost their lives for the Space Race. Unfortunately, it only lasted 39 years. In 2012, a group of visitors found that the monument had been vandalized. Only metal bars and scattered ruins remain. As of 2016 a new, smaller monument has been installed reading, “the feat of the crew ‘Soyuz-11’ will always be stored in the memory of grateful descendants. Georgy Dobrovolsky, Vladislav Volkov, and Viktor Patsaev proved the possibility of a prolonged stay of man is of the earth, laying the foundation for future space projects.” Perhaps the best way for the legacy of the crew of the Soyuz 11 to live on is in the hearts and minds of all who remember their sacrifice on our continuing journey into space."
119,Ascension Cathedral,"Almaty, Kazakhstan","In Kazakhstan, a colorful cathedral with many lives once survived the most powerful earthquake in the region.",https://www.atlasobscura.com/places/ascension-cathedral,"The eye-catching golden domes and kaleidoscopic color scheme of the Ascension Cathedral in Almaty, Kazakhstan, draw visitors to the city’s Panfilov Park, but the building’s genius architecture and complex history demand just as much attention. After nearly 40 years of deliberations, construction of Almaty’s Ascension Cathedral began in 1904, according to architect Constantin Arkadyevich Borisoglebsky’s design. However, as Borisoglebsky had left the city in 1902, it was regional engineer Andrei Pavlovich Zenkov who made addendums to Borisoglebsky’s plans and oversaw construction. As such, it’s commonly called the Zenkov Cathedral. Construction was completed in 1907. In addition to the church’s striking beauty, the architecture and engineering command respect; at a height of 56 meters, the Ascension Cathedral is one of the tallest wooden constructions in the world. It’s widely believed that the church was built entirely without metal. However, while the vast majority of the structure is made of Tien-Shan spruce, there are a small number of nails, bolts, and other metal pieces. The church’s interior came from artistic workshops in Moscow and Kyiv, while the icons were painted by local artist and ethnographer, Nikolay Gavrilovich Khludov. The Orthodox community attended services there until 1927 when they were banned by the Soviet regime. The Cathedral was subsequently vandalized and looted. Over the ensuing decades, it served a variety of public functions, including an exhibition center, concert hall, and the first Central Museum of Kazakhstan. The Cathedral’s bell tower was also the site of Kazakhstan’s first radio transmission center, placed there in the early 1930s. Extensive renovations took place in 1976, and the cathedral was finally returned to the Orthodox church in 1995. The massive earthquake that destroyed most of the buildings in Almaty—then known as Verniy—in 1887 must have left an impression because Borisoglebsky’s design was meant to be earthquake-proof. He included what he called a “seismic basket,” fitting the building’s wooden beams with metal braces and brackets that allowed them to sway with the motion of an earthquake if another one struck, which it did in 1911, laying waste to most of the surrounding buildings. The cathedral’s survival contrasted so sharply with the surrounding ruin that local bishops called it an act of God. Zenkov’s response to that, if he had one, was not recorded, but he was certainly proud of his engineering. He wrote with awe that during the earthquake the bell tower waved like the top of a tall tree in a high wind, bent but unbroken.  The cathedral is located in Panfilov Park in the center of Almaty, Kazakhstan, and is easily accessible by public transport."
120,Zelionyj Bazaar,"Almaty, Kazakhstan","This sprawling market is a one-stop shop for traditional Kazakh foods, from mare’s milk to sheep’s head.",https://www.atlasobscura.com/places/zelionyj-green-bazaar,"You don’t need to love either food or shopping to understand why the Green Bazaar in Almaty is a local favorite and landmark. This two-story green market, in business since 1875, puts most farmers’ markets to shame, with its wide array of Kazakh delights, ranging from fizzy, alcoholic milk to horse sausage. Rows of vendors sell meticulously arranged baskets of kurt, smooth balls of a dry, salty cheese made from fermented mare’s or sheep’s milk. The cheesemongers also sell kumis, a lightly alcoholic beverage made with fermented mare’s milk, which they ladle out of buckets into small soup bowls. Dried apricots, raisins, figs, and other fruit and nuts lie like little jewels on trays, next to fresh fruit being pressed on hand-cranked juicers. The smell of freshly cut flowers, spices, and produce lingers as one walks through the bazaar. From salty camel’s milk to fish roe to horseradish condiments, customers are encouraged to have a taste as they peruse the stalls. The meat selection at the bazaar is extensive, including an entire section dedicated to horsemeat. Here, beneath slabs of hanging meat, butchers prepare and sell varieties of horsemeat sausages, including shuzhuk and qazı, a spicy, garlicky sausage made from horsemeat ribs seasoned and stuffed inside a horse intestine. Sheep’s heads, considered a delicacy, are sold too. On festive occasions, koy bas, a boiled sheep’s head preparation (served cold, with a garnish of onions) is a typical accompaniment to beshbarmak, the popular Kazakh meat-and-noodles dish. The first iteration of the bazaar was built in 1875, as a stopping point for traveling merchants. Though its newer modern building bears few similarities to the original, the market still serves as a place where cultures and cuisines can mingle. Rows of vendors sell spices, nuts, and dried fruit from across Central Asia, as well as honey and fresh breads. There are even stalls selling kimchi. If you’re still hungry after the generously proffered tasting samples, stop over for tea and noodles at one of the food stalls lining the perimeter. And if you must be a tourist, embroidered Kazakh hats, jackets, and intricately woven slippers are some of the beautiful souvenirs on display.  The market is open every day except Monday. The market closes at 7 p.m."
121,Cosmonaut Grove,"Baikonur, Kazakhstan",Avenue of trees planted by cosmonauts before their space departures.,https://www.atlasobscura.com/places/cosmonaut-grove,"In a tradition that goes back to Yuri Gagarin and the Soviet space program, each cosmonaut crew member has planted a tree before their departure at the Baikonur Cosmodrome. The trees are located behind the Cosmonaut Hotel, which was designed for cosmonauts to rest before their space travels. The grove lines the Avenue of the Cosmonauts, as it’s called, and each is designated with a plaque with the crew member’s name and the year. Gagarin’s tree stands the tallest, while recent Soyuz crews have smaller saplings growing from the soil. A planting traditionally takes place the day before a voyage, although it can also be the week before, and it’s accompanied by a walk in the grove to remember the intrepid cosmonauts who came before through the trees that flourish in their absence."
122,Tash Rabat,"At-Bashi District, Kyrgyzstan",Extremely isolated Silk Road caravanserai in the middle of nowhere.,https://www.atlasobscura.com/places/tash-rabat,"Today, we picture the caravans traveling along the Silk Road from China to the Middle East as a rather romantic image. This romanticized portrayal conceals the real dangers that the journey included, since the Silk Road crossed some of the most inhospitable regions imaginable, and many travelers died en route. Unlike its name suggests, the Silk Road was not a single route, but a connection of several established tracks, each with its own fair share of threats. Caravanserais were an extensive network of traveler’s inns along old caravan roads, either located at cities along the way or as outposts of civilization in isolated regions, providing shelter from the hostile natural environment and from bandits. Travelers who reached Tash Rabat have already crossed the dangerous Torugart Pass, giving them the chance to recharge their energy for the next leg of the journey through the Tian Shan Mountains, to pray for a safe passage and to restock on food and water. Some historians argue that Tash Rabat may have been a Christian or Buddhist monastery before it was turned into a caravanserai, but there is little evidence to support this theory. The legend says that it was built by father and son. As they were building cupola on the roof, the son heard a caravan coming from afar. The father asked him to stay so they could finish the work. But the son went to greet the caravan and fell in love with traveling girl. He left his father, who was so sad that he didn’t finish the cupola and left few holes in it. Inside the caravanserai there is little to experience except wandering aimlessly through the dark corridors which are lit only by small openings in the roofs. These damp corridors and rooms, which include a well, a dungeon and a mosque, are extremely atmospheric, especially since it is not unlikely that the few visitors to the site may have the place entirely to themselves. Silk Road caravanserais can still be found all along the former Silk Road from Central China to the Mediterranean Coast. What makes Tash Rabat stand out among the myriad of caravanserais, is its isolated location in a meditative landscape, which gives a good sense about how difficult and dangerous travel along the remote parts of the Silk Road must have been. Even today, with modern 4WD vehicles and navigation systems, venturing out here is anything but straightforward. Snow blocks the road, which connects it with the nearest settlement, At-Bashy, for up to eight months a year. Even without snow blocking the road, constant landslides and avalanches, not to mention regular earthquakes and floodings often turn the road into a mere suggestion. Therefore, the road leading to Tash Rabat should under no circumstances be tackled without a local driver. Altitude sickness is another threat, which should not be taken lightly, since the caravanserai is located at a height of 3,500 meters. If a sudden change in road conditions make a return journey impossible, yurt camps in the vicinity of Tash Rabat can provide shelter. To the East, the road continues to the Torugart Pass border post with China, one of the most notoriously unpredictable borders in Asia, which is reputedly more often closed than it is opened, and where crossing the border can include several days of wait."
123,Muzey Sulayman Too,"Osh, Kyrgyzstan",An outstanding piece of retro Sci-Fi architecture built into a sacred mountain.,https://www.atlasobscura.com/places/muzey-sulayman-too,"With a bonnet-like facade protruding from the face of a cliff along a sacred mountain, this location would have been the perfect setting for a Bond villain, if Soviet movie makers had made the Russian equivalent of Bond movies, or perhaps a settlement on a newly discovered planet in the Star Trek series. Muzey Sulayman Too (also spelled Sulaiman-Too) is housed within a combination of natural and human-made caves that accommodate a total of 13 exhibition rooms. The museum is unique in that the building is just as—if not more—interesting than the exhibits in it. On display are a mismatch of natural and archaeological items, along with a handful of religious artifacts that border on new-age spirituality. Ancient pots, a modern statue of the Buddha, stuffed animals, plastic figures of a prehistoric human, black and white pictures from the Soviet era, and a chamber for spiritual healing sit incongruously (yet intriguingly) side by side. An overwhelming number of plastic chandeliers light the way for the visitors. Muzey Sulayman Too is actually the most recent evolution of this location, which was first used in 1949 to house the Museum of Local Lore. The museum in its current form opened in 2004, but the building as can be seen today was completed in 1978 to celebrate Osh’s 3,000th anniversary.  The museum is open from 8:30 a.m. to 6:00 p.m. The museum offers great views of the city."
124,Dungan Family Restaurant,"Yrdyk, Kyrgyzstan","On the shores of Kyrgyzstan's Issyk-Kul Lake, a family cooks a feast that tells the sad tale of a people's exile.",https://www.atlasobscura.com/places/dungan-family-restaurant,"In the small village of Yrdyk in the far east of Kyrgyzstan, a Dungan family prepares a traditional Dungan Feast in their home restaurant for inquisitive travelers who not only enjoy good food, but a good history lesson, too. In the late 19th century, thousands of Chinese-Muslims fled across the Tien Shan Mountains to Central Asia after their failed rebellion against the ruling Qing Dynasty led to their exile. The arduous journey brought many to Karakol, then a wild frontier town of the Russian czar’s vast empire. Their descendants would become known as Dungans—“the people from the east”—and their cooking would become legendary. The mass exodus would leave the Dungan people in a state of permanent exile, but while they might have lost their homes, they never forgot their culinary traditions. Mamieva Hamida, the mother and head chef leads the preparation of Dungan dishes in her family home in Yrdyk, a center of Dungan culture on the outskirts of Karakol. She even shows guests how to prepare the most popular Dungan dish, ashlan fu. This cold-yet-spicy and revitalizing noodle soup survived war, exile, and the repression of the Soviet era to become a firm favorite in Kyrgyzstan. But before delving into the culinary world of the Dungans, guests are first taken to the local history museum in Yrdyk. Here they learn from enthusiastic amateur historians and storytellers the legends and myths of the Dungan people, and the dramatic story of their exile from China to Kyrgyzstan. The family then serves up a feast for their hungry guests in their living room. A long table is set in the middle of the wide room, and the smell of home cooking wafts through from the adjacent kitchen. Chopsticks are placed alongside knives, forks, and spoons, as a family member pours out steaming hot tea as the food begins to be served. A Dungan Feast comprises at least eight different dishes, and it’s a delectable fusion of cuisines. There are Central Asian–style manti dumplings, Chinese-inspired sweet-and-sour dishes, and bowls of pelmeni that would be more at home in a Russian canteen than in a Dungan family home. The fusion of all these flavors, spices, and styles demonstrates more than anything the tale of Dungan exile from China, and the establishment and integration of their communities in Central Asia.  The Dungan Family Restaurant of Mamieva Hamida is located in the village of Yrdyk, a short drive from the city of Karakol. It's right around the corner from the village history museum. If you're hungry for history and Dungan food, then you'll need to book a spot in advance through the local tourism office."
125,Monument to Yuri Gagarin,"Barskoon, Kyrgyzstan",A boulder carved into the shape of the cosmonaut's head.,https://www.atlasobscura.com/places/monument-to-yuri-gagarin,"On the south shores of lake Issyk-Kul in Barskoon, in the northeastern corner of Kyrgyzstan, is a giant face carved directly into a massive rock. Specifically, it is the giant head of cosmonaut Yuri Gagarin. While the giant face of the first man to journey into outer space, complete with cosmonaut helmet, is carved directly from solid rock, the story behind its creation is less certain. It seems that Yuri visited the area just shortly after his historic spaceflight. He may have even stood on this very rock. At which point, everyone was so psyched about the whole first man in space thing, the boulder was promptly carved into his likeness. Later, in a meta tribute to the first monument, a second more standard bust was erected. A local rumor has an more whimsical version of the rock’s origin. The rumor says that this was in fact where Yuri touched down, a fact which was covered up by the USSR because it was nowhere near the intended landing spot. While almost certainly untrue (Yuri did eject from his capsule landing near the village of Smelovka, in the Ternovsky District) it makes for a wonderful origin story. While unconfirmed this may in fact be a recreation of the first big Yuri rock head, which is said to have been broken up and smeared with concrete after the fall of the Soviet Union. This newer restoration is said to have been paid for by Moscow.The monument can be found driving up the gorge from Barskoon into the mountains."
126,National Museum of Kyrgyzstan,"Bishkek, Kyrgyzstan","Time capsule of a museum, in which the Soviet Union remains alive and kicking.",https://www.atlasobscura.com/places/national-museum-kyrgyzstan,"Kyrgyzstan’s National Museum harbors numerous interesting exhibitions, ranging from excavation finds to fascinating ethnographical collections, partly housed in dusty cabinets. But for the few Western visitors that make it to Bishkek, the real draw is the weird Soviet memorabilia. Lenin is omnipresent in the shrine-like room of the Kyrgyz Soviet Revolution on the upper floor, where his conterfeit – alongside Mikhail Frunze, Kyrgyzstan’s own leading communist – can be seen on porcelain vases and on traditional Kyrgyz rugs. Soviet flags adorn the ceiling and the walls of the hall, and the Hammer and Sickle symbol can be found anywhere. Then there are the highly bizarre murals – rather unusual depictions of Soviet propaganda, since they were not created during the heyday of Soviet propaganda displays, but only shortly before the collapse of the Soviet Union. The style is unique, since it forms a transition from typical Soviet propaganda to modern art. Arguably, the most grotesque mural depicts former US President Ronald Reagan, riding Dr. Strangelove-style on a Pershing, wearing a mask of a grinning skull, while being surrounded by people demanding “No more Hiroshimas“. Additional bronze murals depict key events in communist and Soviet history, among others, Marx and Engels speaking to the people, Lenin inspiring the masses, the October Revolution and the burning tsarist palaces. Sooner or later, the Soviet pieces will likely be removed from the museum, but for now they still remain in place. Update February 2021: The museum is currently being renovated and is closed to the public. The murals have been removed.  As of November 2015, the museum is undergoing a renovation, which may very well include painting over these amazing murals. No amount of begging or attempted bribery will gain one access. A giant Lenin statue dwells behind the museum however, if that's any consolation. Also, beware roaming dogs nearby... they do indeed bite."
