index,attraction,location,blurb,url,description
94,Beehive Tombs of Bat,"Ibri, Oman",Groups of prehistoric tombs that dot the mountains of Northern Oman.,https://www.atlasobscura.com/places/beehive-tombs-of-bat,"More than 100 tombs stand defiantly on the hilltops of Northern Oman, all shaped like beehives. Little is known about the tombs, or the culture that constructed them, but they are thought to date from 3000 to 2000 B.C.E. All together they form one of the largest protohistoric necropoleis in the world. It is a bit difficult to spot the tombs at first, since they merge harmoniously with the hills they were built on, but upon closer inspection they are easily spotted. The tombs are arranged in three main clusters, the one in Bat, which is arguably the most famous, as well as the sites of al-Ayn and al-Khutm. The best preserved tombs of the site are the ones of the al-Ayn grouping. The earlier tombs of the site are simple structures, with only one entrance and one funerary chamber, and the later tombs have two entrances and up to four tomb chambers. Each of the tombs were built as collective burial places for this mysterious bronze-age culture. Besides the tombs, only a few artifacts give any clue to the culture, and are basically limited to a few arrowheads, daggers and water jugs. In 1988, the tombs were inscribed as a World Heritage Site.  Close to Ibri, Adh-Dhahirah Region, Oman. Surprisingly, it's not considered bad form to crawl into one of the tombs and explore. All burial artifacts are long-since gone, but locals sometimes use the tombs as overnight shelter. There's a significant lack of direction signs on how to get to each of these sites. In Bat, the main road goes around a long unfinished fence and you can go inside with your car or walk-in."
95,Snake Canyon,Oman,Nature's water park in the Wadi Bani Awf valley is full of pools flanked with cliffs and natural water slides.,https://www.atlasobscura.com/places/snake-canyon,"Wadi Bani Awf stretches across the Hajjar Mountains, roughly between Nizwa and Rustaq. One of the largest valleys in Oman, it is dotted with picturesque villages, ruins, and natural wonders. One part of the valley, known as Snake Canyon, has been called Oman’s largest natural water park. Much of the valley’s length is through pools that can be jumped into from the high rocks or simply waded through, and there are several waterfalls and natural waterslides. This is an outdoor adventurer’s dream playground. Throughout Wadi Bani Awf, there are places where the colorful rock has been so worn down by rushing waters that it is incredibly smooth, and slippery even when dry. The cliffs on either side are extremely high and at times so narrow that a hiker can touch both sides at once. There is also a “Little” Snake Canyon, probably the narrowest part of the valley. This slim canyon features a 200-foot-long pool, which can get quite cold since the sun has trouble reaching through the narrow canyon opening. Travelers are warned that there are no easy escapes if they change their mind once they have started this trek through Snake Canyon. The canyon floods very quickly, so it is dangerous to be there in the rain. The Royal Oman Police constantly monitor the weather and warn adventurers not to risk their lives. People have drowned in the past. Beyond hiking, Wadi Bani Awf is known as a memorable off-road drive for people who are more motor-minded. It is also good for camping and rappelling."
96,Wadi Dawkah Frankincense Trees,Oman,These gnarly desert trees produce the prized aromatic resin traded along the ancient incense trail.,https://www.atlasobscura.com/places/wadi-dawkah-frankincense-trees,"Frankincense is one of those words with strong biblical associations and relatively little everyday use. That is, if you’re not in or from the Arabian Peninsula. Frankincense is a resin of the Boswellia sacra tree, more commonly referred to as the frankincense tree. These gnarled trees may not be the most majestic plants on earth, but they are extremely sturdy, and they can be tapped for their aromatic resin. Frankincense resin is used for the production of incense, perfumes, and essential oils, and it was a highly prized product in antiquity. This natural park of frankincense trees is located in Wadi Dawkah, an important stop along the ancient Frankincense Trail, an incense trade route that’s been used by merchants for millennia. Around 5,000 frankincense trees can be found in this desert valley, including some ancient specimen. Although frankincense trees can reach a height of 26 feet, most trees in Wadi Dawkah are no more than 10 feet high. Around age 8 to 10, frankincense trees are mature enough to be tapped. In April, when the temperatures are rising fast, the trees can recover from the tapping process. Using a putty knife, workers scrape the bark of the tree; the exact location and number of incisions per tree are dictated by the knowledge that has been passed down from one generation to the next. Resin oozes from the wound, which is left on the tree for two or three weeks to harden. The first harvest, however, is not usable. Workers will repeat the tapping process soon after the first harvest, and the second harvest yields the raw material for the production of incense and essential oils. The same goes for the third and final tapping of the season. A mature healthy tree can produce around 7 to 9 pounds (3 to 4 kg) of frankincense a year. Unfortunately, frankincense trees have drastically decreased in number over the years due to over-exploitation. The natural park in Wadi Dawkah has the dual purpose of protecting the existing trees and growing new ones in order to increase the population of frankincense trees in the wadi.  The natural park is located about 40 km north of Salalah along Route 31. It is part of the Land of Frankincense UNESCO site, which also includes a museum and ancient ruins."
97,Bibi Maryam Mausoleum,"Qalhat, Oman",This lonely tomb is all that remains of a once-bustling ancient trade hub visited by Marco Polo.,https://www.atlasobscura.com/places/bibi-maryam-mausoleum,"Qalhat was once a shining jewel along the Omani coastline. The Indian Ocean trade route brought many people through the ancient city, which Italian explorer Marco Polo described as having “fine bazaars and one of the most beautiful mosques.” In the late-Middle Ages, when it was Oman’s first capital, the city was notably encircled by a fortified wall and was bustling with shops, bazaars, and houses. But when trade in the area shifted to Muscat, Oman’s current capital, Qalhat began its decline into obscurity. It was eventually captured by the Portuguese in 1507. Today, a single mausoleum is all that bears witness to the city’s former glory. Some say the lonely tomb was built by Baha al-Din Ayaz, king of the Hormuz Empire, for his wife, Bibi Maryam. But others maintain that it was indeed her who built it for him."
98,Misfat al Abriyyin,"Misfat al Abriyyin, Oman",Traditional architecture and ancient irrigation systems are on display in this gorgeous mountain village.,https://www.atlasobscura.com/places/misfat-al-abriyyin,"Misfat al Abriyyin is a beautiful rural village near Nizwa that’s notable for both its traditional architecture and agriculture. Seen from the distance, this mountain village is a remarkable sight, as its verdant gardens sit in stark contrast with the rocky, rugged, and arid valley. First of all, Misfat al Abriyyin (also spelled Misfat al Abriyeen) consists of an interesting amalgam of traditional mud houses and more recent additions and renovations. The houses are packed together, and above narrow alleyways the buildings are connected. The alleys are interspersed with uneven steps and steep ramps, with narrower passageways branching off to a house or the gardens. Seen from the garden, it’s possible to appreciate the architectural feat of building multi-story houses perched on boulders. Although some of the older buildings are abandoned, Misfat al Abriyyin is a living village. The residents here make a living from the gardens, and to a lesser extent, tourism. Thickets of date palm trees cover the terraces, surrounded for miles by barren rocks. Agriculture in the village has succeeded through the centuries thanks to a traditional Omani irrigation system known as aflaj, underpinned by a communal understanding of natural resources. There is archaeological evidence that aflaj was used in Oman as early as 5,000 years ago. It is a simple but effective way of using water, in which water sources found uphill are channeled through a village and its adjacent gardens.  Misfat al Abriyyin is located 34 miles (55 km) northwest of Nizwa. A paved road leads to the village, but the village itself can only be explored on foot, as it consists of narrow passageways up and down the steep slopes of the hill. Signs at the entrance of the village request visitors to dress modestly (i.e. long trousers/skirts and no bare shoulders), to refrain from smoking and drinking alcohol, and to not pick fruit. Basic accommodation and food is available in Misfat al Abriyyin. A shop at the entrance of the village sells local produce, such as honey and date syrup."
99,Nizwa Fort,"Nizwa, Oman",This beautifully restored fortification kept the city safe for centuries.,https://www.atlasobscura.com/places/nizwa-fort,"In the heart of the ancient city of Nizwa, lies Oman’s most visited national monument. The Nizwa Fort was constructed over a preexisting structure that dates back to the 12th century. However, the structure on display today was constructed around the 1600s and took around 12 years to complete. Nizwa Fort stood as the administrative seat of power for various Imams and Walis during times of conflict and peace. The fort is a shining example of the amazing architectural advancements that took place during the Ya’rubi era. The Nizwa Fort has the added prestige of possessing the tallest tower attached to a fort in Oman. The tower also employed various techniques to disrupt enemy invasions such as false doors, cannons, secret shafts, and narrow staircases. There are also several pitfalls located around the fort’s dark passageways to surprise enemy intruders. Today, these attributes are on display for tourists, while the turret offers splendid views of Nizwa. A short walk from the fort lies the bustling Nizwa Souk, where a large collection of clay pottery and souvenirs unique to Oman can be purchased. While used for centuries as a tool of war and defense, today, the Nizwa Fort stands as a beautiful and strong tribute to Oman’s often turbulent history."
100,Telegraph Island – Jazirat al Maqlab,Oman,This remote British Imperial telegraph relay outpost drove men insane.,https://www.atlasobscura.com/places/telegraph-island-jazirat-al-maqlab,"The expression “going around the bend” is not just an idle phrase. For a handful of British soldiers in the mid-1800s, being stationed “around the bend” was the worst place you could possibly be, a lonely island outpost where soldiers slowly lost their minds in the desert heat. From 1864 to 1869, Jazirat al Maqlab, or “Telegraph Island,” was an active telegraph outpost crucial to communication between India and Britain. For five years after the telegraphy was decommissioned, British soldiers continued to man the isolated outpost. Reportedly, every single man stationed at the outpost “around the bend” of the Musandam peninsula completely lost his mind from the monotony and heat. Stuck for months on the football-field sized island, cut off from the outside world, and subject to intense desert heat, the solders were slowly driven mad. Today the island is a ghostly remnant of the once-great British Empire. The outpost was abandoned in the mid-1870s, and the buildings have crumbled. The island now serves as a snorkeling and fishing destination rather than a strategic communication hub, but the oppressive heat and the lonely atmosphere that helped drive the soldiers “around the bend” remains. The Bullet Ferry runs from the mainland to the island daily. -or- Hire a Dhow (traditional fishing boat) to take you to the island for exploration and snorkeling or fishing."
101,Majlis al Jinn Cave Chamber,"Quriyat, Oman",This giant underground cave chamber can only be accessed through a small opening at the top.,https://www.atlasobscura.com/places/majlis-al-jinn,"Majlis al Jinn is the second largest cave chamber in the world by surface area. The base of the cave is 624,000 square feet, the size of nearly 11 football fields. However the only way to get in is through one of three tiny openings at the top, all of which have been formed over time as the accumulation of rainwater dissolved the limestone covering. This cave chamber, located 60 miles from Muscat, was discovered by Americans Don Davidson Jr. and his wife Cheryl Jones in 1983. They noticed the strange holes in the ground on aerial photographs, and eventually made the journey out via helicopter. When they looked down into the small openings, they saw the sandy floor below - over 500 feet down. Just days later, they rappelled down for the first time. In an attempt to find an appropriate name for the chamber, they asked the Omanis in the surrounding area if they had a local name for it, to which the response was no. They did, however, mention that they believed that the cave was filled with genies, which are prevalent in Omani mythology and the Quran. In Arabic, the word for “genie” is “al-Jinn”, so hence, the American explorers named the cave is “Majlis al Jinn. “Majlis” means “meeting place,” making the cave name, “the meeting place of the genies.” Now accessible by four wheel drive automobiles, this cave room has become a hot spot for abseilers and BASE jumpers. A small hole at the top sheds a beam of light into the vast base. Strangely, the bottom of this chamber appears to be a sort of graveyard for goats (who presumably fell in), snakes, and birds - their bones littering the floor."
102,Tayq Sinkhole,"Tayq, Oman",A powerful cyclone once made one of the world's largest sinkholes completely fill with water.,https://www.atlasobscura.com/places/tayq-sinkhole,"Because of the geological structure of the subsoil, there’s a wealth of sinkholes scattered all over the Arabian Peninsula. Tayq Sinkhole’s claim to fame rests on its size, as it’s one of the largest sinkholes in the world. It’s so big it resembles a deep wadi, or ravine. The sinkhole measures about half a mile across and its lowest point is 820 feet deep. Like other sinkholes, Tayq was caused by water dissolving the karst limestone in the subsoil until the top layer of soil eventually collapsed. In this case, the water was fed by rivers running along Wadi Sharaa and Wadi Thirrat, which join at Tayq. In May 2018, Cyclone Mekunu hit the region with extreme winds and rainfall. Five times the average amount of annual rainfall poured on the area over four days, causing floods and massive damage. During this time, so much water flowed into Tayq that it filled the whole sinkhole. It’s speculated that water slowly flowed to the sea via caves connecting Tayq Sinkhole to Tawi Atayr Sinkhole (five miles away) and the coast (nine miles away). You can reach the bottom of the sinkhole via a steep path from the southern side, but if you approach the sinkhole from the main road, there is no way to reach the bottom other than abseiling from the edge. Local villagers undertake this hair-raising task when there is a drought and they need to fetch water from the cave at the bottom of the sinkhole. For those seeking an adrenaline rush, take caution: the ropes to hold onto are cheap and worn, and there’s no-one stopping you from tempting your fate.  Taiq Sinkhole is 73 km East of Salalah. Coming from Salalah, a road branches off Route 49 soon after the town of Taqah. Tayq Sinkhole is sometimes referred to as Tayq Cave on road signs."
103,Dhow Factory of Sur,"Sur, Oman",Where artisans use centuries-old techniques to build traditional Arabian ships.,https://www.atlasobscura.com/places/dhow-factory-of-sur,"The city of Sur on the Gulf of Oman is one of the most historic boat-building centers in Arabia. And today, artisans still hand-craft dhows of all sizes at the factory in Sur, using centuries-old techniques. By the sixth century, the city of Sur had become an important center for trade with East Africa. Later, its reach expanded all across the Arabian Sea. Boats, naturally, were a vital part of life in Sur, and a thriving ship-building industry developed in the port city. Sur became famous as a center for the construction of dhows, the generic name given to a range of traditional Arabian sailing vessels, typically fitted with one or two masts and lateen rigging. Once built, these wooden ships would sail all across the region, to the Persian Gulf, the Arabian Sea, the coast of East Africa and across to India and China, trading precious stones, pepper, sandalwood, camphor, cloves, cinnamon, ambergris, ivory, and more. They were also used to carry slaves. Sur’s role at the center of these trade routes faded over the years, especially after the construction of the Suez Canal. The number of dhows built also decreased considerably, but the ship-building tradition remains intact at its dhow factory. The factory produces only two or three large dhows at any given time. They are made from Burma teak and ghaff, a local desert tree, and are built to order. And while modern methods are now used in the construction process, many traditional techniques still remain. It’s not unusual to see a builder using a bow drill instead of an electric drill, and workers moving planks by rolling them over logs. Blueprints and schematics are also rare, if used at all, as all the knowledge for building these vessels is contained within the heads of the local shipbuilders. Today, most of the ships are destined for the tourism industry rather than a life along the trade routes, and some are commissioned by notable individuals. King Abdullah of Jordan  had his dhow made here, along with other sheikhs and sultans. Tim Severin, the British explorer and historian, also came to the dhow factory prior to his epic “Sindbad Voyage.” The factory built his ship, the Sohar, an 87-foot replica of a ninth-century, lateen-rigged, cotton-sailed Arab dhow, which he then sailed from Sur to India and on to China. As for the legendary Sinbad the Sailor himself, some scholars have argued that he came from Oman, others from Baghdad and elsewhere, if he ever even existed at all. But if he did come from Oman, then there’s a good chance he sailed a dhow from Sur during his adventurous seven voyages.  The dhow factory of Sur is located just south of the western end of the Khor Al Batah suspension bridge. The factory isn’t large, so you can see everything in less than an hour, unless you want to sit around and soak up the atmosphere for longer. Don’t miss the beautiful scale models that the artisans also make and put on display in the factory shop. For more about the history of dhow construction, head to the nearby Al Qanjah Boat Yard, where you’ll find the Sur Maritime Museum."
104,Rock Garden Duqm,"Duqm, Oman",A section of the desert with an array of unusual sandstone and limestone formations.,https://www.atlasobscura.com/places/rock-garden,"Whichever way you approach this place, you’re likely to have traveled through hundreds of kilometers of rocky desert.  It is, therefore, somewhat surprising to find 3 square km of desert fenced off and signposted “Rock Garden.”  If you leave behind any preconceived ideas of what a garden may look like, and focus instead on the rock part of the name, you’ll be better prepared for the site. At first sight, there is little (if any) difference between the fenced off and the surrounding area.  Yet, once you start wandering around, you’ll find a curious array of sandstone and limestone formations. Water, wind and millions of years combined managed to create this bizarre landscape. Almost perfectly spherical stones sit next to rocks resembling animals, thrones, human body parts, and whatever else your imagination can conjure up. Some large rocks stand balanced on smaller ones, while others sit at improbable angles. It may not be the most jaw-dropping site you’ll ever see, but it does provide the chance to marvel at the beauty of rocks.  There is something hypnotic about contemplating the way time has made some rocks smooth, and others jagged, some flaky and others scaly, and so on. If you take time to notice these little variations, the Rock Garden has a striking variety of rock surfaces, shapes, and colors.  There is no office or information on site.  There are plans to develop this site to attract tourism, but at the time of writing, you’re more likely to come across lizards, geckos, and skinks than tourists.  Some visitors have reported coming across packs of aggressive stray dogs.  Should this be the case, it is possible to drive through the garden along easily recognizable tracks."
105,Film City,"Film City, Qatar","A creepy, deserted mock Arabian village can be found in the middle of the Qatari desert.",https://www.atlasobscura.com/places/film-city,"If you drive out from Doha for several hours into the Qatari desert, jump off the road and start bumping through rocks and ruts, you’ll pass a very interesting and lonely looking camel corral. Eventually the sand dunes will give way to sand cliffs, and on the horizon will start to rise a truly bizarre sight. This is “Film City,” a palm tree-laden, beige artificial village built for a film or television series. It’s a contemporary replica of a picturesque ancient Bedouin-style village, completely deserted, with the creepiness factor turned all the way up. The abandoned set sits in the middle of the secluded desert peninsula of Zekreet. There are almost no people or cars around, and no signs to give any clues as to why the ghost town is there. Film City’s original purpose, and subsequent desertion, remain something of a mystery. It’s believed that it was built either for a Hollywood or Qatari TV series, or perhaps a promotional film for the 2022 World Cup in Qatar. Visitors may freely walk through the empty main square, climb the turrets, and really sink into the surreal atmosphere of this abandoned movie set in the desert.  Get on Dukhan highway taking D-Ring Road to Shamal and then after traveling 90 kms or 55 miles, turn right once you see the Zekreet sign OR you could take someone with you who knows where it is. I also recommend using a LandCruiser or Jeep to get to Film City. A small car won't make it!"
106,Al Wukair Scrapyard,Qatar,"Some 20,000 dust-covered unwanted vehicles languish in the desert.",https://www.atlasobscura.com/places/al-wukair-scrapyard,"As the crow flies, the scrapyard in Al Wukair is only 12 miles from the center of Doha, but it could hardly be more different. Leaving behind the dazzling city skyline and heading in southwest, you encounter the kind of desert that is more akin to “Mad Max” than romantic rolling dunes. This is not to say the place is devoid of charm, but this is a different kind of charm. At any given time, the gigantic scrapyard accommodates around 20,000 vehicles, including cars, jeeps, trucks, buses, excavators, loaders, bulldozers, cement mixers, cranes, and other construction equipment. There are also motorbikes, dune buggies, water scooters, boats, and nearly every means of transportation that you can think of. These vehicles can be relatively new, old, vintage, or ancient. They can be pristine, dented, neglected, partly wrecked, completely wrecked, or burnt beyond recognition. Walking through the endless rows of dust-covered vehicles is an eerie experience that evokes post-apocalyptic imageries. There is a sense of beauty in the fact that each vehicle was once valued and perhaps even treasured, and now it is quite literally collecting dust, awaiting to be transformed and reborn as something other than itself. You cannot help but pause and admire. On average, a vehicle stays in the scrapyard for four months, during which attempts are made to contact the registered owner. If no one reclaims the vehicle, it is usually demolished and compacted, ready to be recycled and reused—usually for construction purposes. Vintage vehicles do not usually undergo this process, but are kept in a separate section of the yard, and once a year an auction is held to sell them off to the highest bidders. The scrapyard is a perfectly legal enterprise run under the surveillance of the state police. Visits are not encouraged, but they are not actively discouraged either (as yet). At the entrance, there are several bungalow-like offices. Even if the guards are not present, it is implicitly required that visitors report themselves to the authorities upon entering. An authorized escort accompanies visitors to the scrapyard. It should be understood that this is not a guide in the common sense of the term. His or her presence is to ensure the safety of the visitors, and perhaps, that nothing gets stolen. It may not seem the most direct route, but the easiest way to reach the scrapyard is actually by heading west along Salwa Road, and then heading south following the signs for Mesaieed. Along the way, there is an exit for Al Wukair, which leads directly to the scrapyard. This route is longer than driving through Al Wukair (village), but it bypasses all the traffic and the countless speed bumps."
