index,attraction,location,blurb,url,description
27,Saint Audoen's Gate,"Dublin, Ireland",The enchanting archway is the only surviving portal into Dublin's lost medieval wall.,https://www.atlasobscura.com/places/st-audoens-gate,"A great stone wall once hugged the edges of medieval Dublin, enveloping the city’s residents within its embrace. Tall and formidable, access to the city was only granted through the handful of arched gates that peppered the barrier. The wall and its gates were built in 1240 by Norman settlers. For centuries, the fortifications defended Dublin against invading clans and foreign people. In addition to being portals into the city, the gateways also served as tollbooths. As the years wore on, Dublin’s need to maintain its stoic perimeter decreased. Abandoned bits and pieces crumbled. Entire sections fell into disrepair. Eventually, parts of the wall were torn down and lost to time. Only one of the city’s historic gates exists to this day. Tucked behind a side of a church within a small stretch of surviving wall, Saint Audoen’s Gate (also sometimes called Saint Audoen’s Arch) leads to a narrow alleyway. It was restored in 1976, and today visitors can exit the historic center of the city through the gate and follow the winding medieval pathway to High Street and Cornmarket, where they can discover other extant portions of the lost city wall. Under renovation. You can peek through the plywood fence and see the gate"
28,Kingship and Sacrifice,"Dublin, Ireland",This permanent collection of preserved bodies taken from Irish bogs is one of the leading authorities on such morbid mummies.,https://www.atlasobscura.com/places/kingship-and-sacrifice,"Located within the National Museum of Ireland, the permanent exhibition known as Kingship and Sacrifice is a grim collection of withered human sacrifices who were preserved by the natural peat in which they were buried, including the Cashel Man, the oldest bog body ever found that still had flesh on its bones. Starting in 2003, a research project known as the Bog Bodies Research Project was started at the museum, which brought a number of local corpses to the center that had been preserved for thousands of years. Ritual human sacrifice in ancient Ireland was not an uncommon practice, but the disposal of the victims often led to the remarkable preservation of their remains thanks to the unique earthen properties of peat. The bodies, despite being thousands of years old, still have blackened flesh clinging to their bones. The identity of the sacrificial victims remains unknown, but various hypotheses exist, including that they were deposed kings or shamans, simple commoners offered to appease the gods and guarantee harvests, and even “outsiders” such as adulterers and thieves who had broken taboos. In addition to the remarkable bodies dredged up from the muck, regalia and jewelry were found near the bodies, indicating the possibly exalted positions the sacrifices likely held, hence the name of the exhibition. Mummified bog bodies can be found all across the globe, but the blacked bodices on display are some of the only ones that are on actual public display.  It's inside the National Museum of Ireland on Kildare Street, next to the National Library of Ireland. It's 550 meters from the Trinity College entrance and 200 meters northward from the St Stephen's Green. Free entrance."
29,The Hungry Tree,"Dublin, Ireland",An 80-year-old plane tree is devouring an iron bench at Ireland's oldest law school.,https://www.atlasobscura.com/places/the-hungry-tree-dublin-ireland,"Most trees feast upon a steady diet of carbon dioxide, water, and sunshine, which they absorb through their roots and leaves. Some, though, like to absorb other things as well. The Hungry Tree in Dublin is an 80-year-old London Plane tree that’s currently in the process of devouring a cast iron bench. As the years have passed, the tree has grown, causing it to swallow the parts of the structure that stands in its way. Its gnarled bark now spills over the back of the bench, making it appear as though the seat is being sucked into the tree’s trunk. It isn’t the first tree to eat something that stood in its way. Other trees around the world have acted similarly when faced with an obstacle that intrudes upon their growth. Still that hasn’t stopped the Hungry Tree from being listed by the Tree Council of Ireland as one of Ireland’s Heritage Trees. The arboreal bench-eater is located within the grounds of The Honorable Society of King’s Inns, Ireland’s oldest school of law, established in 1541 during the reign of King Henry VIII. The grounds are open and accessible to the public and lead on to Henrietta Street, which along with King’s Inns itself has been used as a location for many films and TV dramas. Quickest access to The Hungry Tree is from the Constitution Hill entrance to King's Inns."
30,Drombeg Stone Circle,"Rosscarbery, Ireland",One of the most popular megalithic sites in Ireland stands as a humbler version of Stonehenge.,https://www.atlasobscura.com/places/drombeg-stone-circle-2,"It sometimes seems as though every stray rock in the Irish countryside has some archeological significance, but formations such as the popular Drombeg Stone Circle show that the people of megalithic Ireland were building elaborate stoneworks. Also known as the “Druid’s Altar,” the circle is a megalithic formation that once consisted of 17 stones (only 13 remain) out in the countryside of Cork County, Ireland. Radiocarbon dating of human remains found at the site during a 1957 excavation suggests that the area was built and actively used between 1100-800 BC. Now the site is secluded, tucked away between verdant farmland and network of country roads. Approaching the stone circle requires walking a short way along a gravel path among high bushes that seem to hide the circle. But then the flat expanse of land opens and the stones rise from the landscape. Visitors expecting Stonehenge should think again. The Drombeg stones are mostly less than two meters high, and the stone circle is oriented along the southwest axis to line up with the midwinter solstice. Scattered across the nearby plain are several other relics including dwelling remains and the site of a primitive kitchen.  There are also the remains of a sacred well by the pathway. Given that this is one of the most visited sites of its kind in Ireland, parts of the land have been covered by gravel to preserve the area, but those interested can walk among the rocks and even touch the sacred stones that humans have revered for thousands of years.  The Drombeg Stone Circle is a little over an hour from Cork, Ireland by car. No public transit access exists. Leaving Cork, take N71 southwest through Bandon and Clonakilty (approximately 55km). Turn left onto R597, and follow for 4.2km. Turn left at the sign for Drombeg Stone Circle, and follow the road approximately 1km. Turn right into the parking lot."
31,The Lost Town of Newtown Jerpoint (Jerpoint Park),Ireland,Local legend says the remains of Father Christmas lie within the medieval grounds.,https://www.atlasobscura.com/places/the-lost-town-of-newtown-jerpoint-kilkenny-ireland,"What’s left of the abandoned medieval village of Newtown Jerpoint lies just outside the Irish town of Thomastown, in Kilkenny. The ruins of Saint Nicholas’ Church, which dates to sometime between the 12th and 13th centuries, still stand. Local legend has it that Saint Nicholas—a.k.a Father Christmas, the inspiration behind Santa Claus—is buried within a cracked, carved tomb in its grounds. According to local tradition, two Norman crusaders nabbed the saint’s remains while heading home to Kilkenny from the Holy Land over 800 years ago. Saint Nicholas’ supposed tombstone depicts a cleric with the heads of two knights peering over his shoulder, which represent the knights who carried the bones. Though it’s true that Norman knights from the area were part of the crusades, the theory that they stole and relocated Father Christmas isn’t widely accepted by non-locals. Newtown Jerpoint existed until sometime in the 17th century. Though it was once a bustling village with over a dozen taverns, the loss of its toll bridge and the re-routing of the local road eventually caused its residents to abandon it. Now, the ruined church and tomb exist within the privately owned Jerpoint Park, a working farm that offers tours, fishing, and sheep dog demonstrations.  Jerpoint is just 2.0 miles (3.2 km) southwest of Thomastown, and 15–20 minutes from the city center of Kilkenny."
32,Santa Maria della Concezione Crypts,"Rome, Italy","The crypts of Capuchin friars decorated with the bones of over 4,000 friars, including an entire ""crypt of pelvises.""",https://www.atlasobscura.com/places/santa-maria-della-concezione,"In 1775, the Marquis de Sade wrote of it, “I have never seen anything more striking.” Granted, the crypt was to his tastes. Mark Twain wrote about it in his 1869 book Innocents Abroad. When Twain asked one of the monks what would happen when he died, the monk responded, “We must all lie here at last.” And lie there they do. Some 4,000 Capuchin friars who died between 1528 and 1870 are still lying, hanging, and generally adorning the Santa Maria della Concezione crypt in Rome. In 1631, the Capuchin friars, so-called because of the “capuche” or hood attached to their religious habit, left the friary of St. Bonaventure near the Trevi Fountain and came to live at Santa Maria della Concezione, of which only the church and crypt remain. They were ordered by Cardinal Antonio Barberini (the Pope’s brother and a member of the Capuchin order) to bring the remains of the deceased friars along with them to their new home so that all the Capuchin friars might be in one place. Rather than simply burying the remains of their dead brethren, the monks decorated the walls of the crypts with their bones as a way of reminding themselves that death could come at any time. A plaque in the crypt reads, “What you are now, we once were; what we are now, you shall be.” The ossuary contains a crypt of skulls, a crypt of leg bones, and perhaps the oddest—a “crypt of pelvises.” Mummified monks were dressed in friar’s clothes and hung from the walls and ceiling. With the addition of electricity, light fixtures were incorporated into some of the hanging monks, bringing a new meaning to the phrase “the eternal light.” A particular highlight of the crypt is the skeleton enclosed in an oval of bones holding a scythe and scales—tools made entirely out of, yes, bones. The crypt is said to have been the inspiration for Sedlec Ossuary in the Czech Republic.  All photography is prohibited."
33,Valle dei Mulini (Valley of the Mills),"Sorrento, Italy",An Italian crevasse filled with abandoned buildings gives visitors a look at the world without humans.,https://www.atlasobscura.com/places/valle-dei-mulini-valley-of-the-mills,"The “Valle dei Mulini,” or “Valley of Mills,” is a verdant grouping of modern ruins nestled at the bottom of a deep Italian crevasse. The deep crack in the rock which houses the crumbling buildings originated during a huge eruption which devastated the Mediterranean area 35.000 years ago. The flour mills, built from stone as far back as the 13th century,  took advantage of the constant stream at the bottom of the valley. They ground all the types of wheat needed by the Sorrentine people in the surrounding area. After the flour mills were successfully established, other early industrial outfits began springing up to take advantage of the waters at the bottom: a sawmill was built which furnished the chaff used by local cabinet-masters and there was a wash-house used by women for personal hygiene and laundering clothes. After the milling of flour was largely shifted to nearby pasta mills, the sunken area of industry became largely obsolete and the buildings were closed and abandoned in the 1940’s. Since their closing, the brick buildings have been slowly taken over by the aggressive greenery that thrives in the humid crevasse. The gorgeous buildings hidden in the Valley of the Mills look like nothing more than a slice of what the world will look like when humans are gone. Update: As of November 2019, the city has voted to restore the Mills, which is currently in progress.  The mills can be seen from Viale Enrico Caruso, which is suspended over the canyon and the intersection with Via Fuorimura."
34,Torre Argentina (Roman Cat Sanctuary),"Rome, Italy",Hundreds of lucky felines haunt the ruins where Caesar was murdered.,https://www.atlasobscura.com/places/torre-argentina-roman-cat-sanctuary,"In Rome the cats have an ancient temple-complex all to themselves. Known as Largo di Torre Argentina, this archaeological wonder was excavated as part of Mussolini’s rebuilding efforts in 1929, revealing four Republican victory-temples that lie sunken 20 feet below modern street level.  In addition to the remains of four different temples, Torre Argentina also contains part of the famous portico of Pompey. Today, volunteers at Torre Argentina care for approximately 130 cats, many of which are disabled or suffer from illness. After the site was excavated, Rome’s feral cats moved in immediately, as they do all over the city, and the gattare, or cat ladies, began feeding and caring for them. Since the mid-1990s, the population has grown from about 90 to a peak of 250, and the organization has ramped up with care for sick or wounded cats, as well as an extensive spay and neuter program to keep the feral population in check. Most of the permanent residents have special needs—they are blind or missing legs or came from abusive homes. On any given afternoon a small crowd gathers here to watch the cats sunbathe on ancient pillars and steps. At first it may be hard to spot the cats, but once you start to see them, they are everywhere. Visitors can admire the cats and their ruins from street level, or head down the steps to the underground office to volunteer, peruse the gift shop, donate, and even adopt cats. There is another Roman cat sanctuary located at the Protestant Cemetery, near the Pyramid of Cestius.  Entrance at Largo di Torre Argentina, corner of Via Florida & Via di Torre Argentina. The ladies who work here are very friendly to everyone. If you do spend any time within the closed off area where the wounded and aged cats stay (who are also very friendly to all), please consider a donation to the Sanctuary."
35,The Monsters of Bomarzo,"Bomarzo, Italy",A 16th-century horror show built in a lovely Italian garden.,https://www.atlasobscura.com/places/the-monsters-of-bomarzo-bomarzo-italy,"The Park of the Monsters, or “Parco dei Mostri,” in the Garden of Bomarzo was not meant to be pretty. Commissioned in 1552 by Prince Pier Francesco Orsini, it was an expression of grief designed to shock. The Prince, also known as Vicino, had just been through a brutal war, had his friend killed, been held for ransom for years, and come home only to have his beloved wife die. Racked with grief, the Prince wanted to create a shocking “Villa of Wonders” and hired architect Pirro Ligorio to help him do so. Ligorio was a widely respected architect and artist and had previously completed the Cathedral of Saint Peter in Rome after the death of Michelangelo, as well as the Villa d’Este in Tivoli. This was to be an unusual, but interesting job for him. The park is filed with bizarre and fascinating sculptures for which only the accompanying inscriptions provide any explanation. Among the pieces are a war elephant, a monstrous fish-head, a giant tearing another giant in half, and a house built on a tilt to disorient the viewer. Perhaps the most frightening piece in the garden is an enormous head, mouth opened wide in a scream. The accompanying inscription reads “all reason departs.” Built during the Italian Renaissance, the garden layout bore little resemblance to the symmetry of other Renaissance gardens, and the art was made in a rough “Mannerist” style, a sort of 16th-century version of Surrealism. It makes sense, then, that the Surrealists loved it. Salvador Dalí visited the park and loved it. He was so inspired, he shot a short film there, and the sculptures inspired his 1946 painting The Temptation of Saint Anthony. Jean Cocteau was also a fan of the park. Other artists followed, and a novel, libretto, and opera have all been based on the park. While there is no way of truly knowing how the Prince felt about the park, the final addition indicates that perhaps he was getting over his melancholy. Built 20 years after the park was begun, it is not a monster but a temple, built to honor his second wife. When you visit the park, be sure to enter the giant screaming mouth (known as “the mouth of hell”), inside which, on the tongue, stands a picnic table and enough seating for a small group to have lunch."
36,Libreria Acqua Alta,"Venice, Italy",This Venice bookstore has resigned itself to constant flooding by keeping its books in bathtubs and boats.,https://www.atlasobscura.com/places/libreria-acqua-alta,"Keeping a collection of books in a city where the roads are made of water is a dangerous idea to begin with, but Venice’s Libreria Acqua Alta has nothing to fear since they just keep all their titles in waterproof basins. The self-proclaimed “most beautiful bookstore in the world” is composed of a number of over-stuffed rooms stacked wall-to-wall with books, magazines, maps, and other ephemera. Due to Venice’s constant flooding, however, these picturesque piles are all placed inside bathtubs, waterproof bins, and in one room a full-size gondola. The name itself even means “Book Store of High Water.” When the local waterways rise to fill the store, the water can rise inches off the floor, which would destroy any other collection. The store’s whimsically cramped atmosphere is even reflected in their “fire escape,” which is simply a door leading directly out into a canal. To really complete the look, the store has become home to more than one stray cat, who are also able to escape the rising tides by hanging out atop the stacks."
37,Quartiere Coppedè,"Rome, Italy",Architectureal fantasy quarter of Rome.,https://www.atlasobscura.com/places/quartiere-copped,"Quartiere Coppedè is an unexpected and bizarre area in Rome, nestled within the Trieste district in the northern part of the city. The fantastical mix of Ancient Greek, Roman Baroque, Mannerist, Medieval, and, overall, Art Nouveau mishmash was brought to life by Florentine architect Gino Coppedè (from whom the quarter itself takes its current name) in 1919. Coppedè worked on the quarter until his death in 1927. Though the Art Nouveau palaces of Quartiere Coppedè, featuring floral, mythological and medieval details, are abundant, there is plenty of space for the fantasies of Coppedè in this vast area. “The 31,000 square meters of the quarter (with some 40 structures) are alive with Florentine towers and Venetian palazzi decorated with external mosaics and frescoes, Baroque Roman palazzi with real and imitation papal stemmata, a sundial, and even a building devoted to a musical decorative scheme whose exterior ironwork and carvings imitate musical notation” (Source). Thanks to its strange beauty, the Quartiere Coppedè has been used as the setting for a number of films, and is a fun way to leave the beaten path of Rome. You can reach Quartiere Coppedè by taking Tram 3 or 19 to Piazza Buenos Aires, which is a short walk to Piazza Mincio. While you're there, be sure to stop by Piazzo Mincio and check out the whimsical Fontana delle Rane (Fountain of Frogs), in which the Beatles famously dunked themselves after a concert in Rome. Also check out the archway over Via Tagliamento, which marks the entrance to the quarter and is where you'll find Quartiere Coppedè's whimsical outdoor chandelier, positioned over the road."
38,Galleria Sciarra,"Rome, Italy",This hidden Art Nouveau courtyard is an opulent feast for the eyes.,https://www.atlasobscura.com/places/galleria-sciarra,"Located just a few steps away from the iconic Trevi Fountain and the fashionable Via del Corso is a largely unknown courtyard that transports visitors back to the height of the Art Nouveau movement. Its gorgeous frescoes and brilliant colors are a feast for the eyes and a welcome change from the pale, faded ancient Roman ruins scattered throughout the city. The opulent courtyard was built in the late 19th century for the wealthy, influential Sciarra family. It was meant to be a shopping mall, which, had the mall come to fruition, would perhaps be one of the most beautiful shopping centers in Rome. Every inch of the four-story walls enclosing the space is covered by colorful frescoes of women and men surrounded by elegant, curling floral designs. The women are the main focus, as the gorgeous artwork, which was painted by Giuseppe Cellini, is intended to celebrate women in the various phases of life. The glass and iron ceiling lets sunlight spill into the courtyard, illuminating the details in the frescoes. When the sun goes down, lights turn on to bathe the courtyard in a warm yellow glow."
39,The Sunken City of Baia,"Baia, Italy",A submerged archeological park still holds the wonders of a Roman Sodom.,https://www.atlasobscura.com/places/the-sunken-city-of-baia-baia-italy,"In its heyday, the Classical Roman city of Baia was the hedonist Las Vegas of the time, but now its remains are partying beneath the waves. A prominent resort city for centuries, Baia catered to the recreational whims of the rich and powerful among the Roman elite. The city, which was located over natural volcanic vents, was famous for its healing medicinal hot springs which occurred all around the city and were quite easy to build spas over. Some of antiquity’s most powerful figures such as Nero, Cicero, and Caesar were known to have visited the city and a number of them actually built permanent vacation villas there. Unfortunately, the good times were not to last and the city was sacked by a Muslim army in the 8th century. By 1500, the remains of the formerly luxurious town were abandoned. After the city remains were emptied, the water level slowly rose due to the same volcanic vents that were once a draw to the area, and most of the ancient ruins were drowned under the shallow waters of the bay. Today the ancient remains of Baia can be visited in one of the world’s few underwater archeological parks. Visitors can view the crumbled structures and amazingly preserved statuary of the city through glass-bottomed boats, snorkeling, or even scuba dives which allow people to actually swim amongst the copious ruins. While the city is no longer a resort, its waters still hold wonders."
40,The Dome Illusion,"Rome, Italy","A master of trompe-l'oeil creates a stunning, tourist-fooling dome out of a flat ceiling.",https://www.atlasobscura.com/places/dome-illusion,"The Jesuit church of Saint Ignazio was supposed to have a glorious dome, but when the money ran out in 1642, the plans were scrapped. Instead of forgoing the dome entirely, painter and Jesuit brother Andrea Pozzo proposed that he paint a life-sized illusion of a dome that would fool the eyes of visitors (as long as they looked up from the proper angle). His masterpiece, painted between 1685 and 1694, still deceives the eye today. Pozzo painted another illusion for the barrel-vaunted ceiling of Saint Ignazio. The huge painting depicting the life and works of Saint Ignatius lifts and expands the simple building skyward, using forced perspective to move the figures up into the heights. The technique is known as quadratura, a mixture of geometrically accurate architecture in forced perspective and elements of fantasy, like cherubs and floating saints. Pozzo wrote a book on the subject, Perspectiva Pictorum et Architectorum, which was very influential with other Baroque painters. Both the dome and the central illustration are painted on a single 17 meter canvas. His work on the illusions was so well received that he was granted the commission for the rest of the artwork in the church. In April of 1891 an enormous powder magazine explosion just outside the city rocked Rome and damaged the ceiling artwork. (It also collapsed part of the roof of the Parliament building and sent the city into a general panic.) A restoration in 1961 repaired the painted ceiling. In 1703, Pozzo repeated his dome illusion in Vienna, in a Jesuit church now called the University Church, and at the Church of the Gesù in Frascati, Italy.  The entrance to the church faces Piazza S. Ignazio. The best way to view the illusion is to enter the church keeping your eyes low until you reach the circular marble marker that indicates the ideal vantage point for taking in the “dome.” A second marker on the floor indicates the ideal viewing spot for the rest of the ceiling."
