index,attraction,location,blurb,url,description
28,Bomi Blue Lake,"Tubmanburg, Liberia","An abandoned mine pit is now a beautiful, colorful attraction.",https://www.atlasobscura.com/places/bomi-blue-lake,"When the Liberia Mining Company began to abandon its operations in Bomi County in northwestern Liberia, it left behind a series of pit mines. But as nature began to reclaim these scars in the Bomi Hills, one of the pits filled with water, creating a beautiful blue lake. Back in the 1960s and ‘70s, the LMC began operations in the Bomi Hills near the town of Tubmanburg. The company dug a series of huge pits to extract iron ore from the hills, but by the late 1970s, the ore reserves were deemed depleted and the company closed its operations. The LMC left a landscape pockmarked by pits, so much so that locals began to wryly refer to the Bomi Hills as the Bomi Holes. And the mining company had left so quickly that they even abandoned some of their equipment at the bottom of the craters. It was a mess, but one that nature slowly began to reclaim. And as it did so, one of the largest pits took on a whole new life of its own. Despite being stuck up in the hills and isolated from any obvious sources of water, the 300-foot-deep pit began to fill with water, likely fed by a spring somewhere down below. By the end of the 1990s, the lake looked like a totally natural formation. And in 2007, Senator Richard Devine, in whose constituency the lake was situated, began to promote the wonders of what he billed as “a natural phenomenon and …. a wonderful sight to behold.” “One thing is certain about this lake,” continued the Senator, “Whether rain or shine, it never rises above its banks, nor does it dry. The water level is absolutely stable. It’s a wonderful sight, a haven for hotel and casino development, and of course water sports.” Senator Devine’s enthusiasm certainly helped draw attention to the Blue Lake, named for its clear blue waters. But so far, hotels and casinos have yet to set up around the lake. There are a few weathered wooden pavilions, but little else. Still, it’s certainly a pretty spot for a picnic. Despite the lake’s mining history— and the possible presence of mining equipment at its bottom—it was, for a while, the source of bottled Blue Lake mineral water. And it seems that the waters are clean and free from pollution. But before you go for a swim, as many do, you might want to know about certain sightings by  United Nations Mission in Liberia (UNMIL) soldiers stationed in the area. These soldiers have apparently spotted some big snakes in the lake, and locals sometimes speak of a particularly large boa living near the waters of the Blue Lake.  Blue Lake, also known as Bomi Lake, is located in the Bomi Hills, about three miles north of the town of Tubmanburg. If you’re feeling fit you could hike up to the lake from Tubmanburg. Otherwise, find someone in town to take you up there in a 4x4 vehicle."
29,Monkey Island,"Marshall, Liberia","After surviving decades of medical testing and civil wars, these chimpanzees were abandoned on their own islands.",https://www.atlasobscura.com/places/monkey-island-liberia,"The year was 1974 and the original Planet of the Apes movie starring Charlton Heston had just been adapted into a small screen series. Little did anyone know, though, that out in the remote jungles of Liberia, a New York non-profit and idealistic young scientist were setting in motion what 30 years later would become what many now call the “real-life planet of the apes.” That non-profit was the New York Blood Center, one of the largest blood banks in the United States. In search of a vaccine for a spate of blood-related diseases, NYBC bankrolled Vilab II, a controversial laboratory led by Betsy Brotman that would go on to conduct medical tests on over 100 chimpanzees. The chimps were injected with various forms of Hepatitis, onchocerciasis (commonly referred to as river blindness), and a host of other maladies. Once they tested positive for one of the diseases, the animals would be transferred to one of six different islands—that, thanks to chimpanzees’ innate physiological inability to swim—were perfect for keeping the infected subjects away from the regular population. Vilab continued its work as Liberia crumbled into civil war, first in 1989 and again in 1999. Eventually, though, the lab encountered a conflict that it could not overcome: growing resistance to animal testing back in the U.S. Eventually, the anti-testing outcry reached the highest levels of the U.S. federal government and the National Institute of Health instituted a moratorium on breeding research chimps and declared that most chimp testing did more harm than good. In 2005, Vilab was shut down for good and all the chimps, approximately 60 or so, were transferred to a series of nearby uninhabited mangrove islands, where they now permanently live. For the next 10 years, NYBC continued to care for the chimps, hiring many of the original lab staff to take food and water to the islands every other day. Then, in March 2015, NYBC suddenly withdrew its financial support, stating they could no longer provide for their former subjects’ well-being. Thankfully, the Humane Society stepped up and decided to assume the responsibility of providing long-term care for the chimps, which costs upwards of $30,000 a month. While her methods eventually fell out of favor, Betsy Brotman and her team’s research did successfully lead to a vaccine for Hepatitis B and a screening method for Hepatitis C. In a 2014 interview, however, Betsy publicly sided with the animal rights activists that eventually caused her lab to close, stating that she no longer believed chimpanzees should be used in experiments.  Do not attempt to visit Monkey Island on your own. The chimps are extremely territorial and are not afraid of making their presence known. If you're intent on visiting, local fishermen can be hired to arrange a boat ride to the island for a negotiated fee."
30,Libassa Ecolodge,"Marshall, Liberia","This Liberian resort offers comfort, ecofriendly hospitality, and a mission of sustainability.",https://www.atlasobscura.com/places/libassa-ecolodge,"No palm trees were harmed in the making of Libassa Ecolodge, a sustainable resort nestled amid a palm-forested lagoon in Liberia. Built on a foundation of conservationist principles, Libassa Ecolodge endeavors to strike a chord of harmony between visitors and the environment through sustainable practices, education, and mindfulness. A fleet of solar-powered huts comprise the on-site accommodations, which range from the most basic Palaver Hut, a traditional Liberian abode housing a double bed and balcony and constructed with local materials, to the Mangrove Lodge, which hovers over the lagoon with a queen-sized bed, a private pool, and balcony. Regardless of how luxurious your lodgings are, each hut is limited to 200 watts of electricity per room, used only in limited amounts via certified low-energy bulbs and appliances. Water use in each hut is restricted, food is composted, and all paper and plastic products must be recycled. For every tree used to build the huts, at least one new seedling was planted in its stead; and none of the surrounding palm trees were cut down to make way for the resort. On-site recreational activities are equally low-impact and include a small mini golf course, badminton and beach volleyball courts, a ping pong table, diving, snorkeling, bodyboarding, canoeing, horseback riding, and archery. To cultivate awareness of local cultures and the ecosystem, Libassa Ecolodge also offers a restaurant that serves up West African cuisine, the opportunity to partake in African and Latin dance lessons, a tranquil wander through a manicured botanical garden, and an animal sanctuary. The lodge aims to become 100 percent renewable through solar and wind power.  Accommodations can be reserved on Libassa Ecolodge’s website. Visitors should be aware that the road past Kpan's Town near the resort is only drivable by all-terrain vehicle."
31,Liberian National Museum,"Monrovia, Liberia",A comprehensive museum dedicated to Africa's oldest modern republic.,https://www.atlasobscura.com/places/liberian-national-museum,"With two devastating civil wars casting a shadow over its modern image, it’s often forgotten that Liberia was the first African republic to proclaim its independence—a feat it accomplished back in 1847. Even more impressive is the fact that this tiny nation, founded by an upstart group that encouraged free African Americans to migrate to Africa, was able to maintain its sovereignty in the face of intense European colonization, which by the time it was over, left nearly 90 percent of the continent’s total landmass in the hands of foreign powers. These are points of pride for Liberians today—and they are on full display at the Liberian National Museum. The institution is housed in an old executive mansion in downtown Monrovia that was damaged and looted during both civil wars but has been subsequently upgraded and repaired with the assistance of UNESCO. While much of the museum’s collection was carried off by rebels and locals exploiting the chaos of the Second Liberian Civil War, several key artifacts remain, including a 250-year-old dining table that Queen Victoria gave to Joseph Jenkins Roberts, Liberia’s first president. Today, the museum’s ground floor has an impressive collection of musical instruments, masks, and other crafts that provide a strong introduction to the country’s indigenous tribes and traditions, while the second and third floors chronicle the country’s founding, challenges, and successes, including the recent Ebola epidemic.  The museum is open from 10:00 a.m. to 4:00 p.m. daily except for Sunday, when it is typically closed. Guided tours are available."
32,Robertsport Ghost Ship,"Robertsport, Liberia","After several weeks of radio silence, this abandoned oil tanker washed up on a remote beach in Liberia.",https://www.atlasobscura.com/places/robertsport-ghost-ship,"In 2016, this mysterious ship bearing the name Tamaya 1 washed up on the shores of Robertsport, Liberia. After the 60-meter-long ship washed ashore, it took government officials several days to realize what had happened, as the Liberian coast is largely unmonitored. Two days later, the government officials learned about the mystery ship on their shores, the Coast Guard boarded the vessel to investigate. The lifeboats were missing and there was no trace of the crew. The Ministry of National Defense put out a statement saying that the bridge was “gutted by fire” and all documents onboard the ship had been burned to a crisp. Theories began to circulate about the cause. The Tamaya was an oil tanker bound for Dakar, Senegal, that had last been seen some three weeks before it washed up on the Robertsport beach. Some suspected the crew and ship had been victims of piracy. That theory was dismissed, as the vessel’s last known position was outside of the waters where pirate groups typically operate. Several months after the incident, the alleged owner, Nigerian national Robert M. Saigba, came to Liberia to meet with government officials. Saigba claimed that the crew was forced to abandon ship to a fishing vessel, leaving behind the Tamaya and their lifeboat. The lifeboat was later found washed up in Edina, Liberia, about 125 miles away.  The ship is a short coastal hike south from Nana's Lodge. Following the coast will get you to the ship, but you will have to either walk across some slippery rocks on the coast or go around them through the forest. The hike is not too difficult but you should take care to wear proper shoes that have grip, not beach sandals."
33,Paynesville Omega Tower,"Paynesville, Liberia",The dead gigantic radio tower of Liberia.,https://www.atlasobscura.com/places/paynesville-omega-tower,"For the implementation of the VLF or Very Low Frequency-Navigation System “OMEGA” in 1976, the US Coast Guard erected a 417 meter tall radio tower, which is taller than any man-made object existing today in the European Union! Built near Paynesville in Liberia, it served together with seven other stations as part of a worldwide navigation system, and which could be used to communicate with submerged submarines. While VLF has a very low data transmission rate, one of the advantages of VLF is that, unlike higher frequencies, of say VHF or UHF, it can deeply penetrate seawater to reach submarines. (Frequencies such as VLF and ELF, extremely low frequency, have been cited as the casue behind disoriented and injured whales who communicate using the same wavelengths) However by the 1990s, the global satellite system and GPS made OMEGA obsolete and so OMEGA was shut-off on September 30th, 1997 and the station was given back to the government of Liberia. Unfortunately during this period the government of Liberia was involved in a bloody civil war and had no use for the transmitter and the huge mast, which though it survived the civil war until today, continues to go unused. As there is no access restriction to the mast, it is theoretically possible it could be used for skydiving, powerful transmission experiments and Tesla experiments. For those Tesla experiments however, one ought not forget, that Liberia is a country with a very unreliable electric power supply, so one should come with their own, very large, power generator. Update: The Paynesville tower was demolished in 2011."
34,Acacus Mountains,"Ghat, Libya",Landscape of bizarrely shaped desert mountains and innumerable rock carvings.,https://www.atlasobscura.com/places/acacus-mountains,"Golden sand dunes cover the ground and cling to the sides of the basaltic mountain range that rises abruptly out of the flat Sahara desert. Forces of nature have always shaped this place, clearly visible in the sand that piles in every rock niche and side canyon of the mountain range, and seemingly embrace the rocks of the terrain. A millennia of desert winds and flashfloods have carved the mountains into bizarre shapes, with innumerable natural arches spanning the foot of the mountains, the largest of which reaches an astonishing height of 150 meters. But it is not the mountains, nor the scenery for which this place is known. Visitors and scientists alike flock to one of Libya’s most remote corners for the numerous pictographs that are found all over the mountains. These images are found seemingly everywhere – at the base of the mountains, under overhanging rocks, in mountain caves, and in the many canyons of the Acacus Mountains. The pictographs depict animals, hunting scenes, and social gatherings. However, they are not merely prehistoric paintings. The date of their origin can roughly be put into four different time periods. The oldest images, from the so-called Wild Fauna Period (12,000 – 6000 BC), were created when the Sahara was covered in a plentiful savannah, with Elephants and Giraffes roaming the wide plains. During this period, carvings depicting those animals were scrawled across the desert cave walls. The Round Head Period (8000 – 6000 BC), named after the images of rather formless bodies in the depictions of humans, forms a transition period between the age of Hunter-Gatherers and the creation of permanent settlements. The Pastoral Period (5500 – 2000 BC) followed, during which the climate of the Sahara grew much more arid. Human figures dominating and taming the forces of nature were painted during this period, including depictions of domesticated cattle and social festivities. Horse and chariot depictions majorly date from the Horse Period (1000 BC – AD 1), during which means of transport made a leap forward, allowing the beginning of large Trans-Continental trade routes in Africa. The final period is called the Camel Period (200 BC – present), during which the Sahara finally became the arid desert that it is today. No single culture or civilization can claim responsibility for the rock art, rather it was most likely a continued tradition among the people of the region, which was set off by the mountains’ earliest inhabitants. The cultures that followed these first settlers, the Tuareg and the Garamantes people, adapted this tradition and created their own images. Over a timespan of 14 millennia, the climate of the region has dramatically changed. Each change, altered the landscape and forced its inhabitants to adapt. The natural forces that have shaped this place are visible in the mountains. The societal changes that followed are visible in the depictions of the rock carvings. Both nature and humans created an astonishing place, in which its history can be read like a book. Reached via 4WD from Ghat or al-Aweinat; Ghat District, Libya"
35,Ghadames,"Gadamis, Libya",A beautiful oasis town dating back to the Roman period still serves as reprieve from the brutal summer sun in Libya.,https://www.atlasobscura.com/places/ghadames-oasis,"A tad less than 300 miles away from Tripoli there exists an ancient getaway, an oasis made of mud, lime, and the trunks of palms. Covered alleyways and heat reflecting, creme-colored walls weave in and out of grottos and lead to the old town spring water pool. This pre-Saharan city is Ghadames, also known as the ‘pearl of the desert’. While none of the buildings from the protohistoric Berber period or the time of Roman domination still stand, the architectural style distinguishes Ghadames from the surrounding pre-Saharan cities. The houses cluster into a rough circle, the outer walls facing the edges of the city creating a fortified wall around the entire settlement. Inside the walls, the houses utilize different floors for different needs, one for storing goods, another for family living, and the covered alleyways for traveling around the city protected from the blistering desert sun, creating the feel of underground passageways. At the top, open-air terraces are reserved for the women only. Considered the old part of town, new housing has been built outside of the lime-washed walls, however many of the 10,000 residents of this historic oasis return when the heat becomes unbearable, as those walls still provide more relief from the relentless heat than anywhere else."
36,Qasr al-Haj,"Qasr al Hajj, Libya","Fortress-like granary, continually in use for more than nine centuries.",https://www.atlasobscura.com/places/qasr-al-haj,"Berber architecture is probably one of the most evocative architectural styles in the world. The simplicity of the structures merge with the harsh landscape of the Sahara desert to create a timeless beauty. Some Berber structures in neighbouring Tunisia became world-famous after George Lucas included them in his Star Wars movies. The Qasr al-Haj is arguably the most stunning piece of Berber architecture in Libya. Other than its name suggests (literally translated: Fortress of al-Haj), the structure is neither a fortress, nor a fortified village. The building is a storage facility, created to store the harvests of the semi-nomadic and partly settled people of the region. It is a circular building, featureless from the outside, with a main gate that leads to the large courtyard inside. Surrounding the courtyard are 114 cave-like storage rooms, arranged in several levels. The lowest level, which partially lies underground, is used to store olive oil, while the upper levels are mainly used for barley and wheat. At the side of the main gate, a staircase leads to the top, where a walk completes a full circle around the top of the structure. In a region of limited crops, granaries like this shelter the harvest from animals, thieves and weather extremes. The Qasr al-Haj was built in the 12th century by Sheikh Abu Jatla, who rented the storage rooms to several parties in exchange for a small amount of barley and wheat, which he then distributed among the poor. Since the building is still in use, visitors are encouraged not to enter the storage rooms without the guidance of the caretaker, or the permission from the owners. As of October 2011, it remains unclear, whether the 2011 Libyan Civil War damaged Qasr al-Haj.  Qasr al-Haj, near Zintan, Jebel al-Gharbi District, Libya"
37,Waw an Namus,Libya,"Surrounded by a smudge of dark earth, this isolated volcano sits in stark contrast to the surrounding Sahara.",https://www.atlasobscura.com/places/waw-an-namus,"“Seen from space, few other dormant volcanoes look as exotic and spectacular as Waw an Namus,” says NASA’s Earth Observatory. From high above, the volcano is clear to see in the Sahara. It’s surrounded by a smudge of dark basaltic ash and tephra, which extends between six and 12 miles around the central caldera in stark contrast to the surrounding desert. And inside the caldera lie three glinting lakes surrounded by flecks of green. Approaching by foot, visitors to this remote location first walk through the moonscape of the ash and tephra. At the heart of this peculiar landscape is the two-mile-wide, 330-feet-deep caldera, with a 460-feet-high post-caldera scoria cone near its center. Once at the caldera rim, a strange sight awaits: three lakes, and a few smaller bodies of water, lie on the floor of the caldera, surrounded by palms, reeds, and swamp vegetation. Much of the water within the caldera is warm and saline, but some bodies of freshwater do exist. Waw an Namus, therefore, has long been an important stop for caravans traveling across this otherwise parched and isolated part of the Sahara. But Waw an Namus isn’t the most inviting of campgrounds for one particular reason: mosquitoes, and lots of them. The name itself translates to “Crater of Mosquitos,” and visitors are well-advised to camp outside the caldera unless they are well prepared with mosquito nets and a serious supply of repellent. The mosquitoes of Waw an Namus don’t often have the chance to feed on fresh blood, so when they do, they don’t hold back. Questions remain regarding the formation of Waw an Namus. Volcanism in the Sahara isn’t fully understood and various theories exist to explain the presence of volcanoes like Waw an Namus. Its age, too, is open to debate. The central cone looks relatively young, suggesting it may have been formed as recently as a few thousand years ago. The arid climate of the region, however, may be masking the volcano’s true age.  Waw an Namus is located in the Sahara desert of south-central Libya, to the south of the Haruj volcanic field. It lies about 250 miles southeast of the oasis city of Sabha. Due to its remote location and the ongoing Libyan Civil War, few people actually visit Waw an Namus despite its reputation as one of the most beautiful and fascinating natural attractions in the country. Tours can be arranged in the larger cities, but it’s worth doing some thorough research before choosing a company."
38,Gaberoun Oasis,Libya,A deserted Bedouin village lines the shores of this stunning desert oasis.,https://www.atlasobscura.com/places/gaberoun-oasis,"This brilliant blue-green gem of a lake, surrounded by golden sand as far as the eye can see, looks like a small pocket of island paradise hidden among the dunes of the Sahara Desert. Palm trees fringe the water, and the ruins of an abandoned village dot one corner of the shore. A Bedouin tribe once lived along the Gaberoun Oasis (also spelled Gabroon, Gabraun, and Gabr Awhn). They fished for saltwater crustaceans, little worm-like creatures that live within the lake. But they couldn’t rely on the lake itself for drinking water, the most precious desert treasure. Instead, they had to dig beneath the sand around its perimeter to search for the same underground springs that feed the trees. The government relocated the entire tribe to a newly built village in the 1980s. The ruins of their old settlement remain, left to bake beneath the scorching sun. A ramshackle tourist camp, complete with a handful of sleeping huts and a small market, keeps a sporadic trickle of human life flowing into the otherwise abandoned oasis. Those who do visit like to swim in the lake; its salinity makes it a pleasant place to float, especially since the surface is strangely chilly. The water’s temperature gets hotter the deeper you dive."
