index,attraction,location,blurb,url,description
54,Church of the Holy Emperor Uroš and Madhe Mosque,"Ferizaj, Kosovo","Christianity and Islam have clashed, yet here a Serbian Orthodox church and a mosque stand together.",https://www.atlasobscura.com/places/church-holy-emperor-uros-madhe-mosque,"The Balkans have seen their share of conflict and turmoil. There, for centuries, Orthodox Christians have been at odds with Muslims, and these religious identities have turned into national identities, as Serbians are predominantly Christian while Albanians, which are the majority of Kosovars, are Muslim. Yet in the small southern Kosovo municipality of Ferizaj (Albanian) or Urosevac (Serbian), one plot of land holds temples to both religions. A mosque, known as Madhe Mosque, was originally built in the 1890s, during the time of the Ottoman Empire, though is was destroyed by German bombers during World War II.  The current mosque was completedin 1943 and upgrades, including the second minaret, were completed as recently as 2013. In the late 1920s, it was decided that a Serbian Orthodox church was to be built in the same courtyard as the mosque. Later named the Church of the Holy Emperor Uroš, dedicated to Serbian emperor Uroš V. Over the years, strife and conflict took their toll on the church, including looting and fires after the beginning of the Kosovo War in 1999. Graffiti is commonly found on its walls to this day. Generally, though, the courtyard holding two seemingly conflicting ideologies goes on in peace."
55,Gadime Cave,"Gadime e Poshtme, Kosovo",The ceiling of this cavern is dripping with multicolored marble stalactites.,https://www.atlasobscura.com/places/gadime-cave,"This cave was discovered by accident in 1966, when a farmer in the village of Gadime e Ulët was doing excavation while preparing to build a house. It was not until ten years later in 1976 that the remarkable limestone cavern was opened to visitors. The total length of all the known corridors and channels in Gadime Cave adds up to more than 4,000 feet, but the deeper part of the cave is still unexplored. It is estimated that it may extend for another 10,000 feet. Compared to cave systems like Mammoth Cave (the longest in the world, with more than 400 miles of tunnels) or Grotte di Frasassi (the longest in Europe, with more than 20 miles of tunnels), Gadime Cave is relatively small. But it is the longest cave system in Kosovo, and offers some extraordinary geological features. One remarkable feature of the cave is that most stalactites and stalagmites are made of marble, and they grow at an average of one millimeter every 30,000 years. Estimates place the formation of the cave in the tertiary geologic period (between 66 and 2.6 million years ago). Deep fissures in the rock can be seen in the ceiling and walls of the cave, and they are due to tectonic movements and erosion. Inside Gadime Cave you’ll find some large stalactites and stalagmites, but it is the smaller ones that form interesting, colorful patterns on the ceiling, floor, and walls of the cave. Some have been broken off, especially along the main corridors, but a large number are still intact, and they are cordoned off for protection. The main concrete corridors are quite handy considering that the cave is very wet, and the silt in the cave is both sticky and slippery. There are a few natural limestone basins where water collects, and an underground lake can be found inside the cave, but the corridors do not go that far. The temperature inside the cave is relatively stable all year round, wavering between 9.6 degrees Celsius and 16 degrees Celsius.  Gadima cave can be visited independently, or as part of a guided tour. There are currently two openings sufficiently large to be used as access points to the cave, but only one is used by visitors."
56,Newborn Monument,"Pristina, Kosovo",This massive monument was unveiled the day Kosovo declared independence from Serbia.,https://www.atlasobscura.com/places/newborn-monument,"On February 17, 2008, the government of the Republic of Kosovo declared independence from Serbia and unveiled this monument. The original monument was bright yellow with blue banners to represent the European Union colors. “Newborn”, a single English word in a country dominated by the Albanian language, represents the birth of a new country, its positive connotations, and the potential for a modern, democratic Kosovo. At its unveiling, it was announced that the letters would be repainted annually to celebrate another year of freedom. People worked nonstop for 10 days to complete the monument so it could be unveiled on the day Kosovo formally declared independence. The 10-foot-tall, 79-foot-long monument is hard to miss, and it gained international attention as soon as it debuted. The tradition to annually repaint the monument is still going strong today. One year, the monument was repainted to represent the flags of all the countries that recognized Kosovo’s independence.  You can walk by the monument at any time."
57,Goddess on the Throne,"Pristina, Kosovo","This stone figurine was made more than 6,000 years ago and depicts a female deity of the Neolithic Vinča culture.",https://www.atlasobscura.com/places/goddess-on-the-throne,"The Goddess on the Throne is a terracotta statuette found in 1956 in Pristina (in modern-day Kosovo), and it is on display at Kosovo Museum. It measures 7.3 inches in height and is estimated to be 6,000 years old. The Goddess on the Throne is a fine example of Vinča art, and there is no doubt that it was inspired by one of the culture’s deities. Vinča culture developed in Southeastern Europe during the Neolithic era, which started with the beginning of agriculture and ended in about 2,300 B.C., when the use of bronze began to spread. One striking discovery made by archaeologists is that Vinča society was far more complex and advanced than it was initially postulated. One of the signs that points to this conclusion are the unearthing of identical figurines, indicating that they had been produced in a proto-industrial fashion unbecoming of Neolithic society. The Goddess on the Throne is an exceedingly well-preserved statuette. Similar, but less well-preserved figures are on display at Kosovo Museum. The Goddess on the Throne and these other figurines do not exhibit obvious or exaggerated female physical traits as other statuettes of that period. In their place, what stands out are the odd-shaped heads. Angular and vaguely anthropomorphic, these heads may call to mind stereotypical depictions of extra-terrestrials. Additionally, the unexpected level of complexity and advancement of the Vinča society has convinced some that such a massive leap forward in human progress could only be explained by the intervention of a benevolent extra-terrestrial entity. The Goddess on the Throne has become the symbol of Pristina, and a stylized representation of the Goddess on the Throne has been adopted as the logo of the Kosovo Museum."
58,Narcis Hotel,"Štrpce, Kosovo","As of 2022, the 124 rooms of Kosovo ski resort remain empty.",https://www.atlasobscura.com/places/narcis-hotel,"Running along the Kosovo/North Macedonia border, the Šar Mountains offer the best opportunities for skiing in Kosovo. The Brezovica ski resort has been the most prominent center for winter sports in this area since 1954, but infrastructures supporting winter tourism have been neglected over the past 20 years—some would claim for much longer. A glimmer of hope that the area may undergo re-development work surfaced in 2014, but it quickly evaporated due to lack of funds. The high expectations undergirding the establishment of the Brezovica ski resort and the uncertainty around its future are two vastly divergent sets of ideas that intersect in the empty corridors of abandoned hotels in and around Brezovica. Narcis Hotel is by far the most conspicuous example of this state of affairs. With its imposing center block and two sloping wings evoking ski runs, Narcis Hotel is still the unmissable landmark that it was in 1973, when it first opened its doors to Yugoslavian skiers. However, unlike the polished image that Narcis Hotel once had, nowadays its exterior is neglected, and its iconic sign is in ruin. No one but the guards are to be seen on site, which explains why all the doors and windows are intact, and the hotel has not been broken in. If the situation for many a hotel in the area is grim, Narcis Hotel faces an additional difficulty, namely being located in the village of Strpce. In fact, the majority of inhabitants in Strpce are of Serbian origins, while the remaining population is made up of Kosovars. This resulted in businesses in the hands of ethnic Serbs being boycotted by tourists of Kosovar ethnicity. Following Kosovo’s declaration of independence in 2008 the situation worsened, and Narcis Hotel’s rate of occupancy fell to 5 percent. This was an untenable situation, and the managers had to make the drastic but inevitable decision to close down. Future prospects are equally bleak, as the ethnic makeup of the village makes the location highly volatile and unlikely to attract investors."
59,Memorial Complex Adem Jashari,"Prekaz, Kosovo",The site where the leader of the Kosovo Liberation Army was killed is now a memorial.,https://www.atlasobscura.com/places/memorial-complex-adem-jashari,"History books of the Balkans are peppered with accounts of conflict between the Albanian and the Serbian ethnicities. Unsurprisingly, words such as occupation or liberation are deployed regularly to describe the same events, depending on who is narrating. One such event is the recent Kosovo War, which started in February 1998 and ended in June 1999. The two main entities involved in the conflict were the forces of the Federal Republic of Yugoslavia on the Serbian side, and the Kosovo Liberation Army (KLA) on the Albanian side, with the latter trying to undermine the Federal Republic of Yugoslavia’s hold on Kosovo. Adem Jashari was one of the key founders of KLA. Jashari was born in 1955 in the village of Prekaz, which belongs to a region inhabited predominantly by ethnic Albanians while the territory was within the borders of Yugoslavia. In 1991, Jashari participated in an uprising against the Yugoslav authorities in Kosovo, and KLA was founded. Shortly after this, Jashari moved to Albania for military training. Upon his return to his hometown, he resumed his activities against the Yugoslav authorities, which eventually led to the Yugoslav forces surrounding his compound on March 5, 1998. More than 60 people were inside the compound, and they included many women and children. By the end of the battle, 28 militants and 30 civilians were killed. Among the militants was Adem Jashari, and most of the civilians that were killed were members of Jashari’s family. This was a turning point that marked the beginning of the Kosovo War.  An unintended consequence of the massacre of Prekaz was KLA’s immediate rise in popularity and respect among the Albanian communities and beyond. Most of the international community turned against the Federal Republic of Yugoslavia and eventually NATO got involved in the conflict. The Memorial Complex Adem Jashari consists of a garden, a museum, and two buildings. The garden is where the graves of the soldiers that died in the conflict can be found, constantly guarded by soldiers of the Kosovo Security Force (KSF).  The museum displays everyday objects that belonged to those who died during the clash on March 5, 1998, including the AK47 that Adem Jashari used on that fateful day. The two buildings belong to the compound where the fighting took place, and they are riddled with bullet holes and bigger cracks caused by heavy artillery.  These two buildings are surrounded by scaffolding so that visitors can appreciate the level of destruction caused by the battle without actually touching the buildings. Several other buildings in Prekaz village and the surrounding countryside bear the scars of this battle."
60,Ura e Terzive,"Bishtazhin, Kosovo",This 15th-century Ottoman bridge was modified to keep up with the changing course of the river Erenik.,https://www.atlasobscura.com/places/ura-e-terzive,"Ura e Terzive is an Ottoman stone bridge originally built in the 15th century in the proximity of the village of Bishtazhin, on the merchant route linking Turkey to Albania. It averages 3.5 meters in width, making it a one-lane bridge, even though nowadays it is rarely used, and only by pedestrians. Its 11 arches and 10 niches extend for over 190 meters, some of which span the river Erenik. In fact, the length of the bridge vastly exceeds that of the river.  This is due to changes in the course of the river Erenik through time, and the building of additional arches as a result. The current structure of the bridge came about from modifications made during the 18th century, while its polished appearance is due to restoration work carried out between 1982 and 1984. Apart from its historical importance, one interesting thing about Ura e Terzive is the inscriptions and drawings carved into its stones. Among the drawings are two pots or jars, and the Star of David. A Turkish inscription on the bridge testifies that the construction of the original bridge was commissioned by the Tailors’ Guild. This is why Ura e Terzive is locally referred to as the Tailors’ Bridge. By facilitating travels between the cities of Gjakova and Prizren, Ura e Terzive boosted local commerce and acquired utmost strategic importance. Nowadays, a new road connecting the two cities is located a few meters north of the bridge, making it, for all intents and purposes, a monument rather than a functional bridge."
61,The Corner House,"Riga, Latvia",A former Latvian headquarters of the brutal KGB secret police is now open as a grim reminder of their atrocities.,https://www.atlasobscura.com/places/the-corner-house-riga-latvia,"The lovely Art Nouveau building in center of the Latvian capital of Riga is actually a former KGB headquarters known as The Corner House, where political prisoners would be taken and subject to torture and worse. The city of Riga came under Soviet control in 1940, and the brutal new leaders brought with them the dreaded KGB secret police. Setting up shop in the Corner House, a secretive headquarters in the middle of the city, the KGB began summoning people to uncertain fates within the depths of the building. “Undesirable Elements” could be picked up for crimes as small as having “anti-Soviet conversations” or “instigating panic.” Many of the people captured by the KGB were executed in a killing area in the basement of the Corner House. Still others were crammed into cells with dozens of other prisoners, and made to sweat and go mad with thirst as the basement was kept at around 85 degrees. When the Nazis drove the Soviets out of Riga during World War II, they opened the doors of the secretive house to garner trust from the population by showing them the horrors the Soviets had created. After the war, the Germans left the country and the Soviets came right back, continuing the secret police practices as they had before. Latvia finally regained its independence in 1991, and the Corner House was simply closed off so that the country could move on. In 2012 some of the space was reopened as a museum and visitors can now see first hand, the secretive headquarters of the brutal KGB. Most of the official documents are still kept hidden away, but just being able to see the location itself is a haunting reminder of a dark period in the city’s history."
62,Riga Central Market,"Riga, Latvia","3,000 market stands in five former Zeppelin hangars.",https://www.atlasobscura.com/places/zeppelin-hangers-turned-markets,"At the turn of the 20th century, Zeppelins were seen as the transportation of the future. During that time, five giant hangars were created to house the German-made airships in the center of Riga, Latvia. When Zeppelins fell out of use, a move to convert the hangars was proposed, and the hangars were turned into Europe’s largest market bazaar. Built in stunning Neoclassical and Art Deco style, the market spans an area of 778,000 square feet and houses 3,000 trade stands. Farmers and craftsman set up hundreds of tables there hawking their wares, only slowed by the Nazi and Soviet occupations that came during the next 60 years. During the Nazi occupation, the market was almost completely shut down to house troops and supplies for the army. However, the market was re-invigorated under the Soviets, who took credit for the Riga Central Market, claiming it was a stunning example of a successful market in the Soviet Union."
63,Art Nouveau in Riga,"Riga, Latvia",Flamboyant architecture from the turn of 20th century.,https://www.atlasobscura.com/places/art-nouveau-riga,"Art Nouveau or Jugendstil (as it was known in German influenced countries) was a style in decorative arts which marked the turn of 20th century. It originated in France but quickly spread throughout Europe often merging with local artistic tendencies. It left a trail of iconic examples of design, from Paris metro stations and works of Victor Horta in Brussels to Helsinki main railway station and secessionist buildings in Budapest. Latvian capital boasts one the most extensive assortment of pure Art Nouveau buildings in Europe. There are over 800 Art Nouveau buildings scattered all over Riga’s historic center. The most striking examples can be found along Elizabetes Iela and Alberta. These include buildings by Mikhail Eisenstein the father of the famous director Sergei Eisenstein. Elizabetes 10a and 10b, Alberta 2, 2a, 4, 8 and 13."
64,The Three Brothers,"Riga, Latvia",The oldest housing complex in Riga is a mini timeline of architectural trends.,https://www.atlasobscura.com/places/the-three-brothers-riga-latvia,"According to local lore, the bond that binds these adjacent buildings, dubbed the “three brothers,” goes deeper than just their names and location. Supposedly, they were all built by descendants of the same family. Whether or not that is true, the “brothers” stand next to one another as a striking timeline of architectural trends. The first brother, which was built in the late 15th century, is among the oldest dwellings in all of Riga. The building features impressive Gothic and Dutch influences, all crowned by an intricate set of crow-stepped gables. It was originally used as one large room; a bustling little hub for manufacturing, trade, and everyday life. The middle brother is a pleasant shade of mellow yellow, though its pale color doesn’t mean it’s a structure to be overlooked. This building, arguably the architecturally grandest and most eye-catching one, was built in the mid-17th century. It, too, features Dutch influences thanks to the city’s trade relationship with the Netherlands. The house boasts intricate details including an engraving above the door that reads, “Soli Deo gloria!” (“Glory to God alone!” in Latin). The youngest brother came along shortly after the middle one. It was built in the later half of the 17th century and is the thinnest of the trio. Its green facade is allegedly meant to be a mask to protect the property from evil spirits. Amazingly, pedestrians are invited to step inside the historic dwelling, as it happens to house the Latvian Museum of Architecture. The museum gives visitors an inside look (literally) at the gorgeous house, as well as a peek at the blueprints and drafts of other architectural marvels throughout the city."
65,Bridge to Nowhere,"Irlavas pagasts, Latvia",A railway bridge leading nowhere stands lonely in the middle of a meadow.,https://www.atlasobscura.com/places/bridge-to-nowhere-latvia,"In the middle of the Latvian countryside is an unusual structure bound to pique the curiosity of anyone who happens upon it. The “Tilts uz nekurieni,” or “Bridge to Nowhere,” is a narrow-gauge railway bridge leading nowhere at all, surrounded on both ends by nothing but a lush green meadow. The concrete span across the Abava River, just 180 feet long (55 meters), was built in 1940, intended to be part of the new Tukums-Kuldiga rail line that was under construction. It was one of a number of ambitious projects planned by the newly independent and quickly developing republic of Latvia. Then World War II broke out. With the nation at war, the railway line was never finished. The high costs of civil engineering and construction are a major consideration in building any railroad. As these activities require specialized equipment and personnel, it is not uncommon to have these portions of a project completed ahead of the general track laying. The abandoned bridge still stands intact, a strange sight in the Irlavas village, near Sāti. To many locals, the lonely Bridge to Nowhere also represents a wartime memorial of sorts. It commemorates the failed effort made by the Germans to continue the bridge during the Nazi occupation of Latvia in the early 1940s. The unique structure may serve no practical purpose, but it belongs to Latvia alone."
66,Black Cat of Riga,"Riga, Latvia",A black cat protests the City Guild in Riga's Old Town.,https://www.atlasobscura.com/places/black-cat-on-roof,"Getting into the Great Guild in Latvia in the 14th century, was an incredibly huge honor. Similarly, getting snubbed from the Great Guild was a gigantic insult. One Riga local was so offended that he attached a black cat on top of his building so it would cast its evil glare upon the Guild for as long as the building would stand. With an arched back, the Black Cat of Riga seems ready to strike and clearly states the man’s displeasure at not getting admitted to the Guild. Obviously, the members of the guild hated the sculpture, and a fight between the man and the guild raged for months to come. Although an agreement was reached and the statue turned around, the Black Cat still sits on its perch in Old Town Riga.  Riga's Old Town, Meistaru street 10/12"
67,Liepaja Northern Forts,"Liepāja, Latvia",These crumbling Latvian forts make for some haunting seaside ruins.,https://www.atlasobscura.com/places/liepaja-northern-forts,"Crumbling away on the edge of the Latvian coast, a row of abandoned concrete bunkers have formed a lovely line of ruins that harken back to a fort built by Tzarist Russia. When they were created, the ruins encircled the entire city of Liepaja. The Northern Forts were part of Liepaja’s central fortress and they were built between the 19th and 20th century to provide shelter to the naval base. A line of outer fortifications surrounded the whole city. However, in 1908, after less than ten years of construction, the whole fortress was considered a strategic misstep and it was abandoned. There were attempts to blow up parts of it, but destroying such robust fortifications is no easy feat, and the remains still stand today. Surprisingly, the efforts to destroy the forts had the effect of creating haunting seaside ruins. Each little stone bunker holds its own secrets. Achieving what man’s powerful explosives could not, the sea has started to take its toll and part of the Northern Forts complex has collapsed to the waterline. This has made it a popular place for youngsters to climb in and around these broken bunkers. The bunkers run along the coast and can be accessed via Krasta street, Koknese street or Jatnieku street."
68,Ligatne Secret Soviet Bunker,"Ligatne, Latvia",A top secret Cold War bunker hidden beneath a Latvian spa facility is now open for tours.,https://www.atlasobscura.com/places/ligatne-secret-soviet-bunker,"Deep beneath Latvia’s “Ligatne” rehabilitation centre, a sort of spa centre, is a well-equipped facility that was built to protect the Soviet political elite in case of a less-relaxing nuclear attack. Planning for the hidden stronghold actually began in the late 1960s, but the Soviet facility was not completed until 1982. A sanatorium was built as though nothing was unusual about it, but unbeknownst even to the workers at the rehabilitation center, the site held a number of secrets. Buried 30 feet beneath the building above, the bunker was a powerful, autonomous, self-sustaining structure filled with state-of-the-art-of-the-day equipment and supplies. The 213,000 square foot hideout could support 250 people for up to three months in the case of a nuclear attack, and was protected beneath layers of dirt, cement, and metal plate. The plan was for the Soviet leadership in Latvia to retreat to the bunker should anyone drop the bomb. The bunker wasn’t the only secret on the grounds either. A shallow reflecting pool in front of the spa building was actually a hidden helipad, and another was camouflaged as a basketball court. The Soviets called the secret redoubt, Pansionat, The Pention House. Since it was a military defense structure, the bunker reverted to the Latvian Ministry of Defense after the Soviet regime ended. When Latvia joined NATO, the secret defense did not measure up to NATO s standards and the site was taken out of military control. Thanks to this abandonment by the military, the bunker was left in its original condition, with all of the old equipment and decoration that it originally had. The former secret facility was opened to the public in 2003, and can now enter the strange Stalinist halls that look like they have not only been protected from radiation, but time as well. The bunker is up in the forested area of Skalupes."
